username,tweet_text,tweet_raw,date,happy,angry,surprise,sad,fear,afinn,bing,sid,bertweet,bertweet_confidence
TrueNorthCentre,an economist with scotiabank has blasted prime minister justin trudeaus immigration targets saying trudeaus immigration levels are causing high inflation levels tune into the daily brief with cosmindzs and newworldhominin  tncnews20230816dbtrude,An economist with Scotiabank has blasted Prime Minister Justin Trudeau’s immigration targets saying Trudeau’s immigration levels are causing high inflation levels.Tune into The Daily Brief with @cosminDZS and @NewWorldHominin !tnc.news/2023/08/16/db-trude…,aug 16 2023  500 pm utc,0.0,0.0,0.0,0.0,1.0,0,-1,0.0,-1,0.6163210868835449
ScotiabankArena,get your limited edition edgeratedr x mapleleafs shirt exclusively at wwe smackdown at scotiabank arena and at the shoprsapparel wwe pop up shop beginning at 12pm on friday august 18th,Get your limited edition @EdgeRatedR x @MapleLeafs shirt exclusively at @WWE Smackdown at Scotiabank Arena and at the @ShopRSApparel WWE Pop Up Shop beginning at 12pm on Friday August 18th! 💙,aug 16 2023  406 pm utc,0.0,0.0,1.0,0.0,0.0,-1,-1,-0.2263,0,0.9067230224609375
Smilejamtvj,tonya russell head of marketing caribbean north and central scotiabank discusses their longtime support of sports across the region and in jamaica,Tonya Russell Head of Marketing Caribbean North and Central Scotiabank discusses their long-time support of sports across the region and in Jamaica.,aug 16 2023  107 pm utc,0.0,0.0,0.33,0.0,0.67,2,1,0.4019,0,0.5530609488487244
TrueNorthCentre,an economist with scotiabank has blasted prime minister justin trudeaus annual target to bring in 500000 immigrants into canada each year as one of the pressures leading to inflation tncnews20230815trudeau,An economist with Scotiabank has blasted Prime Minister Justin Trudeau’s annual target to bring in 500000 immigrants into Canada each year as one of the pressures leading to inflation.tnc.news/2023/08/15/trudeau-…,aug 16 2023  405 am utc,0.0,0.0,0.0,0.5,0.5,0,0,-0.3182,-1,0.6849925518035889
LeafsAlumni,tributes for bob baun outside scotiabank arena this afternoon leafsforever,Tributes for Bob Baun outside Scotiabank Arena this afternoon#LeafsForever,aug 16 2023  954 pm utc,0.0,0.0,0.0,0.0,0.0,0,0,0.0,0,0.8208246827125549
CandiceMalcolm,trudeaus record immigration targets contributing to inflation scotiabank economist tncnews20230815trudeau via truenorthcentre,Trudeau’s record immigration targets contributing to inflation: Scotiabank economist tnc.news/2023/08/15/trudeau-… via @truenorthcentre,aug 17 2023  108 am utc,0.0,0.0,0.0,0.0,1.0,0,0,0.0,-1,0.5295143723487854
ARichCulture,role marketing manager caribbean north company yall fav bank scotiabank new providence  hybrid view job here linkedincomjobsview36961 to apply submit cv via email to hrbahamasscotiabankcom by august 31st 2023 include the position as the subject,Role: Marketing Manager Caribbean NorthCompany: Yall fav bank Scotiabank📍New Providence + HybridView Job Here: linkedin.com/jobs/view/36961…To apply submit C.V. via email to: hrbahamas@scotiabank.com by August 31st 2023. Include the position as the subject,aug 17 2023  301 am utc,0.0,0.0,0.0,0.0,1.0,0,2,0.4588,0,0.945106029510498
OntarioFarms,the countdown is on for ofa members near and surrounding shedden join us on friday for a member appreciation bbq cohosted by our benefit partner scotiabank stop by to meet your local ofa representatives and enjoy a complimentary lunch ontag,🚨The countdown is on for OFA members near and surrounding Shedden! Join us on Friday for a Member Appreciation BBQ co-hosted by our benefit partner@scotiabank. Stop by to meet your local OFA representatives and enjoy a complimentary lunch.🍔🌭#ontag,aug 16 2023  416 pm utc,0.33,0.0,0.0,0.0,0.67,6,3,0.9081,1,0.8310502767562866
itsprincehakeem,if you see at scotiabank arena for sza and drake back to back nights it wasnt me lol,If you see at scotiabank arena for Sza and Drake back to back nights it wasn’t me lol,aug 17 2023  227 am utc,0.0,0.0,0.0,0.0,0.0,3,0,-0.3252,0,0.663486659526825
yobrxxzy,wizkidayo mlle stadium arenas  auditorium tours 2023  tottenham stadium   80k montreal qc ca centre bell   21k washing dc capital one arena   20k scotiabank arena   19k barclays center arena   19k kia forum   175k state farm arena us,.@wizkidayo “MLLE” Stadium Arenas & Auditorium tours 2023 🏟️•Tottenham stadium 🇬🇧 — 80K✅•Montreal QC CA Centre Bell 🇨🇦 — 21K•Washing DC capital one Arena 🇺🇸 — 20K•Scotiabank Arena 🇨🇦 — 19K•Barclays center Arena 🇺🇸 — 19K•Kia Forum 🇺🇸 — 17.5K•State Farm Arena US…,aug 12 2023  1047 am utc,0.0,0.0,0.0,0.33,0.67,0,0,-0.6369,0,0.967549204826355
araghougassian,today i learnt that scotiabank arena an event center in toronto that can hold 20000 people is cooled by near freezing deep lake water from the closeby lake ontario this system reduce energy needs by 70 compared to traditional ac canadian engineering is so based,today i learnt that scotiabank arena an event center in toronto that can hold 20000 people is cooled by near freezing deep lake water from the close-by lake ontariothis system reduce energy needs by 70% compared to traditional AC!canadian engineering is so based 🍁,aug 15 2023  1145 pm utc,0.2,0.0,0.0,0.4,0.4,0,-1,0.1779,0,0.917183518409729
Dark_Emperorr,bwoyatingzafterdark hold on i just realized u said u did something with scotiabank how we didnt know excuse me video link site,#bwoyatingzafterdark hold on I just realized u said u did something with ScotiaBank. How we didnt know? Excuse me... video link site.,aug 17 2023  148 am utc,0.0,0.0,0.0,1.0,0.0,-1,-1,-0.0572,0,0.8233480453491211
roxieyourdream,apple pay is down right now,Apple Pay is down right now.,aug 17 2023  145 am utc,0.0,0.0,0.0,0.0,0.0,-1,1,-0.1027,-1,0.9669575095176697
GravitasMSN,add scotiabank shares to that story horror movie plot an investor buys a preferred share etf and holds for 10 years bnsca theglobeandmailcominvestin,Add Scotiabank shares to that story...Horror movie plot: An investor buys a preferred share ETF and holds for 10 years$BNS.catheglobeandmail.com/investin…,aug 17 2023  128 am utc,0.25,0.0,0.25,0.25,0.25,2,-1,-0.0772,0,0.7870833873748779
uniondesign,the reason i suspect its a cached token is because adding a new scotiabank cc that had never been added to any of my devices before worked perfectly first try the card that tortured me for 2 hours was a card that had previous been added but got deleted due to a appleid signout,The reason I suspect it’s a cached token is because adding a new Scotiabank CC that had NEVER been added to ANY of my devices before worked perfectly first try. The card that tortured me for 2 hours was a card that had previous been added but got deleted due to a AppleID sign-out,aug 17 2023  122 am utc,0.0,0.0,0.0,0.67,0.33,-2,0,-0.0772,0,0.6263553500175476
uniondesign,iphone wallet app says try again  iphone watch app says already in wallet nope  adding on watch say already in wallet nope  adding on macbook says call bank because cs will be so helpful   adding on ipad actually works w scotiabank app verification,- iPhone Wallet app says “try again”- iPhone Watch app says “already in wallet” (nope)- Adding on Watch say “already in wallet” (nope)- Adding on MacBook says call bank (because CS will be so helpful) 🤣🤣🤣- Adding on iPad actually… works?! w/ Scotiabank app verification,aug 17 2023  117 am utc,0.12,0.0,0.25,0.38,0.25,2,2,0.5598,0,0.6526445746421814
uniondesign,scotiabank you really need to fix all your apple pay verification issues this has been going on since february unacceptable i just spent 2 hours trying to add a cc to my watch i actually got it added once but on ipad it said it was unavailable so i removed it from ipad,@scotiabank you really need to fix all your Apple Pay verification issues. This has been going on since February. Unacceptable. I just spent 2 hours trying to add a CC to my watch. I actually got it added once. But on iPad it said it was unavailable. So I removed it from iPad.,aug 17 2023  117 am utc,0.0,0.0,0.33,0.67,0.0,-3,-3,-0.296,-1,0.969965398311615
ScotiabankHelps,hello tjr thank you for reaching out to scotiabank canadas twitter support page we are happy to assist with your inquiries regarding select pay please connect with us via dm kind regards,Hello TJR thank you for reaching out to Scotiabank Canadas Twitter support page.We are happy to assist with your inquiries regarding Select Pay. Please connect with us via DM.Kind Regards.,aug 17 2023  113 am utc,0.5,0.0,0.0,0.25,0.25,10,3,0.9325,1,0.9662802219390869
GoldRheaa,always two cases i will always remember the yahoo ceo and scotiabank ja bill clarke im old lol they were held in high esteem until they were dismissed,Always. Two cases I will always remember- the Yahoo CEO and Scotiabank (Ja) Bill Clarke ...Im old lol. They were held in high esteem until they were dismissed.,aug 17 2023  100 am utc,0.5,0.0,0.0,0.0,0.5,3,0,0.4215,0,0.6441968083381653
ScotiabankArena,twice at scotiabank arena is a reason to celebrate  inspired by their song moonlight sunrise we gave jypetwice matching necklaces depicting two moon phases the first is the moon phase on their debut date the second features the moon on their scotiabank arena debut,#TWICE at Scotiabank Arena is a reason to celebrate 💖Inspired by their song MOONLIGHT SUNRISE we gave @JYPETWICE matching necklaces depicting two moon phases. The first is the moon phase on their debut date the second features the moon on their Scotiabank Arena debut 🌙,jul 5 2023  1201 am utc,0.33,0.0,0.0,0.33,0.33,5,1,0.7845,1,0.981665313243866
cj_prin,very specific tiff related question is this year the first time a wavelengths feature is playing in the imax theatre at scotiabank,Very specific TIFF related question: Is this year the first time a Wavelengths feature is playing in the IMAX theatre at Scotiabank?,aug 17 2023  1223 am utc,0.0,0.33,0.0,0.0,0.67,0,0,0.2023,0,0.9682138562202454
JoeTheberge,trudeaus record immigration targets contributing to inflation scotiabank economist tncnews20230815trudeau via truenorthcentre,Trudeau’s record immigration targets contributing to inflation: Scotiabank economist tnc.news/2023/08/15/trudeau-… via @truenorthcentre,aug 17 2023  1215 am utc,0.0,0.0,0.0,0.0,1.0,0,0,0.0,-1,0.5295143723487854
mullie0907,scotiabank why are you bank machine so bad at accepting cash what joke go back to envelopes also branches close at 5 come on think it is time to make a change,@scotiabank why are you bank machine so bad at accepting cash. What joke!!! Go back to envelopes. Also branches close at 5 come on. Think it is time to make a change.,aug 17 2023  1211 am utc,0.33,0.0,0.0,0.17,0.5,0,-2,-0.1097,-1,0.9761437177658081
BNNBloomberg,scotiabank has launched the first home savings account fhsa making it the latest canadian bank to offer the new banking option geared to help canadians enter the redhot housing market bitly47dyq2o,Scotiabank has launched the First Home Savings Account (FHSA) making it the latest Canadian bank to offer the new banking option geared to help Canadians enter the red-hot housing market. bit.ly/47Dyq2O,aug 16 2023  1145 pm utc,0.0,0.0,0.0,0.29,0.71,3,1,0.4939,1,0.8044960498809814
RomiosGold,copper  scotiabank analyst sees big second half ahead for copper mining stocks mining theglobeandmailcominvestin rg rmiof,#Copper - Scotiabank analyst sees big second half ahead for copper mining stocks #Mining theglobeandmail.com/investin… $RG $RMIOF,aug 16 2023  127 pm utc,0.0,0.0,0.0,0.0,1.0,1,0,0.0,1,0.6609529256820679
eth_88888888,canadian cpi estimates for tomorrow moodys 29 rbc 29 national bank 3 gurgavin capital 3 scotiabank 3 bmo 31 cibc 31 td 31 median 3 everyonen hardknocks loveislandusa snapchat,CANADIAN CPI ESTIMATES FOR TOMORROW MOODY’S 2.9% RBC 2.9% NATIONAL BANK 3% GURGAVIN CAPITAL 3% SCOTIABANK 3% BMO 3.1% CIBC 3.1% TD 3.1% MEDIAN 3%#EveryoneN #HardKnocks #LoveIslandUSA #Snapchat,aug 16 2023  1140 pm utc,0.25,0.0,0.0,0.25,0.5,0,0,0.0,0,0.9538493156433105
ScotiabankArena,introducing a brand new membersonly allinone entertainment experience at scotiabank arena with exclusive access to all leafs and raptors games including 1st round playoffs,Introducing a brand new members-only all-in-one entertainment experience at Scotiabank Arena with exclusive access to all Leafs and Raptors games (including 1st round playoffs).,aug 15 2023  515 pm utc,0.0,0.0,0.0,1.0,0.0,2,0,0.5106,1,0.6269534230232239
DeanBercier,exciting news for firsttime homebuyers scotiabank launched its first home savings account fhsa  contribute up to 8000year max 40000 get 500 interest till jan 31 2024 more details here scotiasocialme6xcpr,🏡 Exciting news for first-time homebuyers! Scotiabank launched it’s First Home Savings Account (FHSA) 🌟 Contribute up to $8000/year max $40000. Get 5.00% interest till Jan 31 2024. More details here. scotiasocial.me/6xcpr,aug 16 2023  1111 pm utc,0.25,0.0,0.0,0.5,0.25,5,2,0.7717,1,0.9797275066375732
jcpglickwebber,yeah i have to leave early on thursday will try to get into one of the public screenings of hamaguchi before i try sprinting from the lightbox to the scotiabank,Yeah I have to leave early on Thursday. Will try to get into one of the public screenings of Hamaguchi before I try sprinting from the Lightbox to the Scotiabank.,aug 16 2023  1106 pm utc,0.0,0.0,0.0,0.0,0.0,0,0,0.25,0,0.8081273436546326
hockey_tr,day 3 at our calgary flames alumni hockey school kris kolanos and rhett warrener were out for our 3 sessions today and signed lots of a autographs as well alumniflames opaofgreece scotiabank foothillscreamery nhlflames nhlalumniassociation hockeyschools,Day 3 at our Calgary Flames Alumni Hockey School. Kris Kolanos and Rhett Warrener were out for our 3 sessions today and signed lots of a autographs as well. @AlumniFlames @OPAofGreece @scotiabank @foothillscreamery @NHLFlames @nhlalumniassociation #hockeyschools,aug 16 2023  1104 pm utc,0.25,0.25,0.0,0.25,0.25,0,1,0.2732,1,0.7197383642196655
__Emilykelly_,selling of my 2 floor drake tour tickets for oct7scotiabank arena 40 bay street waytoronto onm5j 2x2 section 302 row 6 hmu if interested in them,Selling of my 2 floor drake tour tickets for Oct7@scotiabank Arena 40 Bay Street wayToronto ONM5J 2X2Section 302 ROW 6 .HMU if interested in them,aug 16 2023  1059 pm utc,0.33,0.0,0.33,0.33,0.0,2,0,0.4019,0,0.9057896733283997
wesgroup,thank you to our river district partners and sponsors river district energy prosperacu orangetheory scotiabank ewinebc signage sponsor vancouver sign group for more information visit riversidestreetvibeca,Thank you to our River District partners and sponsors.River District Energy@ProsperaCU@orangetheory@scotiabank@EWineBCSignage Sponsor: Vancouver Sign Group.For more information visit RiversideStreetVibe.ca.,aug 16 2023  1035 pm utc,0.0,0.0,0.33,0.0,0.67,2,1,0.5574,1,0.9726658463478088
thesavingstech,scotiabank theatre west edmonton mall,Scotiabank theatre west Edmonton mall,aug 16 2023  1017 pm utc,0.0,0.0,0.0,0.0,1.0,0,0,0.0,0,0.9460930824279785
greg_scott84,4 this app was developed in cooperation with canadas top banks bmo cibc desjardins national bank rbc scotiabank and td,4) This app was developed in cooperation with Canadas top banks: BMO CIBC Desjardins National Bank RBC Scotiabank and TD.,mar 5 2023  821 pm utc,0.2,0.0,0.2,0.0,0.6,2,1,0.2023,0,0.5825811624526978
canadian_ivy,i love how intimate budweiser stage is whenever 5sos come to toronto but i really think its time they play scotiabank arena,i love how intimate budweiser stage is whenever 5sos come to toronto but i really think it’s time they play scotiabank arena,aug 16 2023  1013 pm utc,0.5,0.0,0.0,0.0,0.5,3,2,0.6908,1,0.9895706176757812
TribeNetwork_ca,fyi tickets for the 75th anniversary celebration of the nova scotia cooperative council featuring a conversation with michelle obama presented by east coast credit union in halifax will go on sale august 17th at 10 am via the scotiabank centre website,🚨 FYI: Tickets for the 75th Anniversary Celebration of the Nova Scotia Co-operative Council featuring a conversation with Michelle Obama presented by East Coast Credit Union in #Halifax will GO ON SALE AUGUST 17TH AT 10 AM via the Scotiabank Centre website.,aug 16 2023  1007 pm utc,0.0,0.0,0.0,0.0,1.0,0,2,0.5267,0,0.7782638669013977
Stampthumper,trudeaus record immigration targets contributing to inflation scotiabank economist tncnews20230815trudeau via truenorthcentre,Trudeau’s record immigration targets contributing to inflation: Scotiabank economist tnc.news/2023/08/15/trudeau-… via @truenorthcentre,aug 16 2023  1006 pm utc,0.0,0.0,0.0,0.0,1.0,0,0,0.0,-1,0.5295143723487854
CopperBullish,copper  scotiabank analyst sees big second half ahead for copper mining stocks mining theglobeandmailcominvestin,#Copper - Scotiabank analyst sees big second half ahead for copper mining stocks #Miningtheglobeandmail.com/investin…,aug 15 2023  821 pm utc,0.0,0.0,0.0,0.0,1.0,1,0,0.0,1,0.6434422731399536
globeandmail,scotiabank hires new yorkbased investment banker from credit suisse theglobeandmailcombusiness,Scotiabank hires New York-based investment banker from Credit Suisse theglobeandmail.com/business…,aug 16 2023  936 pm utc,0.0,0.0,0.0,0.0,1.0,0,0,0.3818,0,0.9346929788589478
Jack_VE4JRG,bank of canada losing the fight against inflation says scotiabank economist theepochtimescomworldbank,Bank of Canada ‘Losing the Fight’ Against Inflation Says Scotiabank Economist theepochtimes.com/world/bank…,aug 16 2023  940 pm utc,0.0,0.0,0.0,0.67,0.33,-4,-1,-0.6369,-1,0.684649646282196
Danskine1,trudeaus record immigration targets contributing to inflation scotiabank economist tncnews20230815trudeau via truenorthcentre,Trudeau’s record immigration targets contributing to inflation: Scotiabank economist tnc.news/2023/08/15/trudeau-… via @truenorthcentre,aug 16 2023  931 pm utc,0.0,0.0,0.0,0.0,1.0,0,0,0.0,-1,0.5295143723487854
LarryNeufeldSK,in about 5 years fossilfuels will be reaching their peak this is probably one of the worst times to invest in building a pipeline note to rbc bmo scotiabankcibc  td_canada get ready to have stranded investments greenpeaceca renewables oilpricecomenergyenergyg,In about 5 years #Fossilfuels will be reaching their peak. This is probably one of the worst times to invest in building a #pipeline. Note to @RBC @BMO @scotiabank@cibc & @TD_Canada get ready to have stranded investments @GreenpeaceCA #renewables oilprice.com/Energy/Energy-G…,aug 16 2023  920 pm utc,0.2,0.0,0.0,0.2,0.6,-2,0,-0.2023,-1,0.9680120944976807
DeMureDeb,trudeaus record immigration targets contributing to inflation scotiabank economist tncnews20230815trudeau via truenorthcentre,Trudeau’s record immigration targets contributing to inflation: Scotiabank economist tnc.news/2023/08/15/trudeau-… via @truenorthcentre,aug 16 2023  916 pm utc,0.0,0.0,0.0,0.0,1.0,0,0,0.0,-1,0.5295143723487854
day_leap,actually it seems the extension was just for the 70mm imax version not sure why scotiabank theatre keeps it too but as far as i can tell its canadas only true imax screen in a cineplex ie not museumscience center thats not doing 70mm so maybe theyre just not bothering,Actually it seems the extension was just for the 70mm IMAX version. Not sure why Scotiabank Theatre keeps it too but as far as I can tell its Canadas only true IMAX screen in a cineplex (i.e. not museum/science center) thats NOT doing 70mm so maybe theyre just not bothering.,aug 16 2023  906 pm utc,0.0,0.0,1.0,0.0,0.0,0,-1,0.718,0,0.877711832523346
crflames,this is from a real expert an economist with scotiabank has blasted prime minister justin trudeaus annual target to bring in 500000 immigrants into canada each year as one of the pressures leading to inflation this also affects housing carbon tax raises prices of,This is from a real expert!An economist with Scotiabank has blasted Prime Minister Justin Trudeaus annual target to bring in 500000 immigrants into Canada each year as one of the pressures leading to inflation. This also affects housing!! Carbon tax raises prices of…,aug 16 2023  901 pm utc,0.0,0.0,0.0,0.67,0.33,0,0,-0.3182,0,0.49253591895103455
scotiabank,theres a home out there just for you one of lifes biggest and most exciting moments is owning your first home get there with the first home savings account fhsa the fhsa is now available at scotiabank,There’s a home out there just for you.One of life’s biggest and most exciting moments is owning your first home. Get there with the First Home Savings Account (FHSA).The FHSA is now available at Scotiabank.,aug 16 2023  900 pm utc,0.0,0.0,0.0,0.57,0.43,3,3,0.5413,1,0.9917663931846619
Sharon01881196,mr moore makes so much sense i didnt know who he was ive been living under a mushroom but i saw his interview with carole taylor on bc legends so good,Mr. Moore makes so much sense. I didnt know who he was (Ive been living under a mushroom) but I saw his interview with Carole Taylor on B.C. Legends. So good.,aug 16 2023  843 pm utc,0.0,0.0,0.0,0.5,0.5,3,1,0.7279,1,0.9801948070526123
Gbernard14,scotiabank,Scotiabank:,aug 16 2023  836 pm utc,0.0,0.0,0.0,0.0,0.0,0,0,0.0,0,0.9118030667304993
RuralGrubby,trudeaus record immigration targets contributing to inflation scotiabank economist tncnews20230815trudeau via truenorthcentre,Trudeau’s record immigration targets contributing to inflation: Scotiabank economist tnc.news/2023/08/15/trudeau-… via @truenorthcentre,aug 16 2023  831 pm utc,0.0,0.0,0.0,0.0,1.0,0,0,0.0,-1,0.5295143723487854
BobbiMenard,hey scotiabank telling a teen customer that you dont know how it works but the kid should google how to access their  while on student exchange in japan isnt a great look,Hey @scotiabank telling a teen customer that you dont know how it works but the kid should Google how to access their $ while on student exchange in Japan isnt a great look,aug 16 2023  812 pm utc,0.4,0.0,0.2,0.2,0.2,3,2,-0.6642,-1,0.9461718201637268
BinkyPaulBeast,scotiabank can you guys have a branch in halifax thats opened past 5pm its legit the only reason i want to switch banks its impossible to get to the bank during the work day pathetic,@scotiabank can you guys have a branch in halifax thats opened past 5pm?? Its legit the only reason I want to switch banks. Its impossible to get to the bank during the work day. Pathetic.,aug 16 2023  811 pm utc,0.11,0.0,0.0,0.33,0.56,-1,-1,-0.5267,-1,0.9523077011108398
jessehawken,even in regular format at scotiabank its deadsville theyre holding on to oppy,Even in regular format at Scotiabank it’s DEADSVILLE (they’re holding on to Oppy),aug 16 2023  802 pm utc,0.0,0.0,0.0,0.0,0.0,0,0,0.0,0,0.9071958661079407
diana_lockie,coming from scotiabank who closed peoples bank accounts because of justin and his idiots really thats rich,Coming from scotiabank who closed peoples bank accounts because of Justin and his Idiots? Really thats rich!,aug 16 2023  756 pm utc,0.2,0.0,0.2,0.0,0.6,2,0,0.5965,-1,0.9768109321594238
FrutaGuayaba,scotiabankhelps how can we raise service gaps at scotiabank thanks,@ScotiabankHelps how can we raise service gaps at @scotiabank?Thanks.,aug 16 2023  745 pm utc,0.0,0.0,0.0,0.0,0.0,2,0,0.4404,1,0.5482499599456787
ZaidBaba9,if anyone need tickets for drake at scotiabank arena toronto canada concert please please let me know im selling my 2 for decent price,IF ANYONE NEED TICKETS FORDRAKE AT SCOTIABANK ARENA TORONTO CANADA CONCERTPLEASE PLEASE LET ME KNOW I’M SELLING MY 2× FOR DECENT PRICE,aug 16 2023  728 pm utc,0.0,0.0,1.0,0.0,0.0,2,1,0.5574,0,0.7389689087867737
JMatch9,ya think him  freeland too stupid  dont care to acknowledge trudeaus record immigration targets contributing to inflation scotiabank economist tncnews20230815trudeau via truenorthcentre,Ya think???? Him & Freeland too stupid & don’t care to acknowledge!!Trudeau’s record immigration targets contributing to inflation: Scotiabank economist tnc.news/2023/08/15/trudeau-… via @truenorthcentre,aug 16 2023  726 pm utc,0.0,0.0,0.0,0.0,1.0,0,-1,-0.7208,-1,0.948623538017273
janetripp_,bank of canada losing the fight against inflation says scotiabank economist theepochtimescomworldbank,Bank of Canada ‘Losing the Fight’ Against Inflation Says Scotiabank Economist theepochtimes.com/world/bank…,aug 16 2023  725 pm utc,0.0,0.0,0.0,0.67,0.33,-4,-1,-0.6369,-1,0.684649646282196
Lukathor,a scotiabank economist pins inflation on jolsons runaway immigration tncnews20230815trudeau,A Scotiabank economist pins inflation on Jolsons runaway immigration.tnc.news/2023/08/15/trudeau-…,aug 16 2023  724 pm utc,0.0,0.0,0.0,0.5,0.5,0,-1,0.0,0,0.8809424638748169
PARDONyurfrench,scotiabanks hold music pisses me off maybe its because i am forced to listen to it and knowing that once it stops someone is going to give me some bull shit run around and not be able to help me,Scotiabanks hold music pisses me off. Maybe its because I am forced to listen to it and knowing that once it stops someone is going to give me some bull shit run around and not be able to help me,aug 16 2023  724 pm utc,0.0,0.25,0.25,0.0,0.5,-4,-1,-0.7845,-1,0.9789922833442688
DailyDarkWeb,mexico   allegedly database of scotiabank mexico is leaked threat actor claims to have leaked 141050 lines of data darkweb,#Mexico 🇲🇽 - Allegedly Database of Scotiabank Mexico is leakedThreat actor claims to have leaked 141050 lines of data.#DarkWeb,aug 14 2023  130 pm utc,0.0,0.0,0.33,0.0,0.67,-4,-1,-0.7906,-1,0.8326188325881958
tradwifeobama,scotiabank will not survive my wrath,Scotiabank will not survive my wrath,aug 16 2023  713 pm utc,0.0,0.0,0.0,0.0,1.0,0,-1,0.0,-1,0.9664342999458313
