username,tweet_text,date,happy,angry,surprise,sad,fear,afinn,bing,sid,bertweet,bertweet_confidence
JShamess,does this mean you want to buy land with bitcoin,jul 31 2023  1147 pm utc,0.0,0.0,0.0,0.0,1.0,1,0,0.0772,0,0.9627137184143066
JShamess,thanks brian certainly is a weird market with such upside down housing supply more than most,jul 31 2023  1109 pm utc,0.0,0.0,0.0,0.0,1.0,0,-1,0.5574,-1,0.7656128406524658
Snowball_Dev,great post and even harder to understand  sell is montreal right rullierjoe,jul 31 2023  1104 pm utc,1.0,0.0,0.0,0.0,0.0,3,2,0.6249,0,0.47428518533706665
LLS06289727,mind the gap canada is falling behind the standardofliving curve marc ercolao economist  economicstdcomcafalling via td_economics  just another of the many reasons we need to vote these clowns out of office asap,jul 31 2023  610 pm utc,0.0,0.0,0.67,0.33,0.0,-1,-1,-0.1531,-1,0.9710491299629211
emily_crober,mind the gap canada is falling behind the standardofliving curve marc ercolao economist  economicstdcomcafalling via td_economics,jul 30 2023  115 pm utc,0.0,0.0,1.0,0.0,0.0,-1,-1,-0.1531,0,0.6832515597343445
Barbara61353150,thanks to the mess seanfraser has made of immigration thanks to ongoing immigration surge could widen housing shortfall  lead to higher neutral interest rate td economics  spencer fernando spencerfernandocom202307,jul 30 2023  1208 am utc,0.14,0.14,0.0,0.29,0.43,3,0,0.743,-1,0.6874551773071289
AlbertaBound9,fernando the recent report by td economics points out that social programs like healthcare are also being strained  cdnpoli economicstdcomcabalancin,jul 29 2023  619 pm utc,0.0,0.0,0.33,0.0,0.67,2,0,-0.0516,-1,0.6733868718147278
AlbertaBound9,fernando a report by td economics titled balancing canadas pop in population  asks whether canadas response to our aging population has gone too far too fast  as noted in the report ongoing immigration increases could widen the housing shortfall and lead to interest,jul 29 2023  617 pm utc,0.14,0.14,0.0,0.14,0.57,1,2,0.4588,0,0.8225315809249878
James_Mc666,canada  the cost of the immigration boom according to a new td economics report canadas historic population growth risks exacerbating the countrys biggest problem areas the brakes need pumping when it comes to immigration readthepeakcomstories072,jul 29 2023  514 pm utc,0.0,0.0,0.33,0.0,0.67,-2,-1,-0.296,-1,0.6520787477493286
Pdaug44,ongoing immigration surge could widen housing shortfall  lead to higher neutral interest rate td economics spencerfernandocom202307,jul 29 2023  435 pm utc,0.25,0.0,0.0,0.25,0.5,1,1,0.4588,0,0.8159886598587036
57Habsfan,ongoing immigration surge could widen housing shortfall  lead to higher neutral interest rate td economics  spencerfernandocom202307 via spencerfernando,jul 29 2023  247 pm utc,0.25,0.0,0.0,0.25,0.5,1,1,0.4588,0,0.8305913209915161
schtaunk,rongway tiff  good question,jul 29 2023  227 pm utc,0.0,0.5,0.0,0.0,0.5,3,1,0.4404,1,0.8879512548446655
WSB_redditor,why does tiff say the opposite nacroix immigrationcaboostimmigra,jul 29 2023  226 pm utc,0.0,1.0,0.0,0.0,0.0,0,0,0.0,0,0.8996925950050354
AverageCdnTy,you might not know it but canada has a growth problem  what looks like a solid economic recovery from the pandemic actually masks an underperformance in standard of living that is among the worst of advanced economies says a new report by td economics  financialpostcomnewscanad,jul 29 2023  118 pm utc,0.0,0.0,0.0,0.5,0.5,2,3,-0.0387,-1,0.8726673126220703
dima_nomad,td economics is gently questioning current immigration targets mentioning housing health care impact on inflation  the population surge is a textbook demand shock  economicstdcomcabalancin cdnpoli cdnecon,jul 28 2023  1237 pm utc,0.0,0.14,0.14,0.29,0.43,-2,-1,0.4019,0,0.8382974863052368
LindaAl58104067,ongoing immigration surge could widen housing shortfall  lead to higher neutral interest rate td economics  spencerfernandocom202307 via spencerfernando,jul 29 2023  526 am utc,0.25,0.0,0.0,0.25,0.5,1,1,0.4588,0,0.8305913209915161
Issherai,well canada is far more rate sensitive than the us and the us is pushing rates until the labour market or something else gives way  so idk who ever thought canada was going to avoid a recession,jul 29 2023  124 am utc,0.0,0.0,0.0,0.0,1.0,-3,1,-0.5812,0,0.7629926800727844
Jack_VE4JRG,ongoing immigration surge could widen housing shortfall  lead to higher neutral interest rate td economics  spencerfernandocom202307 via spencerfernando,jul 29 2023  110 am utc,0.25,0.0,0.0,0.25,0.5,1,1,0.4588,0,0.8305913209915161
HandlerCND,canadas immigration strategy could widen housing shortfall by 500k units in 2 years td economics  video canadabusiness economy canada james orlando director and senior economist at td economics joins bnn bloomberg to discuss their report examines dlvritsstxyx,jul 29 2023  109 am utc,0.0,0.0,0.2,0.0,0.8,0,0,0.0,0,0.9210323691368103
AbigailMCND,canadas immigration strategy could widen housing shortfall by 500k units in 2 years td economics  video canadabusiness economy canada james orlando director and senior economist at td economics joins bnn bloomberg to discuss their report examines dlvritsstx1s,jul 29 2023  102 am utc,0.0,0.0,0.2,0.0,0.8,0,0,0.0,0,0.9182710647583008
NancyGCND,canadas immigration strategy could widen housing shortfall by 500k units in 2 years td economics  video canadabusiness economy canada james orlando director and senior economist at td economics joins bnn bloomberg to discuss their report examines dlvritsstx10,jul 29 2023  102 am utc,0.0,0.0,0.2,0.0,0.8,0,0,0.0,0,0.9252626895904541
SamuelsCND,canadas immigration strategy could widen housing shortfall by 500k units in 2 years td economics  video canadabusiness economy canada james orlando director and senior economist at td economics joins bnn bloomberg to discuss their report examines dlvritsstwvr,jul 29 2023  1259 am utc,0.0,0.0,0.2,0.0,0.8,0,0,0.0,0,0.9207319021224976
ayerwaves01,ongoing immigration surge could widen housing shortfall  lead to higher neutral interest rate td economics  spencerfernandocom202307 via spencerfernando,jul 28 2023  1156 pm utc,0.25,0.0,0.0,0.25,0.5,1,1,0.4588,0,0.8305913209915161
ubbergenius,ongoing immigration surge could widen housing shortfall  lead to higher neutral interest rate td economics  spencerfernandocom202307 via spencerfernando,jul 28 2023  1130 pm utc,0.25,0.0,0.0,0.25,0.5,1,1,0.4588,0,0.8305913209915161
AnnStew80895938,ongoing immigration surge could widen housing shortfall  lead to higher neutral interest rate td economics  spencerfernandocom202307 via spencerfernando,jul 28 2023  1115 pm utc,0.25,0.0,0.0,0.25,0.5,1,1,0.4588,0,0.8305913209915161
Crystal1Dearlyn,ongoing immigration surge could widen housing shortfall  lead to higher neutral interest rate td economics  spencerfernandocom202307 via spencerfernando   yes third  w c soon you t and l canada a joke world one immigrant said i have 9 kids canada pays me i make dont work,jul 28 2023  832 pm utc,0.38,0.0,0.0,0.25,0.38,4,1,0.7845,0,0.49985435605049133
103blinddog,ongoing immigration surge could widen housing shortfall  lead to higher neutral interest rate td economics  spencerfernandocom202307 via spencerfernando,jul 28 2023  828 pm utc,0.25,0.0,0.0,0.25,0.5,1,1,0.4588,0,0.8305913209915161
Inky16027248,ongoing immigration surge could widen housing shortfall  lead to higher neutral interest rate td economics  spencer fernando spencerfernandocom202307,jul 28 2023  808 pm utc,0.25,0.0,0.0,0.25,0.5,1,1,0.4588,0,0.8183540105819702
LuisD_53,ongoing immigration surge could widen housing shortfall  lead to higher neutral interest rate td economics  spencer fernando spencerfernandocom202307,jul 28 2023  732 pm utc,0.25,0.0,0.0,0.25,0.5,1,1,0.4588,0,0.8183540105819702
earlhyde2,ongoing immigration surge could widen housing shortfall  lead to higher neutral interest rate td economics  spencerfernandocom202307 via spencerfernando,jul 28 2023  707 pm utc,0.25,0.0,0.0,0.25,0.5,1,1,0.4588,0,0.8305913209915161
Definite_dev,population surge causes higher interest rates  msncomencamoneytopstori,jul 28 2023  502 pm utc,0.5,0.0,0.0,0.5,0.0,1,0,0.4588,0,0.5277674198150635
wesSE22020,well since spending became under scrutiny they had to find somewhere else to drive inflation up and mass immigration was their trick and the trickster was    amazing government im not sue who was voting liberals in yesterdays two by elections,jul 28 2023  425 pm utc,0.0,0.0,0.5,0.0,0.5,4,0,0.5859,-1,0.5093957185745239
TD_Economics,see the us weekly bottom line here usecon gotdcom3rk8izl,jul 28 2023  421 pm utc,0.0,0.0,0.0,0.0,1.0,0,0,0.0,0,0.9699912071228027
TD_Economics,check out our weekly summary of economic  financial events  what to expect in the weeks ahead cdnecon gotdcom44zh6ha,jul 28 2023  421 pm utc,1.0,0.0,0.0,0.0,0.0,0,0,0.0,0,0.962131917476654
MarkTORealtor,yep plus h4l no tail whip,jul 28 2023  343 pm utc,0.0,0.0,0.0,0.0,0.0,-1,0,0.0,0,0.9245424866676331
schtaunk,bank of canada must be wellcorrelated with fed or we create our own inflation as our currency depreciates  so tiff is forced to keep up  and the fed doesnt care about canadian housing bagholders  in fact,jul 28 2023  150 pm utc,0.0,0.33,0.0,0.0,0.67,1,0,-0.5847,-1,0.8688564896583557
MartinGriff63,therealangiepar bigbaldtone c2c_customers natexgroup tddirectinvest will do share trades for 595 for 1st 3 months 10 to buy 1 share,jan 19 2016  934 pm utc,0.0,0.0,0.0,0.0,0.0,2,1,0.5267,0,0.9470679759979248
MoneyTalkGO,no surprises from bofc 71 cent loonie ahead andrew kelvin tdsi owlyvqyqf kimparlee tddirectinvest,dec 3 2015  354 pm utc,0.0,0.0,1.0,0.0,0.0,-1,0,-0.0772,0,0.7561833262443542
TD_Careers,we are looking for passionate guidewire platform specialists to help us design manage and lead endtoend solution design and system analysis find the opportunity for you gotdcom3ihaduy tdcareers,aug 4 2022  500 pm utc,0.12,0.0,0.25,0.0,0.62,7,2,0.8807,1,0.8652673959732056
TD_Careers,for our colleague bruce robinson seeing his team succeed and achieve their goals is the most rewarding part of working at td join our team of agile professionals if people management and building a strong team is what drives you gotdcom3awiqml tdcareers,jul 8 2022  834 pm utc,0.25,0.0,0.0,0.0,0.75,5,4,0.908,1,0.9906501770019531
TD_Careers,do you have strong business analysis abilities and a deep understanding of payroll if so join our corporate initiatives team and discover a role to showcase your expertise in an inclusive and collaborative environment gotdcom3nmbyaj tdcareers,jul 4 2022  312 pm utc,0.2,0.0,0.2,0.0,0.6,5,1,0.8001,1,0.8659816980361938
TD_Careers,are you an innovative problem solver with a knack for data and analytics want to be supported by an authentic human community unleash your potential as a dataengineer to work on our data as a service daas platform gotdcom3fgghio tdcareers,may 25 2022  445 pm utc,0.0,0.0,0.0,0.0,1.0,3,2,0.4215,1,0.8812761902809143
TD_Careers,we are hiring for multiple roles and seniority levels in business insights  analytics for our tdanalytics powerhouse work with rich data to solve complex problems and translate them into solutionoriented stories learn more gotdcom36fqsvm tdcareers,apr 25 2022  145 pm utc,0.0,0.0,0.0,0.0,1.0,1,0,0.4019,1,0.7417339086532593
TD_Careers,are you an innovative inquisitive problem solver were looking for a datascientist to work on complex problems that helps us be the better bank for our colleagues customers and community unleash your potential with tdanalytics gotdcom3sqtgck tdcareers,apr 18 2022  500 pm utc,0.0,0.0,0.29,0.0,0.71,4,-1,0.5719,1,0.952574610710144
learningcouncil,senior instruction designer microassist  austin texas  elearningcouncilcomjobsen tdcareers  lead a team to design create and deploy training microassist focuses on developing accessible custom learning for midsize to large private sector and government organizations,mar 7 2022  332 pm utc,0.0,0.0,0.5,0.0,0.5,0,2,0.2732,0,0.7803309559822083
TD_Careers,we are hiring for multiple roles and seniority levels for in business insights  analytics for our tdanalytics powerhouse work with rich data to solve complex problems and translate them into solutionoriented stories learn more gotdcom3mqowss tdcareers,mar 4 2022  603 pm utc,0.0,0.0,0.0,0.0,1.0,1,0,0.4019,1,0.7108978033065796
TD_Careers,we are hiring for multiple roles and seniority levels for in business insights  analytics for our tdanalytics powerhouse work with rich data to solve complex problems and translate them into solutionoriented stories learn more gotdcom3qaicnl tdcareers,feb 3 2022  900 pm utc,0.0,0.0,0.0,0.0,1.0,1,0,0.4019,1,0.7209461331367493
TD_Careers,are you an innovative inquisitive problem solver were looking for a datascientist to work on complex problems that helps us be the better bank for our colleagues customers and community unleash your potential with tdanalytics  gotdcom3ifakzt tdcareers,jan 27 2022  800 pm utc,0.0,0.0,0.29,0.0,0.71,4,-1,0.5719,1,0.9505191445350647
TD_Careers,td announces it will add up to 2000 new technology roles in 2022 to power the banks futurefocused strategy including indemand positions in dev ops agile and microservices that are fueling tds accelerated tech talent strategy tdcareers gotdcom3gydszn,jan 26 2022  600 pm utc,0.0,0.2,0.0,0.2,0.6,0,2,0.4215,1,0.6251991987228394
TDNews_Canada,td announces it will add up to 2000 new technology roles in 2022 to power the banks futurefocused strategy including indemand positions in dev ops agile and microservices that are fueling tds accelerated tech talent strategy tdcareers tgamca3u2hyae,jan 26 2022  415 pm utc,0.0,0.2,0.0,0.2,0.6,0,2,0.4215,1,0.6410279273986816
a11ycareers,digital accessibility instructional specialist stanford  redwood city ca  careersearchstanfordedujo a11ycareers tdcareers a11yjobs,jan 25 2022  330 pm utc,0.0,0.0,0.0,0.0,0.0,0,0,0.0,0,0.9347352981567383
TD_Careers,weve developed innovative solutions in data and analytics which allows us to focus on work that further helps colleagues and customers listen in to matt forers career journey as a datascientist with tdanalytics and join our team gotdcom30mioap tdcareers,jan 24 2022  310 pm utc,0.0,0.0,0.25,0.0,0.75,6,2,0.8126,1,0.9566666483879089
TD_Careers,our tdanalytics team encourages you to bring your whole self to work everyday and unlock your potential in a rewarding career explore your future here gotdcom30mioap tdcareers,jan 19 2022  400 pm utc,0.0,0.0,0.0,0.5,0.5,4,2,0.743,1,0.9845459461212158
TD_Careers,are you curious driven to innovate and looking to solve complex problems were hiring for multiple machinelearning roles interested join our growing team your opportunity is waiting gotdcom3pghw6h tdanalytics aieverywhere tdcareers,dec 8 2021  845 pm utc,0.25,0.0,0.25,0.0,0.5,7,-2,0.9001,1,0.953015148639679
learningcouncil,director learning programs leads  microsoft  5 locations  elearningcouncilcomjobdir tdcareers,dec 7 2021  253 pm utc,0.0,0.0,1.0,0.0,0.0,0,1,0.0,0,0.9031581878662109
TD_Careers,looking to ace your jobinterview check out our top tips from our sr recruiter graham mitchell tdrecruitercorner nowhiring tdcareers,dec 6 2021  430 pm utc,0.0,0.0,0.5,0.5,0.0,2,1,0.2023,1,0.9285560846328735
JPeyiotis_TD,td wealth financial planning is hiring contact me and apply today tdcareers whytd socialcentretdcomtuch,dec 1 2021  315 am utc,0.0,0.0,0.0,0.0,0.0,3,0,0.4939,0,0.8357917666435242
TD_Careers,explore our roles in advanced and quantitativeanalytics where youll implement and execute statistical models this is your chance to make an impact with our diverse data and analytics team apply today gotdcom30mioap tdcareers tdanalytics,nov 17 2021  800 pm utc,0.0,0.25,0.0,0.25,0.5,3,1,0.4588,1,0.8363619446754456
TD_Careers,applying for a jobopportunity our sr recruiter gerry excellent shares his tips and tricks on the process in our new series tdrecruitercorner gotdcom38v7pop tdcareers nowhiring,nov 8 2021  226 pm utc,0.33,0.0,0.33,0.33,0.0,4,1,0.6597,1,0.7119523286819458
learningcouncil,learning  development coordinator at disney in burbank california  elearningcouncilcomjobs tdcareers,nov 4 2021  337 pm utc,0.0,0.0,0.0,0.0,0.0,0,0,0.0,0,0.9149168133735657
TD_Careers,join us at bfutr 2021 the largest virtual gathering of blacktech professionals in the world on october 2829 and check out our current career opportunities gotdcom3butht1 tdcareers,oct 25 2021  740 pm utc,1.0,0.0,0.0,0.0,0.0,3,0,0.5859,0,0.5347294807434082
JPeyiotis_TD,td wealth financial planning is hiring contact me and apply today  tdcareers whytd socialcentretdcomt1tqd,oct 25 2021  230 am utc,0.0,0.0,0.0,0.0,0.0,3,0,0.4939,0,0.8426488637924194
learningcouncil,learning developer  instructional designer in dallas texas united states  corporate careers at southwest  southwestair careerssouthwestaircomjob tdcareers,oct 20 2021  816 pm utc,0.0,0.0,0.0,1.0,0.0,1,0,0.4215,0,0.9626325368881226
ColleenDans,tdcareers,oct 19 2021  1219 am utc,0.0,0.0,0.0,0.0,0.0,0,0,0.0,0,0.9133862853050232
TD_Careers,td has been ranked as one of forbes worlds best employers learn more here gotdcom2xknaus tdcareers,oct 15 2021  919 pm utc,0.0,0.0,0.0,0.0,0.0,3,1,0.6369,1,0.9531408548355103
TD_Careers,manager learning and development scjohnson tdcareers ldcareers elearningcouncilcomjobs,oct 15 2021  919 pm utc,0.0,0.0,0.0,0.0,0.0,0,0,0.0,0,0.9524934887886047
learningcouncil,enterprise learning and development manager scjohnson in racine wi  elearningcouncilcomjobman  lead endtoend strategy and execution of the learning roadmap for your assigned business units  tdcareers,oct 13 2021  400 pm utc,0.0,0.0,0.0,0.0,1.0,0,1,0.0,0,0.9457800984382629
learningcouncil,director of learning and development atlanta ga rgp tdcareers  setting the strategy to meet the business needs then designing building and delivering talent development programs that continually upskill the performance of our global employee base  elearningcouncilcomjobs,oct 12 2021  1050 pm utc,0.0,0.0,0.29,0.14,0.57,0,1,0.4215,1,0.6236144304275513
learningcouncil,corporate learning and development specialist camas wa united states fisherinvest elearningcouncilcomjobcor tdcareers  work with key managers and employees to help design organize and execute major training initiatives reporting to the ld manager,sep 23 2021  926 pm utc,0.0,0.0,0.2,0.4,0.4,3,1,0.6705,0,0.9296677708625793
learningcouncil,learning and development analyst austin tx wholefoods elearningcouncilcomjoblea  responsible for the design implementation administration and delivery of training programs practices and procedures to all levels of the organization  tdcareers austinjobs atxjobs,sep 12 2021  446 pm utc,0.0,0.0,0.5,0.0,0.5,2,0,0.5859,0,0.9575154185295105
learningcouncil,director worldwide learning and development at apple santa clara california tdcareers elearningcouncilcomjobs  leads a group of learning and development specialists and is a key leader in the  retail engagement and marketing team,aug 30 2021  251 pm utc,0.0,0.0,0.5,0.25,0.25,0,1,0.4588,0,0.5885900855064392
learningcouncil,contact me today tdcareers tdwealth socialcentretdcomtfgpk,aug 23 2021  540 pm utc,0.0,0.0,0.0,0.0,0.0,0,0,0.0,0,0.9187201857566833
JPeyiotis_TD,senior advisor learning  development dell round rock tx remotework tdcareers elearningcouncilcomjobs  you will leverage your lxd expertise to design and deploy high quality and compelling learning experiences that delight our learners and ensure transfer of learning,aug 11 2021  145 am utc,0.2,0.0,0.2,0.2,0.4,4,2,0.872,1,0.9755236506462097
learningcouncil,technical trainer job at sartoriusglobal  elearningcouncilcomjobs  remote job technical training professional for  bioanalytics division salessales support function  remotejobs tdcareers,aug 5 2021  732 pm utc,0.0,0.0,0.0,0.0,1.0,2,1,0.4019,0,0.937509298324585
learningcouncil,technical trainer ann arbor mi sartoriusglobal elearningcouncilcomjobtec remotebased technical training professional for  bioanalytics division salessales support function  tdcareers remotejobs remotework,jul 26 2021  608 pm utc,0.0,0.0,0.0,0.0,0.0,2,1,0.4019,0,0.9277063012123108
learningcouncil,director learning  development athens ga  elearningcouncilcomjobdir tdcareers,jul 26 2021  233 pm utc,0.0,0.0,1.0,0.0,0.0,0,0,0.0,0,0.9696052670478821
TD_Careers,happy nationalinternday  were thrilled to have such bright minds leading us into the future   heres a message to all our td interns celebrating the tremendous work they do tdcampus,jul 27 2023  524 pm utc,0.33,0.0,0.5,0.0,0.17,12,5,0.9217,1,0.9929695725440979
WarMistweet,e thats dim  theres got to be a way to lock and load ai enhanced communication principles gently at the winery in niagarafalls im not finding the words but shouldnt air rights and broadcasting agreements for lcbo truck bays include moneysaving visitations from a,jul 9 2023  422 am utc,0.0,0.2,0.0,0.2,0.6,0,0,0.5647,0,0.8926117420196533
WarMistweet,e40 one might anticipate for the guilded of niagarafalls winery a dialogue of conversational language might be developed in cash in cash out follow a scottie barnes swallow perimeter check yo self on premises access in hours or after hours td_careers is hanging on to the,jul 9 2023  415 am utc,0.25,0.0,0.25,0.0,0.5,0,0,0.0,0,0.9547240138053894
TD_Careers,how likely would you be to reapply to a company that you have been rejected by before,jul 4 2023  241 pm utc,0.0,0.0,0.0,0.0,0.0,-1,-1,-0.5106,0,0.8914414048194885
magazine_cdo,wes anderson of td_careers w jeffrey dobin of dualitytech discusses utilizing data to unlock value from technology initiatives importance of robust datafoundations and maximizing benefits of ai ml and analytics  watch here hubslyq01wfm960,jun 29 2023  159 pm utc,0.0,0.0,0.5,0.0,0.5,6,2,0.836,1,0.7008436322212219
TD_Careers,excited to announce that td has renewed its partnership with onwie_ together we could inspire more than 16000 girls to pursue engineering programs  learn more about our jobopportunities here gotdcom3vkpuhi whytd tdtech onwiesummit2023,jun 23 2023  545 pm utc,0.25,0.0,0.25,0.25,0.25,5,3,0.7269,1,0.9919803142547607
ONWiE_,salamat to mp yaarasaks for recognizing the filipinostd leadership team during the filipinoheritagemonth celebration in north york  were foreverproud to champion financial inclusion for the filcan community and build up our colleagues to advance in their td_careers,jun 22 2023  817 pm utc,0.5,0.0,0.0,0.0,0.5,0,2,0.5994,1,0.9912573099136353
PaulSaguil,why is fraudanalytics important in datasharing  wes anderson of td_careers speaks with jeffrey dobin of dualitytech about the dataprivacy versus utility tradeoff fraud analysis and data protection  watch the interview here hubslyq01thxf80 cdomagazine,jun 17 2023  605 pm utc,0.25,0.0,0.25,0.0,0.5,-2,1,-0.4588,0,0.943983793258667
magazine_cdo,subject suspected fraud in td bank  dear td bank staff  i have posted a message on td ceo linkedin profile mr leo salom please read that message this could uncover organized crime i will report that matter to toronto police ceo of bank of canada  other banks ceos,jun 13 2023  209 pm utc,0.0,0.0,0.11,0.11,0.78,-4,-2,-0.6369,0,0.6142096519470215
hafizmubeen,thats some awesome swag mylan congratulations and welcome to our team tdearlytalent tdcampus,jun 13 2023  1154 am utc,0.5,0.0,0.5,0.0,0.0,8,3,0.9001,1,0.992668867111206
TD_Careers,voices of chha1610am toronto onpoli when do you foresee td_careers switching up basic card pin entry at the community branch and going with a dennysdinerlike blessed are the money managers rajoe show basically the pemex can have hallmark love letter or local scores,jun 7 2023  734 pm utc,0.33,0.17,0.0,0.0,0.5,3,2,0.8442,0,0.8768752813339233
mylannguyen__,they also want the huge brown envelopes that come with handing over taxpayers hard earned to buy fighter jets and later appointments after td careers fail,may 15 2023  540 pm utc,0.33,0.33,0.0,0.33,0.0,-1,-2,-0.1779,-1,0.8834789395332336
WarMistweet,td_careers netflix_ca  chatgpt i want to build a special fx studio in a laneway house in toronto where should i start is this information available from ontconstsec  is this a learners administrative mock ocad solution for seasonal construction icebreaker,may 30 2023  103 am utc,0.0,0.0,0.25,0.0,0.75,0,0,0.3612,0,0.9608521461486816
benotti69,td_careers at hydro pole height a canister style like those that made vacuum devices for banking can hold a protected and styled life perspective on the science of automobiles and local workers or other focus on mall employees or services within,may 26 2023  817 am utc,0.2,0.0,0.0,0.2,0.6,3,1,0.6597,0,0.9208065271377563
WarMistweet,wes anderson of td_careers speaks with jeffrey dobin of dualitytech about his role and responsibilities at the bank and the impact of compliance on how financial institutions derive value from data  watch here hubslyq01qghj30 cdomagazine,may 25 2023  433 pm utc,0.0,0.2,0.2,0.0,0.6,0,0,0.34,0,0.8784195184707642
WarMistweet,look what just came in the mail today   thank you for the warm welcome and wonderful gifts td_careers super excited to be joining as software engineer intern this summer and learning lots with my amazing team tdcampus,may 25 2023  357 pm utc,0.25,0.0,0.25,0.25,0.25,19,7,0.9648,1,0.9927686452865601
magazine_cdo,heres what our students shared with us as they wrapped up their immersive experience in metaverse for their winter coop term if youre looking for your next coop or internship check out our opportunities for the fall semester gotdcom3thoyv1 tdearlytalent,may 22 2023  200 pm utc,1.0,0.0,0.0,0.0,0.0,3,-1,0.6124,1,0.6995940208435059
SmithCharts,packed crowd singing im not the only one at bostons td garden arena,aug 6 2023  156 pm utc,0.0,0.0,0.0,0.0,0.0,0,0,0.0,0,0.7260335683822632
niggato927,as a celtics fan i can say him and the magic are the only 2 lakers that we actually respect and the only player that can come into the td garden and get this kind of treatment shame we didnt get to draft him,aug 7 2023  534 am utc,0.67,0.0,0.33,0.0,0.0,3,1,0.3182,0,0.6217995285987854
