username,tweet_text,tweet_raw,date,happy,angry,surprise,sad,fear,afinn,bing,sid,bertweet,bertweet_confidence
isabeldc,scotiabankhelps having some issues with completing a credit card application everything goes through and then at the end it says it cant complete my application and i have to go into a branch,@ScotiabankHelps having some issues with completing a credit card application. Everything goes through and then at the end it says it can’t complete my application and I have to go into a branch.,aug 11 2023  616 pm utc,0.0,0.0,0.0,0.0,1.0,0,-1,0.3818,-1,0.9148138761520386
ronak6194,scotiabankhelps scotiabank justintrudeau elonmusk rbc now your so called employee is putting false allegations on my reputation worst bank in the world caicedo harrykane 100hrs weekend its been more than 30 hours still no response scammer,@ScotiabankHelps @scotiabank @JustinTrudeau @elonmusk @RBCNow your so called employee is putting false allegations on my reputation.WORST BANK IN THE WORLD.#Caicedo #HarryKane #100hrs #weekendit’s been more than 30 hours still no response.SCAMMER,aug 11 2023  320 pm utc,0.0,0.0,0.0,0.75,0.25,-4,-1,-0.743,-1,0.9767364263534546
ronak6194,scotiabankhelps scotiabank its been more than 24 hours still no response scammer bank of canada bholaashankar criticalrolespoilers justintrudeau elonmusk what a fake organisation,@ScotiabankHelps @scotiabankIt’s been more than 24 hours still no response.Scammer bank of Canada.#BholaaShankar #criticalrolespoilers@JustinTrudeau @elonmuskWhat a fake organisation,aug 11 2023  534 am utc,0.0,0.0,0.0,0.67,0.33,-4,-1,-0.6486,-1,0.9739635586738586
ScotiabankHelps,hi pranab thanks for reaching out please remove the screenshot from your post and send us a dm so that we can obtain more information to assist you mh,Hi Pranab thanks for reaching out! Please remove the screenshot from your post and send us a DM so that we can obtain more information to assist you. ^MH,aug 11 2023  1244 pm utc,0.0,0.0,0.0,0.0,1.0,4,0,0.7184,0,0.6991643905639648
ScotiabankHelps,hi marcus we would like to see how we can help please send us a dm to continue our chat rj,Hi MarcusWe would like to see how we can help. Please send us a DM to continue our chat. ^RJ,aug 11 2023  1206 pm utc,0.0,0.0,0.0,0.0,1.0,5,1,0.7579,0,0.6867629885673523
wincy_chong,scotiabankhelps how do you protect your customer from fraud from continuing once you and the customer confirm fraud is happening on your account simplequestion banking fraud scamalert patforanctvnews,@ScotiabankHelps how do you protect your customer from fraud from continuing once you and the customer confirm fraud is happening on your account? #simplequestion #Banking #fraud #ScamAlert @PatForanCTVNews,aug 11 2023  1005 am utc,0.25,0.0,0.0,0.0,0.75,-11,-2,-0.8689,-1,0.6061506867408752
ronak6194,try sending a wire from one canadian bank to another next door paid 117 for the privilege 3 days and counting for the funds to appear scotiabankhelps,Try sending a wire from one Canadian bank to another next door. Paid $117 for the privilege. 3 days and counting for the funds to appear. .@ScotiabankHelps,aug 10 2023  700 pm utc,0.2,0.0,0.0,0.0,0.8,0,1,0.3612,0,0.9280693531036377
mandaobserver,sorry to hear about that melissa we also have another option by sending us a pm on our scotiabanks facebook page sk,Sorry to hear about that Melissa we also have another option by sending us a PM on our Scotiabanks Facebook page! ^SK,aug 11 2023  440 am utc,0.0,0.0,0.0,0.5,0.5,-1,-1,-0.0772,0,0.7812103629112244
ScotiabankHelps,followed you but it still doesnt work,Followed you but it still doesnt work.,aug 10 2023  1124 pm utc,0.0,0.0,0.0,0.0,1.0,0,1,0.0,-1,0.8062093257904053
underwhelmed00,weve followed you looking forward to your dm thank you,Weve followed you! Looking forward to your DM! Thank you.,aug 10 2023  1122 pm utc,0.0,0.0,0.0,0.0,1.0,2,1,0.3612,1,0.9654665589332581
ScotiabankHelps,hello melissa please follow our page in order for us to communicate with you via dms dw,Hello Melissa Please follow our page in order for us to communicate with you via DMs. ^DW,aug 10 2023  1107 pm utc,0.0,0.0,0.0,0.0,0.0,1,0,0.3182,0,0.935490071773529
ScotiabankHelps,hi kiara sorry to hear that you feel this way please send us a dm to chat further will be happy to look into anything for you sk,Hi Kiara sorry to hear that you feel this way please send us a DM to chat further will be happy to look into anything for you ^SK,aug 10 2023  1102 pm utc,0.25,0.0,0.0,0.25,0.5,3,0,0.6908,0,0.8025391101837158
ScotiabankHelps,hello melissa thanks for reaching out to us we would like to try out few troubleshooting steps with you please send us a dm to chat further dw,Hello Melissa thanks for reaching out to us. We would like to try out few troubleshooting steps with you. Please send us a DM to chat further. ^DW,aug 10 2023  1022 pm utc,0.0,0.0,0.0,0.0,1.0,6,1,0.8481,1,0.7992048859596252
underwhelmed00,hi there pls send us a dm to review this further thank you,Hi there! Pls send us a DM to review this further. Thank you.,aug 10 2023  935 pm utc,0.0,0.0,0.0,0.0,1.0,2,1,0.4215,0,0.891825795173645
ScotiabankHelps,dont think the branch can fix their website that doesnt work,Dont think the branch can fix their website that doesnt work,aug 10 2023  906 pm utc,0.0,0.0,0.0,0.0,1.0,0,1,0.0,-1,0.9724134206771851
ChrisQuigley1,yes thats also what the advisor told me but like is there anything i can have to track the location of my card like where it is right now and when will it arrive,yes thats also what the advisor told me but like is there anything I can have to track the location of my card like where it is right now and when will it arrive?,aug 10 2023  904 pm utc,0.0,0.0,0.0,1.0,0.0,5,3,0.81,0,0.975982666015625
nikankh17,hello we noticed your tweet were sorry to hear about your experience and apologize for the inconvenience this has caused please connect with our partners at scotiabank jamaica for assistancefacebookcomscotiacaribbean pt,Hello we noticed your tweet. Were sorry to hear about your experience and apologize for the inconvenience this has caused. Please connect with our partners at Scotiabank Jamaica for assistance.facebook.com/scotiacaribbean… ^PT,aug 10 2023  819 pm utc,0.0,0.0,0.0,0.5,0.5,-3,-2,-0.0258,0,0.826880693435669
ScotiabankHelps,hi there were happy to hear that youve opened an account with us please note that delivery times for credit cards is between 7 and 10 business days if youd like to chat further please send us a dm thank you,Hi there! Were happy to hear that youve opened an Account with us! Please note that delivery times for credit cards is between 7 and 10 business days. If youd like to chat further please send us a DM! Thank you.,aug 10 2023  728 pm utc,0.25,0.0,0.0,0.0,0.75,9,3,0.9313,1,0.9883706569671631
ScotiabankHelps,i opened a student bank account 8 days ago and they told me i will receive my credit card at my home address is there anyway i can track the post like where is my card right now because its been 8 days already,I opened a student bank account 8 days ago and they told me I will receive my credit card at my home address is there anyway I can track the post like where is my card right now? Because its been 8 days already...,aug 10 2023  723 pm utc,0.22,0.0,0.11,0.22,0.44,2,2,0.6249,0,0.9275315999984741
nikankh17,hi there weve noticed your tweet if you need assistance kindly send us a dm to chat further sa,Hi there we’ve noticed your tweet. If you need assistance kindly send us a DM to chat further. ^SA,aug 10 2023  721 pm utc,0.25,0.0,0.0,0.0,0.75,0,1,0.4939,0,0.8797870874404907
ScotiabankHelps,scotiabank scotiabankhelps justintrudeau elonmusk its been more than 12 hours still there is not even single contact what a scammer 1989taylorsversion onstorm thursdaymorning الهلال_الشباب,@scotiabank @ScotiabankHelps @JustinTrudeau @elonmuskIt’s been more than 12 hours still there is not even single contact. What a scammer#1989TaylorsVersion #onstorm #thursdaymorning #الهلال_الشباب,aug 10 2023  721 pm utc,0.0,0.0,0.0,0.0,0.0,0,0,0.0,-1,0.956672191619873
ScotiabankHelps,hi there were sorry to hear about these issues with your scotiabank online access chris rest assured we have real people who monitor our social pages so after the initial welcome message youve got a live advisor d please send us a dm for assistance kw,Hi there. Were sorry to hear about these issues with your Scotiabank online access Chris. Rest assured we have real people who monitor our Social Pages so after the initial welcome message youve got a live advisor :D Please send us a DM for assistance. ^KW,aug 10 2023  616 pm utc,0.14,0.0,0.0,0.29,0.57,2,-1,0.7579,0,0.8052419424057007
summergirl776,im sorry even though its inconvenient it might be quicker to go down to a branch and have them fix it they might get a person to respond versus a twitter bot,I’m sorry. Even though it’s inconvenient it might be quicker to go down to a branch and have them fix it. They might get a person to respond versus a Twitter bot.,aug 10 2023  611 pm utc,0.0,0.0,0.0,0.67,0.33,-3,0,-0.4019,-1,0.6255204677581787
ScotiabankHelps,hi there thank you for reaching scotiabank canada based on your profile it appears you are currently located in mexico to better assist you we kindly recommend contacting our partners at scotiabank mexico directly through their twitter scotiabankapoya  mh,Hi there thank you for reaching Scotiabank Canada. Based on your profile it appears you are currently located in Mexico. To better assist you we kindly recommend contacting our partners at Scotiabank Mexico directly through their Twitter @ScotiabankApoya . ^MH,aug 10 2023  402 pm utc,0.2,0.0,0.0,0.6,0.2,7,4,0.8979,1,0.5789715647697449
ScotiabankHelps,to chat with us in dm you may use the following link bitly1ruso9h,To chat with us in DM you may use the following link: bit.ly/1Ruso9h,aug 10 2023  350 pm utc,0.0,0.0,0.0,0.0,1.0,0,0,0.0,0,0.9579717516899109
BC_SPCA,hi there to report an animal in danger please call our bc spca animal helpline at 18556227722,Hi there to report an animal in danger please call our BC SPCA Animal Helpline at 1-855-622-7722.,aug 10 2023  346 pm utc,0.0,0.0,0.0,0.5,0.5,-1,-1,-0.2732,0,0.9240576028823853
ScotiabankHelps,hi there thanks for reaching out please send us a dm so that we can obtain more information to assist you mh,Hi there thanks for reaching out! Please send us a DM so that we can obtain more information to assist you. ^MH,aug 10 2023  303 pm utc,0.0,0.0,0.0,0.0,1.0,4,0,0.7184,1,0.7642186284065247
slbeckett,i will dm you because i cant see any of your online products that meet those criteria,I will DM you because I can’t see any of your online products that meet those criteria.,aug 10 2023  302 pm utc,0.0,0.0,0.0,0.0,1.0,0,0,0.0,-1,0.5500667095184326
ScotiabankHelps,hello please send them a message and they will be able to reply,Hello. Please send them a message and they will be able to reply.,aug 10 2023  120 pm utc,0.0,0.0,0.0,0.0,1.0,1,0,0.3182,0,0.9196536540985107
ohheycamille,the last time that page posted was july 3,the last time that page posted was July 3...,aug 10 2023  101 pm utc,0.0,0.0,0.0,0.0,0.0,0,0,0.0,0,0.9752278923988342
ScotiabankHelps,good morning please reach out to our partners at facebookcomscotiacaribbean and theyd be happy to assist further ds,Good morning. Please reach out to our partners at facebook.com/ScotiaCaribbean and theyd be happy to assist further! ^DS,aug 10 2023  1257 pm utc,0.5,0.0,0.0,0.0,0.5,8,2,0.8402,1,0.9195830821990967
ohheycamille,scotiabankhelps scotiabankjm is your app down only the homescreen loads since yesterday,@ScotiabankHelps @ScotiabankJM is your app down? Only the homescreen loads since yesterday.,aug 10 2023  1255 pm utc,0.0,0.0,0.0,0.0,1.0,0,0,0.0,-1,0.5749834775924683
ScotiabankHelps,hi lamba we certainly understand the urgency of your concern and would like to assist you further kindly send us a dm to continue our conversation mh,Hi Lamba we certainly understand the urgency of your concern and would like to assist you further. Kindly send us a DM to continue our conversation. ^MH,aug 10 2023  1239 pm utc,0.25,0.0,0.0,0.25,0.5,2,1,0.7964,1,0.5353804230690002
ScotiabankHelps,good morning stan we would like the opportunity to look into your concern please feel free to send us a dm so we can obtain further details to assist you sc,Good morning Stan we would like the opportunity to look into your concern. Please feel free to send us a DM so we can obtain further details to assist you ^SC,aug 10 2023  1238 pm utc,0.4,0.0,0.0,0.2,0.4,9,2,0.9153,1,0.5424711108207703
LambaRajesh1,scotiabankhelps lamba rajesh lunkaran and my account is freezed by debit card is trashed and im facing lot of problems from last one month please help me out of this situation your employees treat as like that i have done crime its request to solve my problem asap,@ScotiabankHelps Lamba Rajesh Lunkaran and my account is freezed by debit card is trashed and Im facing lot of problems from last one month please help me out of this situation your employees treat as like that I have done crime its request to solve my problem ASAP,aug 10 2023  1237 pm utc,0.0,0.2,0.1,0.2,0.5,-1,-3,0.2732,-1,0.9713165163993835
ScotiabankHelps,hi lamba thanks for reaching out were sorry to hear about your experience we would like the opportunity to look into this for you kindly send us a dm to continue our conversation mh,Hi Lamba thanks for reaching out! Were sorry to hear about your experience! We would like the opportunity to look into this for you. Kindly send us a DM to continue our conversation. ^MH,aug 10 2023  1237 pm utc,0.4,0.0,0.0,0.2,0.4,6,1,0.8979,0,0.8571386933326721
LambaRajesh1,scotiabankhelps hi this lamba rajesh lunkaran and i have been trapped in some unusual activity in my account but from last one month i am not getting any help from my home branch financial drive mississauga and im international student am not able to pay any penny of amount,@ScotiabankHelps Hi this Lamba Rajesh Lunkaran and I have been trapped in some unusual activity in my account but from last one month I am not getting any help from my home branch Financial Drive Mississauga and Im international student am not able to pay any penny of amount,aug 10 2023  1235 pm utc,0.0,0.0,0.14,0.43,0.43,-1,-2,-0.5637,-1,0.9587215185165405
ChrisQuigley1,its not unfortunately i havent been able to use the app they locked me out of my account for a week cause i signed into the app cause it was unusual activity they message ask a question i answer then they ask the same question 5 more times,Its not unfortunately. I havent been able to use the app they locked me out of my account for a week cause I signed into the app cause it was unusual activity. They message ask a question I answer then they ask the same question 5 more times.,aug 10 2023  951 am utc,0.0,0.0,0.0,0.2,0.8,0,-2,0.2584,-1,0.9456738233566284
ronak6194,scotiabankhelps justintrudeau its been 7 hours still no response jailer mauifires elon worstpresidentever scammeralert,@ScotiabankHelps @JustinTrudeauIt’s been 7 hours still no response. #Jailer #MauiFires #Elon #WORSTpresidentEVER #SCAMMERALERT,aug 10 2023  603 am utc,0.0,0.0,0.0,1.0,0.0,-1,0,-0.296,-1,0.9786847233772278
ronak6194,hello thanks for reaching out to us we do offer a variety of credit card options please visit scotiabankcomcaenpersona for more information if you would like to chat more please feel free to send us a dm dw,Hello thanks for reaching out to us. We do offer a variety of credit card options. Please visit scotiabank.com/ca/en/persona… for more information. If you would like to chat more please feel free to send us a DM. ^DW,aug 9 2023  1022 pm utc,0.17,0.0,0.0,0.17,0.67,8,3,0.9429,1,0.9252180457115173
ScotiabankHelps,i fixed it  when you sent me a new debit card you didnt provide instructions to remove the expired card  last time i called you folks said its a third party issue and call apple,I fixed it . When you sent me a new debit card you didn’t provide instructions to remove the expired card . Last time I called you folks said it’s a third party issue and call apple.,aug 9 2023  1158 pm utc,0.0,0.0,0.0,0.0,0.0,0,-2,0.4019,-1,0.8355220556259155
ScotiabankHelps,we can certainly look into this for you and troubleshoot the issue with digital wallet please send us a dm to chat further pt,We can certainly look into this for you and troubleshoot the issue with digital wallet please send us a DM to chat further. ^PT,aug 9 2023  1142 pm utc,0.0,0.0,0.0,0.0,1.0,1,-1,0.6705,0,0.6889533996582031
ScotiabankHelps,hello there we are sorry to hear about your experience and apologize for the inconvenience this has caused please send us a dm to chat further pt,Hello there we are sorry to hear about your experience and apologize for the inconvenience this has caused. Please send us a DM to chat further. ^PT,aug 9 2023  1134 pm utc,0.0,0.0,0.0,0.5,0.5,-3,-2,-0.0258,0,0.7382996678352356
bluezed28,scotiabankhelps when are you guys going to fix your apple wallet issue its 2023 and i cant add my scotia cards to my wallet every other bank and card issuer works fine,@ScotiabankHelps when are you guys going to fix your apple wallet issue. It’s 2023 and I can’t add my scotia cards to my wallet. Every other bank and card issuer works fine.,aug 9 2023  1132 pm utc,0.25,0.0,0.0,0.25,0.5,2,1,0.2023,-1,0.9519088268280029
ronak6194,scotiabankhelps scotiabank your so called advisor never called me after confirming appointment what a scammer youre fraud bank of the canada also ther e is no communication on why the call not made cyanboujee jailerfdfs,@ScotiabankHelps @scotiabankYour so called advisor never called me after confirming appointment.What a scammer you’re.Fraud bank of the Canada. Also ther e is no communication on why the call not made. #cyanboujee #JailerFDFS,aug 9 2023  1022 pm utc,0.25,0.0,0.0,0.25,0.5,-5,-1,-0.7184,-1,0.9772439002990723
ScotiabankHelps,hi melissa sorry to hear that you are having trouble adding the card to your google wallet please send us a dm to chat further sk,Hi Melissa sorry to hear that you are having trouble adding the card to your Google Wallet. Please send us a DM to chat further! ^SK.,aug 9 2023  922 pm utc,0.0,0.0,0.0,0.6,0.4,-2,-2,-0.1779,0,0.7047552466392517
underwhelmed00,scotiabankhelps when will the ability to add credit cards to google wallet be fixed the app cant contact the bank to validate,@ScotiabankHelps When will the ability to add credit cards to Google Wallet be fixed? The app cant contact the bank to validate.,aug 9 2023  920 pm utc,0.0,0.0,0.0,0.33,0.67,3,0,0.7506,-1,0.8123273253440857
ScotiabankHelps,hello amanda thank you for bringing this to our attention and we appreciate your effort please connect with us via dm to chat further kind regards,Hello Amanda thank you for bringing this to our attention and we appreciate your effort. Please connect with us via DM to chat further.Kind Regards.,aug 9 2023  903 pm utc,0.5,0.0,0.0,0.25,0.25,7,2,0.872,1,0.980819046497345
sung_amanda,can anyone help canadian goose seems to have damaged wings sitting at the corner outside of scotiabankhelps richmond brighouse vancouverpd bc_spca i just dont want anyone to potentially hurt an innocent beautiful bird  animal animallover scotiabank richmondbrighouse,Can anyone help? Canadian goose seems to have damaged wings sitting at the corner outside of @ScotiabankHelps Richmond Brighouse @VancouverPD @BC_SPCA I just don’t want anyone to potentially hurt an innocent beautiful bird 🙏🏻#animal#animallover#scotiabank#richmondbrighouse,aug 9 2023  839 pm utc,0.2,0.2,0.0,0.4,0.2,4,-1,0.3565,-1,0.6560640931129456
ScotiabankHelps,hi there thanks for reaching out to us were sorry to hear about this and apologize for the inconvenience this has caused please send us a dm to chat further pt,Hi there thanks for reaching out to us. Were sorry to hear about this and apologize for the inconvenience this has caused. Please send us a DM to chat further. ^PT,aug 9 2023  838 pm utc,0.0,0.0,0.0,0.5,0.5,0,-2,0.5574,0,0.8051859736442566
ScotiabankHelps,yvonne sorry to hear that youre having issues connecting to the fraud department and sending us dms weve just followed you so please reattempt sending a dm so we can further assist you  kw,Yvonne. Sorry to hear that youre having issues connecting to the Fraud Department and sending us DMs. Weve just followed you so please reattempt sending a DM so we can further assist you :) ^KW,aug 9 2023  627 pm utc,0.0,0.0,0.0,0.2,0.8,-4,-3,-0.2752,0,0.7061912417411804
ScotiabankHelps,please try to send us a dm now to chat further talk soon sa,Please try to send us a DM now to chat further. Talk soon! ^SA,aug 9 2023  626 pm utc,0.0,0.0,0.0,0.0,1.0,1,0,0.3182,0,0.9231361150741577
Yvonne38817182,and looks like the dm is disabled,And looks like the DM is disabled ?,aug 9 2023  615 pm utc,0.0,0.0,0.0,0.0,1.0,2,0,0.3612,-1,0.837242066860199
ScoChlo,i cant send a dm unless im verified apparently,I can’t send a DM unless I’m verified apparently,aug 9 2023  612 pm utc,0.0,0.0,0.0,0.0,1.0,0,0,0.0,0,0.666918158531189
ScotiabankHelps,hey we have sent you a dm and will continue to chat there ds,Hey. We have sent you a DM and will continue to chat there. ^DS,aug 9 2023  536 pm utc,0.0,0.0,0.5,0.0,0.5,0,0,0.0,0,0.6113658547401428
Ashleig03919515,as you dont follow me and im not verified it will not allow me to can you dm me,As you don’t follow me and I’m not verified it will not allow me to. Can you dm me,aug 9 2023  532 pm utc,0.0,0.0,0.0,0.0,1.0,1,0,-0.1695,0,0.5556556582450867
Ashleig03919515,scotiabankhelps been trying to talk to a manager or supervisor for months been promised phone calls that never come i would like to talk to someone asap,@ScotiabankHelps been trying to talk to a manager or supervisor for months been promised phone calls that never come. I would like to talk to someone asap.,aug 9 2023  528 pm utc,0.0,0.0,0.0,1.0,0.0,3,2,0.1002,-1,0.8458763957023621
ScotiabankHelps,good afternoon and thank you for connecting with scotiabank canada we would be happy to look into your international gic refund please feel free to send us a dm so we can assist you sc,Good afternoon and thank you for connecting with Scotiabank Canada. We would be happy to look into your International GIC Refund please feel free to send us a DM so we can assist you ^SC,aug 9 2023  446 pm utc,0.5,0.0,0.0,0.0,0.5,10,5,0.9287,1,0.9665502905845642
PrajapatiHappy,hi i had opened gic account in your bank in 2020  and i applied for refund on 29th april 2023 but i didnt receive refund yet however i sent mail on your mail address and i didnt get any response there why my refutis getting late,HiI had opened GIC account in your bank in 2020 .And i applied for refund on 29th april 2023 but i didnt receive refund yet. However i sent mail on your mail address and i didnt get any response there. Why my refutis getting late?,aug 9 2023  443 pm utc,0.0,0.0,0.17,0.33,0.5,0,2,0.0,-1,0.7972072958946228
ScotiabankHelps,hi cat were sorry to learn that youre seeing unauthorized charges from google if there was no trial period games etc purchased from google you may reach out to our fraud department 247 at 18008136602 otherwise you can send us a dm for assistance kw tweetwhateveritworksorgmessagescompose,Hi Cat. Were sorry to learn that youre seeing unauthorized charges from Google. If there was no trial period games etc. purchased from Google you may reach out to our Fraud Department 24/7 at 1-800-813-6602. Otherwise you can send us a DM for assistance. KW tweet.whateveritworks.org/messages/compose…,aug 9 2023  151 pm utc,0.17,0.0,0.0,0.17,0.67,-7,-2,-0.8074,0,0.5041264891624451
ScotiabankHelps,hi there we have followed you please send us a dm to continue our chat rj,Hi thereWe have followed you. Please send us a DM to continue our chat. ^RJ,aug 9 2023  1255 pm utc,0.0,0.0,0.0,0.0,1.0,1,0,0.3182,0,0.6683726906776428
i3seel,contact me a person to buy a computer and he forged and fraudulently used the banks name,Contact me a person to buy a computer and he forged and fraudulently used the banks name.,aug 9 2023  1229 pm utc,0.0,0.0,0.0,0.0,1.0,0,-1,0.0,-1,0.9294652342796326
i3seel,plz write dm,Plz write dm,aug 9 2023  1228 pm utc,0.0,0.0,0.0,0.0,1.0,0,0,0.0772,0,0.9485650062561035
ScotiabankHelps,hi there we would like more info please send us a dm to continue our chat rj,Hi thereWe would like more info. Please send us a DM to continue our chat. ^RJ,aug 9 2023  1226 pm utc,0.0,0.0,0.0,0.0,1.0,3,1,0.6222,0,0.8103262186050415
i3seel,scotiabankhelps there is a person who commits fraud against people in the name of the bank forges documents and i have all the evidence,@ScotiabankHelps There is a person who commits fraud against people in the name of the bank forges documents and I have all the evidence.,aug 9 2023  1224 pm utc,0.0,0.0,0.0,0.0,1.0,-3,-1,-0.5719,-1,0.9659906625747681
ScotiabankHelps,hello bigger thank you for reaching out to us today were sorry to hear you feel this way please let us know if there is anything we can assist you with rm,Hello bigger Thank you for reaching out to us today. Were sorry to hear you feel this way. Please let us know if there is anything we can assist you with.^RM,aug 9 2023  1202 pm utc,0.0,0.0,0.0,1.0,0.0,3,0,0.6486,1,0.686676025390625
ScotiabankHelps,hello we have replied to your dm and will continue our chat there ds,Hello We have replied to your DM and will continue our chat there. ^DS,aug 9 2023  1200 pm utc,0.0,0.0,0.0,0.0,1.0,0,0,0.0,0,0.7136754393577576
summergirl776,annoying thank you for the update hope it gets worked out for you i redownloaded the app took off 2 step verification readded it and then i could log in,Annoying. Thank you for the update. Hope it gets worked out for you. I redownloaded the app took off 2 step verification re-added it and then I could log in.,aug 9 2023  1012 am utc,0.0,0.0,0.0,0.33,0.67,2,1,0.4019,0,0.8542026877403259
