username,tweet_text,tweet_raw,date,happy,angry,surprise,sad,fear,afinn,bing,sid,bertweet,bertweet_confidence
AvoidAmazon,lol thank you for censoring my comment it just shows the world you have lots of hide,lol. Thank you for censoring my comment. It just shows the world you have lots of hide.,jul 18 2022  548 pm utc,0.0,0.33,0.0,0.33,0.33,4,1,0.5574,-1,0.8901962041854858
track202020,called plates,Called plates,jul 16 2022  1056 pm utc,0.0,0.0,0.0,0.0,0.0,0,0,0.0,0,0.9185194969177246
Ripley49952702,if you want to save resources standardize takeout containers and recycle them to industrial cleaningwashing factories,If you want to save resources standardize take-out containers and recycle them to industrial cleaning/washing factories.,jul 15 2022  759 pm utc,0.0,0.0,0.0,0.0,0.0,3,0,0.5423,0,0.8026432991027832
woodytobiasii,isnt this tupperware,Isnt this tupperware?,jul 15 2022  701 pm utc,0.0,0.0,0.0,0.0,0.0,0,0,0.0,0,0.9418234825134277
Terrainstar,get your money out of government controlled banks,Get your money out of government controlled banks,jul 15 2022  611 pm utc,0.0,0.0,0.0,0.0,1.0,0,0,0.0,-1,0.7597312331199646
tweettwattoot,not with that craptastic virtue signaling avatar gfy,Not with that craptastic virtue signaling avatar! GFY!,jul 15 2022  1103 am utc,0.0,0.0,0.0,0.0,0.0,0,1,0.4215,-1,0.9715328216552734
naughtydaddysk,rip these big banks a new asshole,Rip these big banks a new asshole!!!!!!!!,jul 14 2022  609 pm utc,0.0,0.0,0.0,0.0,1.0,-3,-1,0.0,-1,0.9766528606414795
AvoidAmazon,dont forget to censor my comments i would be disappointed if you didnt,Don’t forget to censor my comments. I would be disappointed if you didn’t.,jul 14 2022  548 pm utc,0.0,0.33,0.0,0.33,0.33,-5,-1,0.0119,-1,0.7844115495681763
AvoidAmazon,dont forget to mention your profits will increase with inflation with the rising interest rates pretty sweet deal right scotiabank,Don’t forget to mention your profits will increase with inflation with the rising interest rates. Pretty sweet deal right Scotiabank?,jul 14 2022  548 pm utc,0.5,0.25,0.0,0.0,0.25,4,3,0.9333,-1,0.5549232363700867
iammaiacassidy,i need a humans rights lawyer i previously had a criminal defense attorney who advised me to pursue a human rights lawyer i have received a call back this morning  unfortunately while i was working out  had my phone on do not disturb im playing phone tag at the moment,I need a humans rights lawyer. I previously had a criminal defense attorney who advised me to pursue a human rights lawyer. I have received a call back this morning -- unfortunately while I was working out & had my phone on do not disturb. Im playing phone tag at the moment.,jul 14 2022  518 pm utc,0.0,0.0,0.1,0.2,0.7,-5,-3,-0.5624,-1,0.663455605506897
Alwaysworking9,time for lawyers,Time for lawyers,jul 14 2022  516 pm utc,0.0,0.0,0.0,0.0,0.0,0,0,0.0,0,0.9434708952903748
iammaiacassidy,theres a scene in grace  frankie where janefonda screams in the grocery store because shes being blatantly ignored thats what this feels like,Theres a scene in Grace & Frankie where @Janefonda screams in the grocery store because shes being blatantly ignored. Thats what this feels like.,jul 14 2022  504 pm utc,0.0,0.0,0.0,1.0,0.0,-1,1,0.2023,-1,0.674748957157135
iammaiacassidy,you forgot to censor the comment scotiabank,You forgot to censor the comment Scotiabank.,jul 7 2022  1048 pm utc,0.0,0.5,0.0,0.0,0.5,-2,0,-0.4588,-1,0.7480617165565491
AvoidAmazon,they like to pretend that they dont discriminate but they actually discriminate go figure,They like to pretend that they don’t discriminate but they actually discriminate. Go figure.,jul 13 2022  1214 pm utc,0.0,0.0,0.0,0.0,0.0,1,-2,0.1406,-1,0.862595796585083
AvoidAmazon,no they wont scotiabank takes no accountability for anything im surprised they havent censored you yet they do it to me often,No they won’t. Scotiabank takes no accountability for anything. I’m surprised they haven’t censored you yet. They do it to me often.,jul 13 2022  1212 pm utc,0.0,0.0,0.67,0.0,0.33,-4,0,-0.2631,-1,0.9723039865493774
AvoidAmazon,you should censor this comment too scotiabank im happy to keep your social media people busy whatever i can do to help with employment,You should censor this comment too Scotiabank. I’m happy to keep your social media people busy. Whatever I can do to help with employment.,jul 12 2022  407 pm utc,0.25,0.0,0.0,0.0,0.75,3,1,0.5267,0,0.745766282081604
AvoidAmazon,dont forget to censor this comment too,Don’t forget to censor this comment too,jul 12 2022  1208 am utc,0.0,0.5,0.0,0.0,0.5,-3,0,0.4847,0,0.7887954115867615
RileyMarshallTO,hey will anybody be managing that account and respond to this ongoing discrimination havent seen any interaction yet,Hey will anybody be managing that account and respond to this ongoing discrimination? Haven’t seen any interaction yet….,jul 11 2022  1036 pm utc,0.0,0.0,0.33,0.0,0.67,0,-1,0.0,-1,0.5507835149765015
iammaiacassidy,are we just not going to talk about this,Are we just not going to talk about this?,jul 7 2022  1048 pm utc,0.0,0.0,0.0,0.0,0.0,0,0,0.0,-1,0.6521878838539124
iammaiacassidy,and stop censoring people scotiabank because youre sensitive about criticism,And stop censoring people scotiabank because you’re sensitive about criticism.,jul 11 2022  719 pm utc,0.0,0.0,0.0,0.0,1.0,-3,0,-0.6249,-1,0.5809078812599182
iammaiacassidy,sounds great but lower your fees and interest rates scotiabank,Sounds great but… lower your fees and interest rates Scotiabank.,jul 7 2022  1048 pm utc,1.0,0.0,0.0,0.0,0.0,4,1,0.5789,0,0.4865170121192932
AvoidAmazon,please take that rainbow off your profile you are pissing off current employees and customers woke,Please take that rainbow off your profile. You are pissing off current employees and customers. #woke,jul 11 2022  334 pm utc,0.0,1.0,0.0,0.0,0.0,-2,0,-0.1027,-1,0.9759404063224792
AvoidAmazon,lol you blocked me again cowards,Lol. You blocked me again. Cowards!,jul 11 2022  334 pm utc,0.0,0.0,0.0,0.0,0.0,2,0,0.1779,-1,0.9427814483642578
TraderMike16,lol blocked again,Lol. Blocked again. 🖕,jul 11 2022  1034 am utc,0.0,0.0,0.0,0.0,0.0,2,0,0.1779,-1,0.8794556856155396
AvoidAmazon,good for the tuna,Good for the Tuna!,jul 11 2022  137 am utc,0.0,0.0,0.0,0.0,0.0,3,1,0.4404,1,0.9389105439186096
AvoidAmazon,why i can not still access online account with scotiabank,Why I can not still access online account with Scotiabank,jul 10 2022  615 pm utc,0.0,0.0,0.0,0.0,1.0,0,0,0.0,-1,0.9470632672309875
ilse31046,please sue them i cannot stand this bank,Please sue them. I cannot stand this bank,jul 10 2022  348 pm utc,0.0,0.0,0.0,0.0,1.0,1,-1,0.3182,-1,0.9828186631202698
TigercashTch,the bank respects no one i hope they get sued,The bank respects no one. I hope they get sued,jul 10 2022  1017 am utc,0.33,0.0,0.0,0.0,0.67,1,-1,0.4588,-1,0.9810642004013062
AvoidAmazon,the bank is horrible,The bank is horrible,jul 10 2022  130 am utc,0.0,0.0,0.0,0.0,1.0,-3,-1,-0.5423,-1,0.980664849281311
AvoidAmazon,the bank is run by scumbags i hope they get sued,The bank is run by scumbags. I hope they get sued,jul 10 2022  128 am utc,0.0,0.0,0.0,0.0,1.0,2,-1,0.4404,-1,0.9827856421470642
AvoidAmazon,because they have billions to pay out please sue them the bank deserves it,Because they have billions to pay out. Please sue them. The bank deserves it.,jul 10 2022  127 am utc,0.0,0.0,0.0,0.0,1.0,0,-1,0.2263,-1,0.9028578996658325
AvoidAmazon,high fees scrotumbank thanks for the censorship hide,High fees Scrotumbank. Thanks for the censorship. Hide!!!,jul 10 2022  127 am utc,0.0,0.5,0.0,0.0,0.5,1,0,0.296,-1,0.9680172204971313
AvoidAmazon,let iammaiacassidy make her transfer and apologize to her stop breaking the law and your terms of service and treat all sex workers with respect,Let @iammaiacassidy make her transfer and apologize to her! Stop breaking the law and your terms of service and treat all sex workers with respect!,jul 10 2022  126 am utc,0.17,0.0,0.5,0.33,0.0,-2,0,0.6124,-1,0.5235875248908997
AvoidAmazon,youre going to get bombarded with this until you publicly apologize firm up policies to prevent this discrimination and compensate maia for the stress youve caused disgusting behavior from a bank,You’re going to get bombarded with this until you publicly apologize firm up policies to prevent this discrimination and compensate Maia for the stress you’ve caused. Disgusting behavior from a bank.,jul 10 2022  124 am utc,0.0,0.0,0.0,0.4,0.6,-5,-3,-0.6908,-1,0.9738522171974182
orange_sporange,why arent you allowing people who work using onlyfans as a platform bank with you even though you legally have no right to deny them their banking service,Why arent you allowing people who work using onlyfans as a platform bank with you even though you legally have no right to deny them their banking service?,jul 9 2022  1120 pm utc,0.0,0.0,0.0,0.0,1.0,-2,1,-0.4939,0,0.6379147171974182
FreeToucanSam,what is wrong with you,What is wrong with you?,jul 9 2022  222 pm utc,0.0,0.0,0.0,0.0,0.0,-2,-1,-0.4767,-1,0.9695072174072266
Herbert_Sama,why scotiabankbb app would need to manage my phone calls,Why @ScotiabankBB app would need to manage my phone calls?,nov 12 2019  135 pm utc,0.0,0.0,0.0,0.0,1.0,0,0,0.0,-1,0.7965989112854004
Leekee,they gotta do better man,They gotta do better man 😩,oct 27 2019  527 am utc,0.0,0.0,0.0,0.0,0.0,2,1,0.4404,-1,0.6605938076972961
ianaadu,let go of their neck sir,Let go of their neck sir 😭😂😭😂,oct 27 2019  527 am utc,0.0,0.0,0.0,0.0,1.0,0,0,0.0,0,0.9180283546447754
Leekee,we deserve a better app scotiabankbb,We deserve a better app @ScotiabankBB,oct 26 2019  831 pm utc,0.0,0.0,0.0,0.0,0.0,2,1,0.4404,1,0.5984004735946655
Serena_Walker,scotiabankbb this after your agent on the phone last night says he can see the funds were not given and the account should be corrected by midnight,@ScotiabankBB this after your agent on the phone last night says he can see the funds were not given and the account should be corrected by midnight,oct 15 2019  543 pm utc,0.0,0.0,0.33,0.0,0.67,0,0,0.0,0,0.6034092307090759
Serena_Walker,scotiabankbb you guys have to do better you raised your fees and basically removed interest and i said nothing but this i go to your atm do not get the money and you are saying it is going to take 30 to 90 days to complete the dispute your kidding right,@ScotiabankBB you guys have to do better.... You raised your fees and basically removed interest and I said nothing.... But this... I go to your ATM do NOT get the money and you are saying it is going to take 30 to 90 days to complete the dispute. Your kidding right?,oct 15 2019  542 pm utc,0.43,0.0,0.0,0.14,0.43,1,1,0.0,-1,0.9709077477455139
xBlack_white_x,cibcfcibbb scotiabankbb look at what your age mates across the sea are doing,@CIBCFCIBBB @ScotiabankBB look at what your age mates across the sea are doing,sep 26 2019  237 pm utc,0.0,1.0,0.0,0.0,0.0,0,0,0.0,0,0.9425948858261108
TrashyHag,fcib would surely welcome a boss like you,FCIB would surely welcome a boss like you.,sep 11 2019  759 pm utc,1.0,0.0,0.0,0.0,0.0,4,2,0.8126,1,0.9887520670890808
SF3frankie,ask about maintenance fees which may come with the various account types,Ask about maintenance fees which may come with the various account types.,sep 11 2019  516 pm utc,0.0,0.0,0.0,0.0,1.0,0,0,0.0,0,0.9461226463317871
closenoug,but when and if they dont bring contactless one time then just bin it and that app is a mess idk how they not shame,But when? And if they don’t bring contactless one time then just bin it. And that app is a mess. Idk how they not shame,sep 9 2019  825 pm utc,0.0,0.5,0.0,0.5,0.0,-4,-2,-0.1328,-1,0.9576530456542969
xBlack_white_x,chip is definitely coming but contactless  i want an app that actually looks like time and effort was placed into making it happen not a web wrapper,Chip is definitely coming but Contactless?? 🥴I want an app that actually looks like time and effort was placed into making it happen... not a web wrapper.,sep 9 2019  649 pm utc,0.0,0.0,0.2,0.4,0.4,3,1,0.6757,0,0.7084631323814392
Brandysull,the day scotiabankbb  scotiacaribbean has a debit card w a chip  contactless is when ill rate them again,The day @ScotiabankBB / @ScotiaCaribbean has a debit card w/ a chip & contactless is when I’ll rate them again,sep 9 2019  648 pm utc,0.33,0.0,0.0,0.33,0.33,-2,0,-0.4215,0,0.8200488090515137
Reneh,seriously jesus scotiacaribbean i would like an answer,Seriously!? Jesus. @ScotiaCaribbean I would like an answer,sep 9 2019  405 pm utc,0.0,0.0,0.0,0.0,0.0,3,1,0.2023,-1,0.5404093265533447
lukeyism,it has gotten so inconvenient to do business with them i considering moving my account,It has gotten so inconvenient to do business with them I considering moving my account.,sep 9 2019  358 pm utc,0.0,0.0,0.0,0.33,0.67,-2,0,-0.4795,-1,0.9634552001953125
anomalycc,how much money i need to open an account at scotiabank scotiabankbb,How much money I need to open an account at Scotiabank? @ScotiabankBB,sep 9 2019  354 pm utc,0.0,0.0,0.0,0.0,1.0,0,0,0.0,0,0.9714986085891724
lukeyism,we need it in barbados too scotiabankbb cibcfcibbb republicbankbb,We need it in Barbados too @ScotiabankBB @CIBCFCIBBB @republicbankbb,sep 9 2019  349 pm utc,0.0,0.0,0.0,0.0,0.0,0,0,0.0,0,0.7852054238319397
lukeyism,931 on hold and counting for scotiabankbb scotiabank to address my fraud alert that they called me about this is not service this is a nuisance,9.31 on hold and counting for @ScotiabankBB @scotiabank to address my fraud alert that they called me about. This is NOT service. This is a nuisance.,sep 3 2019  646 pm utc,0.0,0.0,0.0,0.0,1.0,-5,-2,-0.3818,-1,0.9769452810287476
BajanCallie,cant blame you thats ridiculous i get that banking is an expensive venture but at some point they need to realize they cant get blood out of stone offer better products that encourage more loans,Can’t blame you. That’s ridiculous. I get that banking is an expensive venture but at some point they need to realize they can’t get blood out of stone. Offer better products that encourage more loans.,aug 24 2019  649 pm utc,0.0,0.0,0.4,0.0,0.6,-1,-1,0.8429,-1,0.778617262840271
BajanCallie,theyre also purposely changing the atms so you must have an account with them in order to pay loanscredit cards accounts that have ridiculous monthly fees i find that sickening considering the high interest rates on said loanscredit cards scotiabankbb think dem smart,They’re also purposely changing the ATMs so you MUST HAVE an account with them in order to pay loans/credit cards. Accounts that have *ridiculous* monthly fees. I find that sickening considering the high interest rates on said loans/credit cards. @ScotiabankBB think dem smart,aug 24 2019  1054 am utc,0.2,0.0,0.0,0.2,0.6,-2,-1,-0.1531,-1,0.9686455726623535
Brandysull,maybe nows the time to make that move to jamaica citizen of carico wait,maybe nows the time to make that move to Jamaica citizen of CARICO- wait.,aug 23 2019  1013 pm utc,0.0,0.0,0.5,0.5,0.0,0,0,0.0,0,0.9108676314353943
xBlack_white_x,scotiabankbb cibcfcibbb look at what your age mates are doing overseas,@ScotiabankBB @CIBCFCIBBB look at what your age mates are doing overseas,aug 23 2019  1012 pm utc,0.0,1.0,0.0,0.0,0.0,0,0,0.0,0,0.907926082611084
Brandysull,only 24 hrs lucky its not days,Only 24 hrs? Lucky its not days,aug 23 2019  200 pm utc,1.0,0.0,0.0,0.0,0.0,3,1,0.4215,1,0.5344836711883545
TheSocaWarrior,scotiabankbb i dont understand wunna at all implementing everything backwards,@ScotiabankBB I don’t understand wunna at all. Implementing everything backwards,aug 8 2019  108 pm utc,0.0,0.0,0.0,0.0,0.0,0,0,0.0,-1,0.976402997970581
xBlack_white_x,cibcfcibbb scotiabankbb look at what your age mates are doing in the other islands,@CIBCFCIBBB @ScotiabankBB look at what your age mates are doing in the other islands.,jul 23 2019  728 pm utc,0.0,1.0,0.0,0.0,0.0,0,0,0.0,0,0.9390818476676941
xBlack_white_x,scotiabankbb and while youre at it include contactless too,@ScotiabankBB and while you’re at it include contactless too.,jul 19 2019  358 am utc,0.0,0.0,0.0,0.0,0.0,0,0,0.0,1,0.5044851303100586
LoopJamaica,cgirlzhack barbados kicks off with tree planting tree at schools to contribute to climatesafefuturesafe cgirlsinict showing us how to get it done 1treeatatime beempowered futuresafegirls girlsinict loopnewsbb scotiabankbb wearyandy taituh allysonleacock uneclacpos,@cgirlzhack Barbados kicks off with tree planting tree at schools to contribute to #climatesafefuturesafe! @CGirlsinict showing us how to get it done #1TreeAtATime! #BeEmpowered #FutureSafeGirls#GirlsInICT@LoopNewsBB @ScotiabankBB @wearyandy @TaituH @AllysonLeacock @UNECLACPOS,jul 19 2019  1200 am utc,0.0,0.0,1.0,0.0,0.0,0,0,0.0,1,0.7376036047935486
xBlack_white_x,i wont repeat anything,i wont repeat anything !,jul 10 2019  1255 am utc,0.0,0.0,0.0,0.0,0.0,0,0,0.0,0,0.8610714673995972
bridgelewis25,best to let the page handle that not at liberty to speak on behalf of the bank,Best to let the page handle that. Not at liberty to speak on behalf of the bank.,jul 6 2019  1252 am utc,0.0,0.0,0.0,0.0,1.0,3,2,0.3451,0,0.9312440156936646
CGirlsinict,does he work at scotia i want answers fr,Does he work at scotia? I want answers fr 🤣,jul 5 2019  131 am utc,0.0,0.0,0.0,0.0,1.0,1,1,0.0772,0,0.9745702743530273
bds_angelo,its 2019 why isnt it atleast chip and yall pos machines hsve contactless enabled scotiabankbb make it make sense,It’s 2019.. why isn’t it atleast chip. And yall pos machines hsve contactless enabled... @ScotiabankBB make it make sense,jul 4 2019  1034 pm utc,0.0,0.0,0.0,0.75,0.25,0,0,0.0,0,0.6090373992919922
xBlack_white_x,scotiabankbb get with the programme,@ScotiabankBB get with the programme !,jul 4 2019  533 pm utc,0.0,0.0,0.0,0.0,0.0,0,0,0.0,0,0.8211829662322998
inalaennit,doesnt matter whether youre a woman or man if you think barbadians need to lead healthier lifestyles come learn and plan with us dcscant connelldr qehconnect rihanna digicelbarbados barbadostoday chefette246 burgerkingtt chickenbarnbb scotiabankbb undpbarbados,Doesn’t matter whether you’re a woman or man- if you think Barbadians need to lead healthier lifestyles come learn and plan with us. @dcscant @ConnellDr @qehconnect @rihanna @digicelbarbados @BarbadosToday @Chefette246 @BurgerKingTT @ChickenBarnBB @ScotiabankBB @UNDPBarbados,jul 4 2019  532 pm utc,0.0,0.0,0.0,0.0,1.0,1,1,-0.0191,1,0.5706841945648193
xBlack_white_x,scotiabankbb why on the last day of the month do you have a promotion for a isuzu dmax taking up 3 parking spaces  your hastings branch when spaces are already so limited in that complex,@ScotiabankBB why on the last day of the month do you have a promotion for a Isuzu Dmax taking up 3 Parking spaces @ your hastings branch when spaces are already so limited in that complex?,jul 4 2019  529 pm utc,0.17,0.0,0.33,0.0,0.5,-1,-2,-0.3593,-1,0.7191434502601624
xBlack_white_x,hello we are sorry to learn of your experience with scotiabank please feel free to connect with our partners scotiabankbb should you wish to speak with us further vr,Hello we are sorry to learn of your experience with Scotiabank. Please feel free to connect with our partners @ScotiabankBB should you wish to speak with us further. ^VR,jul 2 2019  524 pm utc,0.25,0.0,0.0,0.25,0.5,2,0,0.7906,0,0.5917355418205261
VisaSecurity,scotiabankbb when yall really plan to upgrade your debit cards look at what your age mates are doing,@ScotiabankBB when yall really plan to upgrade your debit cards? Look at what your age mates are doing !,jul 2 2019  230 pm utc,0.0,1.0,0.0,0.0,0.0,0,0,0.0,0,0.960904061794281
RraPang,honestly scotiabankbb i believe that you lot should include a mandatory psychological evaluation as part of your hiring process cuz this is unreal same for cibc_fcib,Honestly @ScotiabankBB I believe that you lot should include a mandatory psychological evaluation as part of your hiring process. Cuz this is unreal. Same for @CIBC_FCIB .,jun 25 2019  742 pm utc,0.0,0.0,0.0,1.0,0.0,-1,1,0.5106,-1,0.9625192880630493
xBlack_white_x,wonder when scotiabankbb is gonna upgrade their debit cards 2019 and still no chip,Wonder when @ScotiabankBB is gonna upgrade their debit cards. 2019 and still no chip?,jun 25 2019  742 pm utc,0.0,0.0,0.5,0.5,0.0,-1,1,-0.296,0,0.5180229544639587
neiltaggart,irony when the bank takes so long to process your refinancing that they delay the process even more because the docs you originally submitted are out of date scotiabankbb useless,Irony: when the bank takes so long to process your refinancing that they delay the process even more because the docs you originally submitted are out of date. @ScotiabankBB #useless,jun 6 2019  206 pm utc,0.0,0.0,0.25,0.25,0.5,-4,-3,-0.6486,-1,0.9741795063018799
yaksemaj,scotiabankbb 13 at warrens,@ScotiabankBB 1/3 at Warrens.,may 28 2019  1158 pm utc,0.0,0.0,0.0,0.0,0.0,0,0,0.0,0,0.9558945894241333
yaksemaj,scotiabankbb 03 atms at skymall working for deposits this morning will there be a refund on monthly service fees to compensate for the time wasted and inconvenience,@ScotiabankBB 0/3 ATMs at SkyMall working for deposits this morning. Will there be a refund on monthly service fees to compensate for the time wasted and inconvenience?,may 28 2019  400 pm utc,0.0,0.0,0.0,0.0,1.0,-4,-1,-0.6908,-1,0.5995022058486938
LiLiSutherland,thank you so helpful,Thank you so helpful!,may 3 2019  214 pm utc,1.0,0.0,0.0,0.0,0.0,4,2,0.6801,1,0.9847782254219055
LiLiSutherland,scotiabankbb,@ScotiabankBB,may 3 2019  1141 am utc,0.0,0.0,0.0,0.0,0.0,0,0,0.0,0,0.9078584313392639
GtotheX,anyone banking with scotiabankbb or scotiabank get out backwardthinking,Anyone banking with @ScotiabankBB or @scotiabank GET OUT!!!!! #Backwardthinking,may 1 2019  1211 am utc,0.0,0.0,0.0,0.0,1.0,0,0,0.0,-1,0.9512718319892883
GtotheX,scotiabankbb  scotiabank im in disgust with your bank,@ScotiabankBB .... @scotiabank I’m in disgust with your bank,may 1 2019  1207 am utc,0.0,0.0,0.0,0.5,0.5,-3,-1,-0.5994,-1,0.9817326664924622
GtotheX,a customer has an account for over 30 years and you treat them like crap noloyalty scotiabankbb,A customer has an account for over 30 years and you treat them like crap... #Noloyalty @ScotiabankBB,may 1 2019  1204 am utc,0.0,0.0,0.67,0.0,0.33,-1,0,0.3818,-1,0.9794238805770874
GtotheX,scotiabankbb i hope all your shares fall through the ground you should be embarrassed,@ScotiabankBB I hope all your shares fall through the ground. You should be embarrassed,may 1 2019  1200 am utc,0.0,0.0,0.0,0.0,1.0,1,-1,0.3818,-1,0.9812906384468079
GtotheX,scotiabankbb has to be the worst bank on the planet your backwards thinking will be the end of you im going to make that everyone i know in every country see that to never use any scotiabank just because of your incompetence,@ScotiabankBB has to be the worst bank on the planet. Your BACKWARDS thinking will be the end of you. I’m going to make that EVERYONE I know in every country see that to NEVER use any scotiabank just because of your incompetence,apr 30 2019  1156 pm utc,0.0,0.0,0.0,0.67,0.33,-5,-2,-0.8126,-1,0.9832762479782104
ScotiabankHelps,hello we have noticed your tweet to ensure your feedback is reviewed we recommend connecting with our partners at scotiabank barbados you may message them at their handle scotiabankbb kind regards vr,Hello we have noticed your tweet. To ensure your feedback is reviewed we recommend connecting with our partners at Scotiabank Barbados. You may message them at their handle @ScotiabankBB. Kind regards. ^VR,apr 26 2019  212 pm utc,0.33,0.0,0.0,0.0,0.67,5,1,0.8176,0,0.7097911238670349
Saucemane,man scotiabankbb is terrible,Man @ScotiabankBB is terrible,apr 25 2019  543 pm utc,0.0,0.0,0.0,0.0,1.0,-3,-1,-0.4767,-1,0.9811171889305115
pmagn,dirty secret in your investment portfolio how you invest your savings might just be the single most important determinant of your carbon footprint stocks market dow tsx investments pensions bank dirty little blogcopowermenewsyourpo,dirty secret in your investment portfolio:How you invest your savings might just be the single most important determinant of your carbon footprintStocks market Dow tsx investments pensions bank dirty littleblog.copower.me/news/your-po…,mar 22 2019  308 am utc,0.11,0.22,0.11,0.0,0.56,-2,0,-0.4988,0,0.9134355783462524
pmagn,vancity coop vancouver n they have ff investment portfolios too genus investments vancouver and copower bonds ontario are a few,Vancity co-op Vancouver.. n they have FF investment portfolios too.Genus investments VancouverAnd coPower bonds Ontario are a few .,mar 22 2019  308 am utc,0.0,0.0,0.0,0.0,1.0,0,0,0.4215,0,0.97337406873703
JimBair62221006,many of us are indirectly funding climate chaos via these very banks  others does anyone have recommendations on good canadian alternatives we can all drive demand for alternatives while also advocating to reform the worst offenders,Many of us are indirectly funding climate chaos via these very banks & others.Does anyone have recommendations on good Canadian alternatives??We can all drive demand for alternatives while also advocating to reform the worst offenders.,mar 22 2019  252 am utc,0.0,0.0,0.0,0.2,0.8,-3,1,-0.836,-1,0.49427202343940735
JimBair62221006,time for td_canada td_directinvest rbc rbcwealth and scotiabank scotiabankjm scotiabankbb stop funding climate chaos climateemergency rbc td,time for .@TD_Canada @TD_DirectInvest .@RBC@RBCwealth and @scotiabank .@ScotiabankJM .@ScotiabankBB stop funding climate chaos#ClimateEmergency #rbc #td,mar 21 2019  907 pm utc,0.0,0.0,0.0,0.0,1.0,-3,-1,-0.7096,-1,0.5232549905776978
pmagn,yeah im not in barbados but thanks anyway,Yeah Im not in Barbados but thanks anyway...,mar 21 2019  1045 pm utc,0.0,0.0,0.0,0.0,0.0,3,0,0.6652,0,0.726671576499939
