username,tweet_text,date,happy,angry,surprise,sad,fear,afinn,bing,sid,bertweet,bertweet_confidence
Melrich24,batting springer cleanup  does our manager watch the games  holy cow,aug 5 2023  503 pm utc,0.0,0.0,0.67,0.33,0.0,0,1,0.0,0,0.8936633467674255
aNewLife444,need berrios to have a top tier game,aug 5 2023  502 pm utc,0.0,0.0,1.0,0.0,0.0,2,1,0.2023,0,0.7531797289848328
KyleTreats,john schneider playing a callup on back to back days,aug 5 2023  502 pm utc,0.5,0.0,0.0,0.0,0.5,0,0,0.2023,0,0.9265841245651245
ErnieCleMVP,springer cleanup,aug 5 2023  502 pm utc,0.0,0.0,0.0,0.0,0.0,0,0,0.0,0,0.9544591903686523
MuckFessier,when schneider hits another bomb on a 21 count in his first ab this game,aug 5 2023  501 pm utc,0.0,0.5,0.0,0.0,0.5,-1,-1,-0.4939,0,0.9639383554458618
VancouverTitans,dont forget to get tickets to our td_canada watch party tomorrow watch us dominate the sfshock    vancouvertitansggtdfanhu,aug 5 2023  100 am utc,0.0,0.33,0.67,0.0,0.0,-1,1,0.434,1,0.8772986531257629
prisMonroe,they actually said that wow,aug 5 2023  351 pm utc,0.0,0.0,1.0,0.0,0.0,4,1,0.5859,0,0.7249603271484375
bramptondtbia,jambana one world festival 2023 is happening in 3 days   join us from 1  9pm at gage park to celebrate emancipation day get a taste of the caribbean   jambanafestival td_canada citybrampton jonesjonesltd jambanafestival emancipationday downtownbrampton,aug 4 2023  801 pm utc,0.6,0.0,0.0,0.0,0.4,4,2,0.8442,1,0.8689699769020081
C_fabi_DC,winnable fighting shocktheworld,aug 5 2023  143 pm utc,0.0,0.0,0.0,1.0,0.0,0,1,0.0772,0,0.6879134774208069
bta1976,that is a bs article  td_canada and other banks have said completely useless  only ones getting these accounts are their richest customers  others can not save in this account along with tax free saving education saving retirement saving ect   then afford living day 2 day,aug 5 2023  1243 pm utc,0.43,0.0,0.0,0.0,0.57,1,0,0.2451,-1,0.967304527759552
WangBingwu,a paypal系統 接收方 donationchinaspringorg  b 國際電匯捐款 地址 1323 56 street delta bc v4l 2a6 canada 銀行名稱 加拿大td canada trust  銀行國際代碼 ccooo405740 7303554  接收方名稱 chinaspring democracy movement society 賬號 05740047303554,mar 10 2023  644 pm utc,0.0,0.0,0.0,0.5,0.5,1,1,0.5106,0,0.9748216271400452
WangBingwu,i know they arent i was just saying this would be a jays move for the way this year is going,mar 10 2023  634 pm utc,0.0,0.0,0.0,0.0,0.0,0,0,0.0,0,0.9290839433670044
WilliamHancock,i really thought getting the td visa infinite travel aeropoints card would help to any degree but no  aeroplan td_canada,aug 5 2023  836 am utc,0.0,0.0,0.0,0.0,0.0,1,0,-0.2382,-1,0.6921335458755493
Hoppcir,worked out,aug 5 2023  512 am utc,0.0,0.0,0.0,0.0,1.0,0,1,0.0,0,0.9482481479644775
GLaflower,markjcarney do believe that companies ignoring climatechange and globalwarming will go bankrupt pathwaysnetzero rbc td_canada ableg cdnpoli can 8 of  economy og handle a transition plan cafreeland s_guilbeault yes yes pembina ableg graph via drjamesehansen,aug 5 2023  432 am utc,0.0,0.33,0.33,0.0,0.33,-1,-1,-0.2263,-1,0.5194571614265442
MSchleinich,td_canada youre banks are fucking garbage,aug 5 2023  408 am utc,0.5,0.0,0.0,0.0,0.5,-4,-2,0.0,-1,0.982721745967865
KyleBak07548968,just a crazy thought,aug 5 2023  350 am utc,0.0,0.0,0.0,0.0,1.0,-2,-1,-0.34,0,0.8721548914909363
sefrook,jambana one world festival 2023 is happening in 3 days   join us from 1  9pm at gage park to celebrate emancipation day get a taste of the caribbean   jambanafestival td_canada citybrampton jonesjonesltd jambanafestival emancipationday downtownbrampton,aug 5 2023  309 am utc,0.6,0.0,0.0,0.0,0.4,4,2,0.8442,1,0.8689699769020081
bramptondtbia,i really liked the order of this lineup guys get on base for the top of the order,aug 4 2023  801 pm utc,0.0,0.0,0.5,0.5,0.0,4,2,0.5984,1,0.9852638244628906
2Future__,hello thank you for reaching out we can certainly understand how frustrating this would be please send us a dm so we can assist further with your application fd,aug 5 2023  229 am utc,0.0,0.33,0.0,0.0,0.67,2,0,0.6249,0,0.6814765930175781
TD_Canada,hes got rance mulliniks trending and for that i am grateful,aug 5 2023  217 am utc,1.0,0.0,0.0,0.0,0.0,3,1,0.4588,1,0.9851866364479065
keepfischin,td_canada good evening you are telling me im pre approved for a td visa but when i confirm my details you say my address isnt valid ive had the same address 21 years its whats on my alberta drivers licence wont let me past it can i go in branch and finish process,aug 5 2023  215 am utc,0.2,0.0,0.0,0.4,0.4,5,1,0.431,0,0.5680972337722778
JJaunzou,youre banned from our watch parties,aug 5 2023  137 am utc,0.0,0.0,0.5,0.5,0.0,-2,0,-0.0772,-1,0.895818829536438
VancouverTitans,idk why did you lose to them,aug 5 2023  136 am utc,0.0,0.0,0.0,1.0,0.0,0,-1,-0.4767,-1,0.8812648057937622
JJaunzou,why were you wearing a defiant jersey,aug 5 2023  131 am utc,0.0,0.0,0.0,0.0,0.0,-1,-1,-0.2263,0,0.8551937341690063
harjai6_,put bichette in instead of dejong then ill love it,aug 5 2023  126 am utc,0.33,0.0,0.0,0.33,0.33,1,1,0.34,1,0.9457927942276001
samsonxp_,probably samsonxp,aug 5 2023  110 am utc,0.0,0.0,0.0,0.0,1.0,0,0,0.0,0,0.9228595495223999
JJaunzou,this guy in all those photos is really hot and sexy and cool and awesome and probably good at winston what is his,aug 5 2023  103 am utc,0.25,0.0,0.25,0.25,0.25,11,5,0.918,1,0.986574113368988
bookersmancave,kk is faster though,aug 5 2023  1256 am utc,0.0,0.0,0.0,0.0,0.0,0,1,0.3612,0,0.8410601615905762
jmegan,heck yes he does nextlevel,aug 5 2023  1214 am utc,0.0,0.0,0.0,0.0,0.0,1,-1,0.4019,1,0.9630992412567139
Frosty2thumbs,so happy im watching this game,aug 4 2023  1151 pm utc,0.5,0.0,0.5,0.0,0.0,3,1,0.6115,1,0.9928170442581177
TD_Canada,great catch we can confirm the text you received is a smishing text please forward a screenshot of the text to phishingtdcom for our security teams to investigate further more information on protecting yourself online can be found here tinyurlcom4zkhcxnd kj,aug 4 2023  1138 pm utc,0.33,0.0,0.17,0.0,0.5,4,1,0.8316,1,0.6088957190513611
sonotolnow444,td_canada just thought id let you guys know total scam you guys would never send this,aug 4 2023  1132 pm utc,0.0,0.0,0.0,0.0,1.0,-2,-1,-0.5719,-1,0.9614557027816772
VancouverTitans,watch parties are back at thesportsbar_ra presented by td_canada   aug 5  sfshock  doors 230pm   get your tickets at vancouvertitansggwatchpar,jul 21 2023  1114 pm utc,0.0,0.0,1.0,0.0,0.0,0,0,0.4019,0,0.867699146270752
kgqncf625w,there isnt really a better option lets be real,aug 4 2023  1114 pm utc,0.0,0.0,0.0,1.0,0.0,2,1,-0.3865,0,0.7923381328582764
_TerrenceMeyers,what the heck did espinal do to deserve this treatment no one wanted to see bichette hurt but it finally looked like espy was going to get a steady opportunity,aug 4 2023  1109 pm utc,0.33,0.0,0.0,0.33,0.33,1,0,0.631,-1,0.9376364946365356
Jen29089919,biggio rarely plays so option him to bisons and try barger,aug 4 2023  1108 pm utc,0.0,0.0,0.0,0.0,1.0,0,0,-0.1877,0,0.95090651512146
Step_The_Hen,no theyre not related but it wouldve been funny if they were,aug 4 2023  1107 pm utc,0.0,0.0,1.0,0.0,0.0,3,-1,0.5023,1,0.4996464252471924
samsonxp_,mfw i eat an entire half  half of fried chicken for this w,aug 4 2023  1106 pm utc,0.0,0.0,0.0,0.0,1.0,0,-1,0.0,0,0.9232705235481262
VancouverTitans,dont forget to grab a nutritious snack to stay at your best   presented by td_canada  forceofnature  owl2023,aug 4 2023  1105 pm utc,0.0,1.0,0.0,0.0,0.0,2,1,0.7065,1,0.8923683762550354
libraryowl,i like a nice varsho bunt  he sure runs fast nextlevel,aug 4 2023  1100 pm utc,1.0,0.0,0.0,0.0,0.0,5,3,0.765,1,0.984274685382843
liftheavyeveryd,team is turning into a joke,aug 4 2023  1059 pm utc,0.5,0.0,0.5,0.0,0.0,2,-1,0.296,-1,0.970346987247467
ChuckMcJ,johnnysources is the real mvp here gate14pod,aug 4 2023  1046 pm utc,0.0,0.0,0.0,1.0,0.0,0,0,0.0,1,0.9722992181777954
elizabeth_d,hi td_canada and canrevagency im trying to pay a small amount in pit arrears from two different tax years for an elderly family member what on earth does this actually mean was it just never updated after 2017 and why wont it accept a 9 digit sin wo spaces as the acct,aug 4 2023  644 am utc,0.0,0.0,0.67,0.33,0.0,0,-1,-0.7339,-1,0.7268422842025757
DJGamble13X,alright folks how much we losing by today im thinking 82 boston,aug 4 2023  1043 pm utc,0.0,0.0,0.0,1.0,0.0,-3,-1,-0.1531,-1,0.6447914838790894
JohnWKowal1,why is guerrero untouchable move him way down 7th is where he belongs all he can do is hit 40 mph lob balls in the middle of the plate in a home run derby real pitchers make him look awful stop babysitting this manchild,aug 4 2023  1040 pm utc,0.2,0.2,0.0,0.6,0.0,-4,-1,-0.6369,-1,0.9418879151344299
306Jordan,please win thats the tweet,aug 4 2023  1038 pm utc,0.0,0.0,0.0,0.0,0.0,5,1,0.7269,1,0.8372427225112915
Trevor_m29,if he can hit with risp its worth a shot tbh,aug 4 2023  1033 pm utc,0.0,0.5,0.0,0.0,0.5,2,1,0.2263,0,0.6821280717849731
SHollywoodN,hes a 28th round nobody from 2017 that decided to hit last year and has been on a tear this season in aaa he wasnt a prospect until a minute ago last year he started his 5th year in the minors in a,aug 4 2023  1032 pm utc,0.0,0.33,0.0,0.33,0.33,1,0,-0.2235,0,0.9030043482780457
2Future__,davis please save our disappointing team from  a monumental collapse of a season,aug 4 2023  1029 pm utc,0.0,0.0,0.33,0.67,0.0,-1,-1,-0.2263,-1,0.9741257429122925
set921,the fact that im hoping davis saves this team speaks volumes,aug 4 2023  1029 pm utc,0.0,0.0,0.0,0.0,1.0,2,0,0.4215,1,0.8316770792007446
set921,makes sense hes there for his bat do he should be higher that the 2 defensive specialists,aug 4 2023  1028 pm utc,0.0,0.0,0.0,0.5,0.5,0,-1,0.0258,0,0.665697455406189
Jakester075,this jays lineup is ridiculous springer batting 2nd stupid he shouldve be moved to 8th or 9th the way he is hitting playing both catchers another stupid move kirk cant hit a beach ball  jansen is better so play him and forget kirk,aug 4 2023  1024 pm utc,0.0,0.5,0.17,0.0,0.33,-6,-2,-0.5242,-1,0.9755182266235352
GU3RNS,no gurriel has straight just been awful this year aside from his one month heater since may 15th hes hitting 220 varsho is hitting 200 but one is significantly better defensively can hate the trade all you want but gurriel was an all star based on one month hes been bad,aug 4 2023  1017 pm utc,0.0,0.4,0.0,0.6,0.0,-6,-2,-0.8608,-1,0.8769182562828064
SixtySevenWest,i dont know why you keep rolling out the 20 million a year automatic out there has to be a hot dog vendor that hits better than him somewhere in the stadium,aug 4 2023  1016 pm utc,0.0,0.5,0.0,0.5,0.0,2,2,0.4404,-1,0.6119261980056763
dr_butterballs,why,aug 4 2023  1015 pm utc,0.0,0.0,0.0,0.0,0.0,0,0,0.0,0,0.7436332106590271
NerfherderVI,jano batting cleanup  sure why not,aug 4 2023  1009 pm utc,0.0,0.0,1.0,0.0,0.0,0,0,0.3182,0,0.8286876678466797
WilliamHancock,its his brother,aug 4 2023  1006 pm utc,0.0,0.0,1.0,0.0,0.0,0,0,0.0,0,0.9330813884735107
EdwardJames1708,lets go bluejays here comes the big win streak,aug 4 2023  1004 pm utc,0.0,0.0,0.5,0.5,0.0,5,1,0.5859,1,0.9728863835334778
LFGBlueJays,why is the hell is the manager putting himself in the lineup anything to try and get this lineup going i guess,aug 4 2023  920 pm utc,0.0,0.0,0.5,0.5,0.0,-4,-1,-0.6808,-1,0.9476574659347534
Achiuwaseason,and a higher average than varsho still chills,aug 4 2023  944 pm utc,0.0,0.0,0.0,0.5,0.5,0,0,0.0,0,0.8714713454246521
Christalball93,i think manoah continues to improve last time he looked better before the hit batter and that was following 2 missed calls from ump his pitches were dancing as jomboy said haha,aug 4 2023  943 pm utc,0.0,0.2,0.0,0.6,0.2,5,1,0.765,1,0.9756217002868652
Ogopogo1,lets go need to sweep the sox,aug 4 2023  943 pm utc,0.0,0.0,0.0,1.0,0.0,0,0,0.0,1,0.9063709378242493
j_hall70,i like this lineup about time jansen is in the 4 hole,aug 4 2023  942 pm utc,0.0,0.0,0.0,1.0,0.0,2,1,0.3612,1,0.8805465698242188
Christalball93,jays need to do a better job of letting fans know who the prospects are i follow them daily and never heard of him,aug 4 2023  942 pm utc,0.0,0.0,0.0,0.5,0.5,3,2,0.6249,-1,0.5193857550621033
Sk8judgeDT,hopefully setting a spark in our bats,aug 4 2023  939 pm utc,0.0,0.0,0.5,0.0,0.5,3,0,0.5574,1,0.8039239645004272
Krossgaming1369,springer cant hit his own nut sack currently and hes in the 2 hole common johnny boy do better,aug 4 2023  939 pm utc,0.0,0.25,0.0,0.25,0.5,2,0,0.4404,-1,0.9538790583610535
sterling_short,varsh in the 9 finally,aug 4 2023  927 pm utc,0.0,0.0,0.0,0.0,1.0,0,0,0.0,0,0.6126216650009155
Airjans12,its beautiful,aug 4 2023  925 pm utc,1.0,0.0,0.0,0.0,0.0,3,1,0.5994,1,0.9838861227035522
StrikeRicher,can we also send down espinal and biggio and call up barger and horowitz,aug 4 2023  923 pm utc,0.0,0.0,0.0,0.0,1.0,0,0,0.0,0,0.9714064002037048
simmsstephen,flip whit and george and i could get on board with it,aug 4 2023  921 pm utc,0.0,0.5,0.0,0.0,0.5,0,0,0.0,1,0.7802801728248596
Amar_366,td_canada 449pm entry friday payday once again td is understaffed  without a business line  the fact that i come in here on a regular basis  dont see the same faces is an issue with hiring yonge n bloor needs veteran staff not rookie  exit time 51829min for banking,aug 4 2023  918 pm utc,0.0,0.25,0.0,0.0,0.75,0,-1,0.0,-1,0.9278031587600708
Achiuwaseason,all star player cope more,aug 4 2023  917 pm utc,0.0,0.0,0.0,0.0,0.0,0,0,0.0,0,0.7335222959518433
bookersmancave,question why is varsho getting way more playing time than kk kk is having a better offensive season as far as at least putting the bat to the ball and putting the ball in play hes better defensively he doesnt need that much rest time to sit varsho bluejays nextlevel,aug 4 2023  917 pm utc,0.0,0.0,0.0,0.5,0.5,4,1,0.8655,0,0.5150268077850342
bluejaysdomain,schneider in the lineup and no espinal or biggio its beautiful,aug 4 2023  803 pm utc,1.0,0.0,0.0,0.0,0.0,2,1,0.4019,1,0.9707642793655396
sabesankara,this is a good moved by jays hopefully work out,aug 4 2023  915 pm utc,0.0,0.0,0.0,0.0,1.0,5,2,0.6808,1,0.9870451092720032
dugongpotato1,any relation to john schneider,aug 4 2023  915 pm utc,0.0,0.0,0.0,0.0,0.0,0,0,0.0,0,0.9681290984153748
LangilleEli,springer at 2 with his hitting struggles is weird but jansen cleanup lets goooooo,aug 4 2023  913 pm utc,0.0,0.5,0.0,0.5,0.0,-4,-2,-0.2732,0,0.6809172630310059
DomCal1,now starting the timer td_canada  to see how long until someone pretends not to notice the blk guy in the wheelchair at the accessible counter last weeks timer was 21 min and 6 staff walking past 15 times,aug 4 2023  911 pm utc,0.0,0.0,0.0,0.5,0.5,-1,1,-0.1027,0,0.8831173181533813
salesmode1,i thought we were supposed to win more games and score more runs with whit in leadoff spot what happened,aug 4 2023  910 pm utc,0.0,0.25,0.0,0.0,0.75,4,1,0.5859,0,0.8669573068618774
RMancock,schneider should be batting ahead of kirk lmao,aug 4 2023  910 pm utc,0.0,0.0,1.0,0.0,0.0,4,0,0.5994,0,0.9432011842727661
Wrigley_pain23,i agree hes got so much power,aug 4 2023  909 pm utc,0.0,1.0,0.0,0.0,0.0,1,0,0.3612,1,0.9624935984611511
dvlspitchfork5,defensivelyvery nice hittingwell see,aug 4 2023  906 pm utc,1.0,0.0,0.0,0.0,0.0,3,1,0.4215,1,0.9667216539382935
soleskywho,yall can get stoked about the lineup all you want but manoah is pitching,aug 4 2023  906 pm utc,0.0,0.0,0.0,1.0,0.0,1,0,0.0387,1,0.6060226559638977
mcdraibouchbomb,if he grounds out with runners in scoring position it will be an upgrade on the swing and miss from the core,aug 4 2023  903 pm utc,0.0,0.25,0.25,0.25,0.25,-2,-1,-0.1531,0,0.6622146368026733
boston_sports88,lets go red sox,aug 4 2023  903 pm utc,0.0,0.5,0.0,0.5,0.0,0,0,0.0,1,0.6291418075561523
deeznutz6969693,mid lineup  loss incoming  finished   owned,aug 4 2023  900 pm utc,0.0,0.0,0.0,0.0,0.0,-3,-1,-0.3182,-1,0.7957114577293396
FinnOilersJays,best of luck to davis schneider tonight heres hoping that this will provide a boost of some sort to the offence,aug 4 2023  859 pm utc,1.0,0.0,0.0,0.0,0.0,9,2,0.8885,1,0.9857090711593628
HungoverBandit,you guys are making headlines south of the border time to get mad show some fire and  turn this thing around,aug 4 2023  859 pm utc,0.0,0.33,0.33,0.33,0.0,-5,-1,-0.6808,0,0.6357149481773376
barstoolsports,personally i think this lineup is genius,aug 4 2023  545 pm utc,0.0,0.0,1.0,0.0,0.0,0,1,0.0,1,0.9797220826148987
betterthanbelt,this has made my day thank you,aug 4 2023  854 pm utc,0.5,0.0,0.0,0.5,0.0,2,1,0.3612,1,0.9916635751724243
elchivoSgoat,the hitting has gotten this bad our 45 is now jansen kirk,aug 4 2023  851 pm utc,0.0,1.0,0.0,0.0,0.0,-3,-1,-0.628,-1,0.9703328609466553
JORGEREYESS2369,whod have thunk vlad springer kirk and manoah would be complete duds this year   vlad for example cant hit in the clutch as with most jays save jansen,aug 4 2023  848 pm utc,0.0,0.5,0.0,0.0,0.5,2,0,0.539,-1,0.9263134002685547
JORGEREYESS2369,stay away from that slide and have a great game  go jays,aug 4 2023  846 pm utc,0.33,0.67,0.0,0.0,0.0,3,1,0.6249,1,0.9682229161262512
GLaflower,if the guys in the previous lineups were hitting they would be good lineups too with the the talent the jays have they should be able to pull names form a hat to make the lineup and they should have success,aug 4 2023  843 pm utc,0.0,0.33,0.0,0.67,0.0,5,3,0.8555,1,0.9224167466163635
PehPeh75,decent lineup if geriatric springer groundout jr crapmid varnoshow could actually hit  also manoah vs the moose i give us a zero percent winning probability,aug 4 2023  842 pm utc,0.0,0.25,0.25,0.0,0.5,4,2,0.5267,0,0.5474714040756226
Keeshan26284093,this jays team is so confusing,aug 4 2023  839 pm utc,0.0,0.0,0.0,0.0,1.0,-2,-1,-0.3593,-1,0.962675929069519
MicahCline7,coaches kid hitting in middle of the order and playing mi not surprised joke,aug 4 2023  839 pm utc,0.4,0.2,0.2,0.0,0.2,2,-1,-0.1911,0,0.7666605710983276
jj_beaudry_10,danny bonds hitting cleanup,aug 4 2023  839 pm utc,0.0,0.5,0.0,0.0,0.5,0,0,0.0,0,0.9626613855361938
GLaflower,they moved bo down for one game theres a big difference between 24 yr old bo and 33 yr old springer,aug 4 2023  838 pm utc,0.0,0.0,0.0,0.0,0.0,1,0,0.0,0,0.9308478236198425
Guillermo2Mars,no lol he got sent down but has been back up for a bit now,aug 4 2023  837 pm utc,0.0,0.0,0.0,0.0,0.0,2,0,0.0772,0,0.9421387910842896
GLaflower,hes a veteran whos a star in this league where do people want him to hit 8th like before hell snap out of the slump and start driving the ball all over the field,aug 4 2023  837 pm utc,0.0,0.25,0.25,0.0,0.5,-1,-1,-0.4215,0,0.8961342573165894
Guillermo2Mars,thats manoah lol,aug 4 2023  836 pm utc,0.0,0.0,0.0,0.0,0.0,3,0,0.4215,0,0.8605518937110901
JTrueNorthgamin,dj moving on up nice to see the one who been doing the same all year is getting notice  but still number one goal this offseason newhittingcoach,aug 4 2023  832 pm utc,0.33,0.0,0.0,0.0,0.67,3,1,0.3291,1,0.9713606238365173
doglvrof2,jansen finally gets promoted think this lineup might not be bad,aug 4 2023  832 pm utc,0.0,0.0,0.0,0.0,1.0,-2,-1,0.6858,1,0.9551239013671875
Breakwhy_,less likely to be hitting with multiple runners on up there,aug 4 2023  831 pm utc,0.0,1.0,0.0,0.0,0.0,0,0,0.0,0,0.6849101781845093
BraxyFV,who dat,aug 4 2023  831 pm utc,0.0,0.0,0.0,0.0,0.0,0,0,0.0,0,0.9171349406242371
GU3RNS,gurriel jr has been just as bad as varsho since the all star break with worse defence,aug 4 2023  830 pm utc,0.0,0.0,0.5,0.5,0.0,-6,-3,-0.7351,-1,0.9780174493789673
IDidTheIggy,not just a lineup a world series winning lineup,aug 4 2023  830 pm utc,0.0,0.0,0.0,0.0,0.0,4,1,0.5267,0,0.6934561729431152
swifty_P,dont be a soft feeble team today,aug 4 2023  829 pm utc,0.0,0.0,0.0,0.0,1.0,-2,0,0.2235,-1,0.6255794167518616
KyleTreats,john probably thought he was putting himself in the lineup by writing schneider will be disappointed,aug 4 2023  829 pm utc,0.0,0.0,0.0,0.67,0.33,-2,-1,-0.4767,-1,0.9317588210105896
MiddleAgedJoker,its not much,aug 4 2023  828 pm utc,0.0,0.0,0.0,0.0,0.0,0,0,0.0,0,0.9041615128517151
MiddleAgedJoker,how long ago were those successes,aug 4 2023  828 pm utc,0.0,0.0,0.0,0.5,0.5,0,1,0.5574,0,0.89317786693573
Jabronirob,gotta try something different not sure about springer in 2 hole,aug 4 2023  826 pm utc,0.0,0.0,0.0,1.0,0.0,0,0,-0.2411,0,0.8115811944007874
SophieShipton_,lets see what happens in the game expected the unexpected with this team these days,aug 4 2023  826 pm utc,0.75,0.0,0.0,0.25,0.0,0,-1,0.0,0,0.8738475441932678
Nickthebeast99_,brother hes 2 for his last 49 bottom line he shouldnt be in the top of the lineup,aug 4 2023  825 pm utc,0.0,0.0,0.67,0.0,0.33,2,1,0.2023,-1,0.7851669192314148
YouCantFaizMe,definitely not more abs whits been hot so runners will be on he needs to be in the bottom half to take the pressure off,aug 4 2023  825 pm utc,0.0,0.0,0.0,0.33,0.67,-1,1,0.128,0,0.8383353352546692
nemo_99,management finally did something shocked,aug 4 2023  825 pm utc,0.0,0.0,0.5,0.0,0.5,-2,-1,-0.3182,-1,0.49059492349624634
_Murreth,can he drive in runners in scoring position because pitching isnt this teams problem,aug 4 2023  823 pm utc,0.0,0.25,0.0,0.25,0.5,-2,-1,0.3089,0,0.8787207007408142
Nickthebeast99_,so home runs from when he was an astro makes this a great matchup tonight,aug 4 2023  822 pm utc,0.33,0.0,0.0,0.67,0.0,3,1,0.7073,1,0.9905147552490234
Achiuwaseason,traded an all star and future star for a 9 hole hitter btw,aug 4 2023  819 pm utc,0.0,0.0,0.0,1.0,0.0,0,0,0.0,0,0.9622455835342407
SophieShipton_,youre not the only one,aug 4 2023  818 pm utc,0.0,0.0,0.0,0.0,0.0,0,0,0.0,0,0.9074597954750061
marcsudbury4,my god what a terrible lineup i was giddy at the start of the year looking at the lineup now its just depressing,aug 4 2023  818 pm utc,0.0,0.0,0.33,0.33,0.33,-6,-3,-0.6369,-1,0.9766762852668762
SophieShipton_,has even better numbers vs paxton lets see what happens tonight much less pressure in the 2 hole,aug 4 2023  818 pm utc,0.0,0.0,0.0,0.67,0.33,1,1,0.2484,1,0.9139807820320129
InfiniteGrowth9,team is pathetic,aug 4 2023  817 pm utc,0.0,0.0,0.0,1.0,0.0,-2,-1,-0.5719,-1,0.9760622382164001
Jaredbr05084605,hes the wild card  for a hit to a not sure what you are going to get he worries me unpredictable,aug 4 2023  817 pm utc,0.0,0.5,0.0,0.5,0.0,0,-3,-0.5806,-1,0.6629530191421509
Nickthebeast99_,explain what is great,aug 4 2023  816 pm utc,1.0,0.0,0.0,0.0,0.0,3,1,0.6249,0,0.8090580105781555
BasedKhatri99,daulton varsho is just a glorified bradley zimmer,aug 4 2023  816 pm utc,0.0,0.0,0.0,0.0,0.0,0,0,0.5106,-1,0.8359544277191162
zekeke_,yep its a lineup for sure,aug 4 2023  814 pm utc,0.0,0.0,0.0,0.0,0.0,0,0,0.5423,1,0.6130101680755615
SpringersDonger,which one,aug 4 2023  814 pm utc,0.0,0.0,0.0,0.0,0.0,0,0,0.0,0,0.9465348124504089
Yusei_Rivera,finally a half decent set lineup,aug 4 2023  813 pm utc,0.0,0.0,0.33,0.0,0.67,0,1,0.0,1,0.7396129965782166
briangm11,not sure the lineup matters much when this team plays an al east team scoring any runs tonight jays another lost weekend coming up,aug 4 2023  813 pm utc,0.0,0.2,0.2,0.2,0.4,-2,-1,-0.2874,-1,0.9614012837409973
SophieShipton_,yeah i know i mean i was shocked when i saw it but hopefully theyll get the w manoah has to pitch well,aug 4 2023  812 pm utc,0.0,0.0,0.5,0.5,0.0,1,0,0.7311,1,0.5978603363037109
Jaredbr05084605,ok was just giving an opinion hopefully they can win must win series,aug 4 2023  811 pm utc,0.0,0.0,0.0,0.0,1.0,10,2,0.9313,1,0.9014062285423279
Nickthebeast99_,i wouldnt say 940 is great,aug 4 2023  811 pm utc,1.0,0.0,0.0,0.0,0.0,3,1,0.6249,0,0.6666125655174255
JohnAreacode306,dont forget this guy,aug 4 2023  811 pm utc,0.0,1.0,0.0,0.0,0.0,-1,0,0.1695,1,0.5364257097244263
RunHomeJays,daniel mr clean jansen i know thats right,aug 4 2023  811 pm utc,0.0,0.0,0.0,0.0,0.0,2,2,0.4019,1,0.9061198830604553
SophieShipton_,george has the best numbers against paxton and hit a springer dinger off him last time so thats my only reason as to why hes batting 2nd,aug 4 2023  810 pm utc,0.0,0.25,0.25,0.25,0.25,3,1,0.6369,1,0.7132604718208313
houstonhogan07,so whit can get a hit and instantly hits into a double play,aug 4 2023  809 pm utc,0.0,0.5,0.0,0.0,0.5,0,1,0.34,0,0.9623209834098816
Nickthebeast99_,i would rather kirk be in the 2 spot over him rn tbh,aug 4 2023  809 pm utc,0.0,0.0,0.0,0.0,1.0,0,0,0.0,0,0.784019947052002
Jaredbr05084605,george cant hit vlady seconds move everyone up one and put george behind chapman just a thought  the whole team cant clutch hit,aug 4 2023  809 pm utc,0.0,0.5,0.0,0.25,0.25,0,0,0.0,-1,0.8956601619720459
ErnieCleMVP,jano cleanup finally,aug 4 2023  809 pm utc,0.0,0.0,0.0,0.0,1.0,0,0,0.0,0,0.7719082832336426
Brlmkr0224,stay away from the ipad davis  it is not your friend good luck tonight,aug 4 2023  809 pm utc,0.5,0.5,0.0,0.0,0.0,6,2,-0.2579,-1,0.8312546610832214
YouCantFaizMe,he had good numbers against bradish toohes slumping you cant put him in such an important spot,aug 4 2023  808 pm utc,0.25,0.0,0.0,0.25,0.5,5,1,0.5719,0,0.733168363571167
houstonhogan07,who else should hit there bo is hurt and the rest of the hitters are bad too,aug 4 2023  806 pm utc,0.0,0.5,0.0,0.5,0.0,-5,-2,-0.7845,-1,0.9549236297607422
RainingthoughtZ,this hitting lineup is awful they lack hitting,aug 4 2023  806 pm utc,0.0,1.0,0.0,0.0,0.0,-5,-2,-0.6486,-1,0.9807557463645935
GPJaysfan,finally much needed changes  jansen cleaning up schneider in the lineup varsho 9th,aug 4 2023  806 pm utc,0.0,0.0,0.0,0.0,1.0,0,0,0.0,0,0.8013955354690552
Nickthebeast99_,when bo struggled last season schneider moved him down in the bottom part of the lineup george whos struggling way more than bo gets moved down to the cleanup spot and now to the 2 spot lmao,aug 4 2023  806 pm utc,0.0,0.0,0.0,0.0,1.0,0,-2,-0.0772,0,0.8478439450263977
Clxckwork,okay lets win tonight yes,aug 4 2023  806 pm utc,0.0,0.0,0.0,1.0,0.0,5,1,0.8126,1,0.9789911508560181
