username,tweet_text,date,happy,angry,surprise,sad,fear,afinn,bing,sid,bertweet,bertweet_confidence
smallworldnotes,small world sundays  torontounion  nhapitapi  presented by td bank canada  sunday july 30 2023 at 6pm edt free event  learn more smallworldmusiccomshowstd,jul 27 2023  201 pm utc,0.5,0.0,0.0,0.0,0.5,1,1,0.5106,0,0.912982165813446
PradyumanJhala,too far too fast td bank report warns policymakers need to keep up with immigration surge and its effect on economy thestarcombusinesstoofar via torontostar,jul 28 2023  522 pm utc,0.0,0.0,0.17,0.17,0.67,-2,1,-0.1027,0,0.5778993368148804
SinAzimi,td bank predicts higher interest rates and an affordability crisis   if canadas population boom continues at its current frantic pace interest rates will face upward pressure and the massive influx of people will significantly worsen affordability  theglobeandmailcomampbusi,jul 28 2023  455 pm utc,0.25,0.0,0.25,0.25,0.25,-6,-2,-0.7579,-1,0.9368964433670044
gregp_j,yankees finally confirm what we expected all week nestor cortes second rehab start will come in somerset first pitch 705 pm at td bank ballpark,jul 28 2023  328 pm utc,0.2,0.0,0.0,0.2,0.6,0,0,0.0,0,0.6608182787895203
SOMPatriots,snapshots from last nights its summer celebration at the somerset patriots baseball game played at td bank stadium hosted by rwjbarnabas and proudly cosponsored by derive technologies   derivetech itandssummercelebration rwjbarnabashealth healthcaretech,jul 28 2023  325 pm utc,0.4,0.0,0.0,0.2,0.4,2,1,0.7184,1,0.7574408054351807
DeriveTech,wow more tracking coming thanks to td insurancetd bank and likely others wonder what they want with all of our data they collect how about manufacturers do their part to make vehicles harder to steal before they sell them,jul 28 2023  416 pm utc,0.0,0.0,0.67,0.17,0.17,5,1,0.6204,-1,0.5059490203857422
True_North__,let me go to td bank and ask them where is my money,jul 28 2023  410 pm utc,0.0,0.0,0.0,0.0,1.0,0,0,0.0,0,0.9636813402175903
rsgnl,hello wed like to assist you please send us a dm no account numbers with additional details regarding your experience maddy,jul 28 2023  346 pm utc,0.0,0.0,0.0,0.0,1.0,2,1,0.3818,0,0.9133418202400208
SOMPatriots,hi brandon we ask if you can send us a dm so we may further assist please make sure to not include any account numbers in your response  tyler,jul 28 2023  325 pm utc,0.0,0.0,0.0,0.43,0.57,1,0,0.5574,0,0.9595127105712891
TDBank_US,tdbank_us looking to get an official letter stating that i closed my account with td bank is this possible,jul 28 2023  323 pm utc,0.25,0.0,0.0,0.25,0.5,0,0,0.0,0,0.8152512311935425
b_edward95,hi chris we hear your concerns and ask you to reach out to us via dm so we can gain further information please make sure to not include any account numbers in your response  tyler,jul 28 2023  320 pm utc,0.0,0.0,0.0,0.57,0.43,4,0,0.8107,0,0.9691210389137268
TDBank_US,it sounds like you are the one that needs to be educated dave according to a report from the td bank elevated immigration levels are responsible for the housing crisis and we cant build our way out of it when the gap is 500000 houses,jul 28 2023  301 pm utc,0.0,0.0,0.0,0.17,0.83,1,1,-0.0772,-1,0.9271382689476013
Frankie26303813,too far too fast td bank report warns policymakers need to keep up with immigration surge and its effect on economy thestarcombusinesstoofar via torontostar,jul 28 2023  300 pm utc,0.0,0.0,0.17,0.17,0.67,-2,1,-0.1027,0,0.5778993368148804
CERC_CA,growth is a necessary remedy to canadas labour shortage but td bank warns the benefits erode if it occurs too fast relative to a countrys ability to plan and absorb new entrants tribalxmzewel,jul 28 2023  242 pm utc,0.0,0.0,0.2,0.0,0.8,2,1,0.7227,0,0.7658454775810242
TorontoStar,𝐓𝐎𝐃𝐀𝐘𝐒 𝐆𝐀𝐌𝐄  𝐅𝐫𝐢𝐝𝐚𝐲 𝐉𝐮𝐥𝐲 𝟐𝟖   td bank ballpark   bowiebaysox    705 pm   postgame fireworks   rwjbarnabas    atmilbcom3xvftdm,jul 28 2023  234 pm utc,0.0,0.5,0.0,0.0,0.5,0,0,0.0,0,0.9759514331817627
SOMPatriots,ottawas push for historic immigration could cause housing and infrastructure crisis higher interest rates td bank  linktheepochtimescommkt_a,jul 28 2023  1200 pm utc,0.2,0.0,0.0,0.0,0.8,-2,-1,-0.2732,-1,0.8879156708717346
RvanHofslot,double the games double the fun  last nights game will continue at 505 pm followed by a brief intermission before we play 7 innings on jurassic pork night with postgame fireworks presented by td bank    bitly3ydhb3v yourhometownteam  htss_inc,jul 28 2023  202 pm utc,0.25,0.25,0.0,0.0,0.5,4,1,0.6908,1,0.9489790797233582
IronPigs,good morning thank you for reaching out to td bank today we welcome you to send us a dm with additional details so we may address your concerns accordingly no acct numbers please kathrynn,jul 28 2023  117 pm utc,0.17,0.0,0.0,0.17,0.67,8,2,0.8519,1,0.9738661050796509
TDBank_US,the tdb2b10k is proud to host for a 2nd year the beacon walk run roll event join us for this prerace event on friday aug 4  530pm in fortwilliams park  disabilitypride disabilitypridemonth adaptivesports mainerunning mainesports,jul 28 2023  143 pm utc,0.5,0.0,0.0,0.0,0.5,3,1,0.6486,1,0.9850355386734009
Beach2Beacon10K,td bank group executive for southern africa gloria mamba applauds the working relationship with malawiredcross which she said has led to the banks more support mrcs director of programs prisca chisala has thanked td bank for all the support in machinga and mangochi,jul 27 2023  700 pm utc,0.0,0.0,0.33,0.0,0.67,6,3,0.883,1,0.9664656519889832
MalawiRedCross,turn up the savings at festivals this summer  heres how to save before during and after,jul 28 2023  101 pm utc,0.5,0.0,0.5,0.0,0.0,2,1,0.6908,0,0.7179860472679138
TDBank_US,dad and i will continue east today stopping in somerville nj well tap the brakes a bit have lunch and catch oppenheimer before game 6 with the doublea sompatriots at td bank ballpark   midatlanticroadtrip 20ballparks21days,jul 28 2023  101 pm utc,0.0,0.5,0.0,0.0,0.5,-1,1,0.128,0,0.9124660491943359
SOMPatriots,𝐓𝐎𝐃𝐀𝐘𝐒 𝐆𝐀𝐌𝐄  𝐅𝐫𝐢𝐝𝐚𝐲 𝐉𝐮𝐥𝐲 𝟐𝟖   td bank ballpark   bowiebaysox    705 pm   postgame fireworks   rwjbarnabas    atmilbcom3xvftdm,jul 28 2023  1200 pm utc,0.0,0.5,0.0,0.0,0.5,0,0,0.0,0,0.9759514331817627
TDBank_US,good morning thank you for tagging td bank in your post we welcome you to send us a dm regarding your debit card transactions so we may assist further no acct numbers please kathrynn,jul 28 2023  1223 pm utc,0.2,0.0,0.0,0.0,0.8,7,3,0.8176,1,0.9593092799186707
ChadU607,we pulled our money out of td bank after what they did to canadians  now using a local credit union  there are a lot of options out there staying with these large corporations is a choice,jul 28 2023  1156 am utc,0.0,0.4,0.0,0.2,0.4,0,0,0.3818,-1,0.6471603512763977
DODOBIRD6661,ottawas push for historic immigration could cause housing and infrastructure crisis higher interest rates td bank theepochtimescomworldotta,jul 28 2023  1153 am utc,0.2,0.0,0.0,0.0,0.8,-2,-1,-0.2732,-1,0.8928385972976685
annaedwardsnews,monday saw european macro looking weak pooja kumra european  uk rates strategist at td bank said china determines europe in a way hours later we got stimulus from the chinese politburo enough to turn around the recession signals in europe jury still out 27,jul 28 2023  1151 am utc,0.0,0.0,0.33,0.33,0.33,-4,-1,-0.6908,0,0.8388981223106384
DianaNu84941814,ottawas push for historic immigration could cause housing and infrastructure crisis higher interest rates td bank     linktheepochtimescommkt_a,jul 28 2023  1104 am utc,0.2,0.0,0.0,0.0,0.8,-2,-1,-0.2732,-1,0.8879156708717346
daryl_brito,per anthonynoto sofi has a goal to become a top 10 bank the current 10th largest bank by market cap is td bank with a market cap of 1195 billion with sofi having a current market cap of 855 that is a 14x accumulating 10k shares of sofi will have a chance of making you a,jul 28 2023  1056 am utc,0.0,0.0,0.11,0.11,0.78,5,1,0.6124,1,0.7085224390029907
AllaquanS,all td bank accounts,jul 28 2023  1039 am utc,0.0,0.0,0.0,0.0,1.0,0,0,0.0,0,0.9555931687355042
TDBank_US,hi there bruce have a great morning robin,jul 28 2023  1006 am utc,1.0,0.0,0.0,0.0,0.0,3,1,0.6249,1,0.990108847618103
WomenUrbanismCA,we are excited to announce our upcoming virtual workshop series creating gender inclusive public parks thanks to funding from park_people and td bank we are hosting a threepart workshop series based on themes of sustainability inclusivity and placemaking in public parks,jul 27 2023  420 pm utc,0.0,0.0,0.0,0.33,0.67,5,2,0.7579,1,0.9902510643005371
peterpham681,and it asked me 350cad fee to register a server to server money transfer and it needed my banking details to login to connect server to server in fact it deposited check fraud of 4835cad in my td bank account to spoil it to appropriate and embezzle my funds,jul 28 2023  513 am utc,0.14,0.0,0.14,0.0,0.71,-4,-1,-0.5859,-1,0.9073054790496826
washheights44,cute design for their copa de la diversión identity too zorros de somersetnamed after when some foxes trespassed at td bank ballpark right before the patriots held the press conference announcing their partnership with the yankees,jul 28 2023  509 am utc,0.17,0.0,0.17,0.33,0.33,2,2,0.4588,0,0.8071127533912659
PoeticGenius__,td bank is safe for now,jul 28 2023  258 am utc,0.0,0.0,0.0,0.0,1.0,1,1,0.4404,0,0.7210206389427185
andrewaperez,great catching up with my brother anthony earlier this evening in torontos west end   anthony is a vp on the trading floor at td bank in spite of this we still find no shortage of things to talk about   cdnpoli toronto,jul 28 2023  256 am utc,0.17,0.0,0.5,0.17,0.17,0,-1,-0.3612,1,0.9891158938407898
peterpham681,it deposited check fraud of 4835cad in my td bank account to spoil it to appropriate my inheritance of 5000000000usd and i paid him 350cad fee and he has demanded more 1200cad processing fee,jul 28 2023  151 am utc,0.25,0.0,0.0,0.0,0.75,-5,-1,-0.6908,-1,0.9289366006851196
TheNRHour_,media day with yankees catching prospect ben rice live from td bank ballpark sompatriots sandymilena_ 90syankskid nrmedia repbx,jul 27 2023  1013 pm utc,0.5,0.0,0.0,0.0,0.5,1,0,0.296,0,0.9379328489303589
TheNRHour_,here is bryanhoch throwing out the first pitch before the game live at td bank ballpark with somerset patriots sompatriots nrmedia repbx,jul 27 2023  1111 pm utc,0.0,0.0,0.0,0.67,0.33,0,0,0.0,0,0.9418988823890686
TheNRHour_,here is our friend julian julianguilarte1 questions to yankees catching prospect ben rice as we spoke to him live from td bank ballpark with sompatriots media day sandymilena_ sandy_stats  nrmedia dugoutstation repbx,jul 27 2023  1052 pm utc,0.4,0.0,0.0,0.0,0.6,1,0,0.6597,0,0.8475276827812195
always_vote,cbconthecoast marktingcfp switched from td bank to credit union 2011 best thing i ever did banking wise kept the banks credit card at same  rate a benefit was free chequing acct no charge for cheques no bank fees  my credit union is protected by provincial government,jul 28 2023  1202 am utc,0.25,0.0,0.0,0.0,0.75,5,4,0.9633,1,0.9555537700653076
SmittyWhite4,you should read yesterdays report from the td bank we are not building ourselves out of a housing crisis the solution is simple yet politicians refuse to address it show some leadership and speak out,jul 28 2023  1200 am utc,0.0,0.0,0.0,0.14,0.86,-4,-2,-0.6124,-1,0.9305583834648132
TheNRHour_,media day with yankees pitching prospect richard fitts live from td bank ballpark sompatriots thednrcompany nrmedia repbx,jul 27 2023  929 pm utc,0.33,0.0,0.0,0.33,0.33,1,0,0.296,0,0.9531304836273193
TheNRHour_,media day with yankees outfielder willie calhoun 11williecalhoun live from td bank ballpark sompatriots nrmedia repbx,jul 27 2023  819 pm utc,0.33,0.0,0.0,0.0,0.67,0,0,0.0,0,0.9568145871162415
RickyD962,in america jamie dimon ceo of jp morgan citis jane fraser bank of america brian moynihan td banks bharat mastani total is 20 ceo of the top banks arrested in 2022 released by someone  i know who and arrested them again in 2023 locked in for good now,jul 27 2023  1122 pm utc,0.0,0.0,0.25,0.0,0.75,-1,2,-0.1779,0,0.5432906150817871
TDBank_US,we appreciate the reply and would like to discuss with you further if you do change your mind were available from 6am  11pm est no account numbers please kody,jul 27 2023  1115 pm utc,0.25,0.0,0.25,0.0,0.5,4,3,0.6486,1,0.9159724116325378
TDBank_US,hello we hear you and want to try and assist please send us a dm with more information so we can review the matter further no account numbers please kody,jul 27 2023  1057 pm utc,0.0,0.0,0.0,0.0,1.0,3,0,0.4215,0,0.8924070000648499
TitusFinance,td bank raises 5 year insured mortgage rate to 559,jul 27 2023  1013 pm utc,0.0,0.0,0.0,0.0,1.0,0,0,0.0,0,0.9468545913696289
Aloknathdey1,td bank froze her accounts after an etransfer it wont tell her why ak4studycomtdbankfrozeh,jul 27 2023  933 pm utc,0.0,0.0,0.0,0.0,1.0,0,-1,0.0,-1,0.9214691519737244
AllaquanS,gunnaboy127 tell them kick them td bank accounts asap shit lit  let get this free money,jul 27 2023  707 pm utc,0.2,0.0,0.4,0.0,0.4,-3,0,0.0708,0,0.7738443613052368
AllaquanS,im cashing out all on td bank,jul 27 2023  706 pm utc,0.0,0.0,0.0,0.0,1.0,0,0,0.0,0,0.8870912194252014
KayItskay2,is cibc planning to eventually go fully online in digital banking at some point like td bank,jul 27 2023  554 pm utc,0.0,0.0,0.33,0.0,0.67,2,1,0.3612,0,0.9011366367340088
unclebigtim,td bank did well for me with cash deposits when i had a hotdog cart,jul 27 2023  523 pm utc,0.0,0.0,0.0,0.0,1.0,0,1,0.2732,1,0.8906028866767883
SOMPatriots,𝐓𝐎𝐃𝐀𝐘𝐒 𝐆𝐀𝐌𝐄  𝐓𝐡𝐮𝐫𝐬𝐝𝐚𝐲 𝐉𝐮𝐥𝐲 𝟐𝟕   td bank ballpark   bowiebaysox    705 pm   zorros de somerset   rally towels   livgolf_league    bitly3preccv,jul 27 2023  1200 pm utc,0.0,0.0,0.0,0.0,1.0,0,0,0.0,0,0.9731602072715759
ROINJNews,td bank awards 150k to rwjuh somersets babs siperstein proud center  roinjcom20230727health,jul 27 2023  445 pm utc,0.5,0.0,0.0,0.0,0.5,5,2,0.7269,1,0.7751533389091492
schtev69,td bank  hold my beer  td the massive influx of immigrants will significantly worsen affordability for homebuyers and renters,jul 27 2023  438 pm utc,0.0,0.0,0.0,0.67,0.33,-3,-1,-0.5106,-1,0.9497386813163757
GlobalNational,hi ruth45080116 we would love to help you today please send us a dm so that we can assist you further no account numbers please lr,jul 27 2023  215 am utc,0.2,0.0,0.0,0.0,0.8,6,1,0.8519,1,0.9796342253684998
TDBank_US,do any politicians read economist and analyst reports   td bank today the massive influx of immigrants will significantly worsen affordability for homebuyers and renters  the federal government must restore balance to immigration policies,jul 27 2023  438 pm utc,0.0,0.0,0.0,0.33,0.67,-2,-1,-0.2732,-1,0.9032081365585327
schtev69,td bank was like no i asked if any other bank might have it and they were like you can ask but most tellers wouldnt have it they have to special order it  but sounds like i should probably try a couple more banks,jul 26 2023  1149 pm utc,0.0,0.0,0.17,0.0,0.83,5,3,0.8271,0,0.9072619080543518
nationalpost,tdbank_us recently awarded a 150000 grant to rwjsomersets babs siperstein proud center to conduct screenings for hiv and sexually transmitted infections for lgbtq adults njbizcomtdbankawards150,jul 26 2023  953 pm utc,1.0,0.0,0.0,0.0,0.0,6,1,0.8074,1,0.7465466260910034
Duncecap_,td bank awards 150k grant to proud center  via njbiz njbizcomtdbankawards150,jul 27 2023  402 pm utc,0.5,0.0,0.0,0.0,0.5,6,2,0.8225,1,0.5537240505218506
NJBIZ,td bank looks at immigration  of course it tends to be proimmigration but provides some interesting tables   quote the oecd predicts the country will remain in the tail position for the coming decade when it comes to gdp per capita   economicstdcomcabalancin,jul 27 2023  157 pm utc,0.25,0.0,0.25,0.0,0.5,2,1,0.5499,0,0.672741711139679
NJNewsCommons,𝐓𝐎𝐃𝐀𝐘𝐒 𝐆𝐀𝐌𝐄  𝐓𝐡𝐮𝐫𝐬𝐝𝐚𝐲 𝐉𝐮𝐥𝐲 𝟐𝟕   td bank ballpark   bowiebaysox    705 pm   zorros de somerset   rally towels   livgolf_league    bitly3preccv,jul 27 2023  341 pm utc,0.0,0.0,0.0,0.0,1.0,0,0,0.0,0,0.9731602072715759
Graff2023,new td bank location in charlotte nc opens with community space for local small business owners buffly46vxys1,jul 27 2023  333 pm utc,0.0,0.0,0.0,0.0,1.0,0,0,0.0,0,0.697684645652771
SOMPatriots,peaches stergo asks judge to stop forfeiture of her house denied sentencing proceeds guideline is 5163 months ausa wants 96 months in this sad sad case she was not robin hood she made fake td bank documents the victim sold his collection of diamonds,jul 27 2023  1200 pm utc,0.0,0.0,0.0,0.67,0.33,-15,-4,-0.9528,-1,0.9210706949234009
mi_jim,td bank group donates 250k grant to emanuel nine memorial abcnews4comnewslocaltdb,jul 24 2023  835 pm utc,0.0,0.0,0.5,0.0,0.5,1,0,0.3612,0,0.9222745299339294
innercitypress,small world sundays  torontounion  nhapitapi  presented by td bank canada  sunday july 30 2023 at 6pm edt free event  learn more smallworldmusiccomshowstd,jul 27 2023  311 pm utc,0.5,0.0,0.0,0.0,0.5,1,1,0.5106,0,0.912982165813446
TDNews_US,td bank group has given a 250000 grant for the emanuel nine memorial the donation will support the construction of the memorial along with social justice outreach programs that will focus on education and advocacy for the victims families bitly44wrfxm,jul 26 2023  550 pm utc,0.0,0.0,0.33,0.0,0.67,4,1,0.8126,0,0.7998189330101013
Beach2Beacon10K,the 25th running of the tdb2b10ks wheelchair division will include 10 athletes5 men  5 women this is the 1st year it has been filled   hermin garic hopes to repeat his 2023 victory along with the 23 top female finisher yen hoang adaptivesports disabilitypridemonth,jul 27 2023  1241 pm utc,0.0,0.0,0.5,0.0,0.5,4,2,0.5574,1,0.728111207485199
chelseafilm,save the date   coming back to regalmovies union square,jul 26 2023  905 pm utc,0.0,0.0,0.5,0.0,0.5,2,0,0.4939,0,0.8998268842697144
K38Tweets,the staff at td bank on marivale once gave me someone elses credit card by mistake thankfully im a good enough person to have brought it back,jul 27 2023  1132 am utc,0.0,0.0,0.0,0.25,0.75,1,1,0.7096,1,0.6563672423362732
stuartlosaltos,surely it must get difficult for people to argue that genderwang is somehow marxist when its biggest fans are the big banks whenever i go to my atm td bank shows me the pharma pride flag during every transaction,jul 26 2023  1116 pm utc,0.25,0.0,0.0,0.0,0.75,0,1,0.1027,-1,0.5602030158042908
againstgrmrs,my account was closed on me whil i was waiting for a fic insurance claim     pissed is a understatement  my money was stolen and then my account closed    td bank sucks,jul 26 2023  1256 am utc,0.18,0.09,0.27,0.09,0.36,-9,-2,-0.872,-1,0.9815919399261475
My_TeslaModelS,i have never hated anything as much as i hate the td bank   having to deal with estate matters with them is a horrifying experience,jul 27 2023  1128 am utc,0.0,0.0,0.0,0.5,0.5,-5,-3,-0.6036,-1,0.9765092730522156
daisyanne39,no   it means less spending power and a weaker economy and dollar overall  which means fewer banks buy the gics the federal government prints which is where federal government gets money  td bank is saying canada is about to take irreparable damage,jul 6 2023  621 pm utc,0.0,0.25,0.0,0.0,0.75,-4,-3,-0.8074,-1,0.9036890268325806
Nate22727802,td bank froze her accounts after an etransfer it wont tell her why  cbc news i24newstech20230727woma,jul 27 2023  928 am utc,0.0,0.0,0.0,0.0,1.0,0,-1,0.0,-1,0.908293604850769
bilawal_maskeen,td bank froze her accounts after an etransfer it wont tell her why  cbc news uknewswisacomindexphp20,jul 27 2023  857 am utc,0.0,0.0,0.0,0.0,1.0,0,-1,0.0,-1,0.9063941240310669
daisyBab,canada is pushing for record immigration as the country deals with a labour crunch and an aging population but a new report from td bank suggests there may be unintended consequences if economic and social infrastructure growth does not keep pace  bnnbloombergcacanadasimm,jul 27 2023  811 am utc,0.0,0.12,0.12,0.12,0.62,2,0,0.5267,0,0.6972603797912598
BNNBloomberg,yeah that was mei got a free ticket and didnt really care for a bobblehead someone told me people like the bobbleheads so i decided to post it sold it to someone in attendance who saw it on ebay bobblehead or not it was a great first time at td bank ballpark ill be back,jul 26 2023  530 pm utc,0.4,0.0,0.0,0.2,0.4,7,3,-0.2356,1,0.9864715933799744
JakeRyanBarros,bnntd report  canada is pushing for record immigration as the country deals with a labour crunch and an aging population but a new report from td bank suggests there may be unintended consequences if economic and social infrastructure growth does not keep pace,jul 27 2023  424 am utc,0.0,0.12,0.12,0.12,0.62,2,0,0.5267,0,0.6906837821006775
bend11735343,i love was interesting to getting a anthony volpe bobblehead tonights at td bank ballpark sompatriots and somersetcntynj and i was very sad and,jul 27 2023  421 am utc,0.5,0.0,0.0,0.25,0.25,3,1,0.5434,1,0.9815494418144226
TylerMroz10,meeting td bank on st annes tomorrow to set up donation acct  i will pay every 1 back  i will decide whos going to win this election because i am going to f everyone up who violated me my bodymy home my perfect credit multimillion dollar med malpractice govt cover3,jul 27 2023  354 am utc,0.0,0.0,0.0,0.33,0.67,4,3,0.743,-1,0.872812807559967
insatiablevine,tell that to td bank who turned off the accounts of the canadian truckers,jul 27 2023  204 am utc,0.0,0.0,0.33,0.0,0.67,0,0,0.0,-1,0.796237051486969
BNNBloomberg,canada is pushing for record immigration as the country deals with a labour crunch and an aging population but a new report from td bank suggests there may be unintended consequences if economic and social infrastructure growth does not keep pace  bnnbloombergcacanadasimm,jul 26 2023  530 pm utc,0.0,0.12,0.12,0.12,0.62,2,0,0.5267,0,0.6972603797912598
schtev69,do any politicians read economist and analyst reports   td bank today the massive influx of immigrants will significantly worsen affordability for homebuyers and renters  the federal government must restore balance to immigration policies,jul 26 2023  1149 pm utc,0.0,0.0,0.0,0.33,0.67,-2,-1,-0.2732,-1,0.9032081365585327
nationalpost,i was around when the anaheimducks were first a movie then a team i went to a nhlbruins game in their new td bank north  i ended up buying my 1 year old a pair of mighty ducks socks  and my 3 year old a jacket  kariya  selanne,jul 26 2023  953 pm utc,0.0,0.0,0.0,0.33,0.67,0,2,0.0,0,0.8058964014053345
cookdad,hello john we would like to learn more about your concern so we can help please send us a dm no account numbers please ash,jul 27 2023  101 am utc,0.0,0.0,0.0,0.2,0.8,5,0,0.7823,0,0.8930652141571045
TDBank_US,𝐓𝐎𝐃𝐀𝐘𝐒 𝐆𝐀𝐌𝐄  𝐖𝐞𝐝𝐧𝐞𝐬𝐝𝐚𝐲 𝐉𝐮𝐥𝐲 𝟐𝟔   td bank ballpark   bowiebaysox    705 pm   anthony volpe bobble head first 1000 fans 6 years   whitecastle    bitly3posybm,jul 27 2023  1259 am utc,0.0,0.0,0.0,0.0,1.0,0,1,0.0,0,0.9710339903831482
SOMPatriots,surely it must get difficult for people to argue that genderwang is somehow marxist when its biggest fans are the big banks whenever i go to my atm td bank shows me the pharma pride flag during every transaction,jul 26 2023  1200 pm utc,0.25,0.0,0.0,0.0,0.75,0,1,0.1027,-1,0.5602030158042908
stuartlosaltos,its baseball and networking night for the njstatebar members are at td bank ballpark to watch the sompatriots over food and drinks from a private suite njstatebar,jul 26 2023  1116 pm utc,0.0,0.0,0.33,0.0,0.67,0,0,0.0,0,0.7996804714202881
againstgrmrs,we hear you and would like to try and assist with this matter please send us a dm with more information so we can review the situation further no account numbers please kody,jul 26 2023  1256 am utc,0.0,0.0,0.0,0.0,1.0,4,1,0.6155,0,0.9052342176437378
NJStateBar,somerset patriots i had a better chance of taking anthony volpe himself home than getting a bobblehead   td bank ballpark  sompatriots in bridgewater nj swarmappcomc2433pfq1ffb,jul 27 2023  1220 am utc,0.0,0.0,0.2,0.4,0.4,4,1,0.5994,0,0.7091997265815735
TDBank_US,the bond market is so overlooked  i just bought some newly issued td bank senior notes paying 62 interest paid quarterly  why even take risk in most stocks,jul 26 2023  1058 pm utc,0.2,0.0,0.0,0.0,0.8,-2,-1,0.105,0,0.7860507369041443
9Number9,rehabs bobbleheads and baseballs top prospects  from jackson holliday to nestor cortes steven_cusumano and elijfishman catch you up on this weeks storylines as the bowiebaysox visit td bank ballpark,jul 26 2023  1030 pm utc,0.0,0.0,0.5,0.0,0.5,3,1,0.4588,0,0.923237681388855
FirstShelbourne,td bank eats 225 million termination fee after aml failures doom merger  corruption crime  compliance okttopdlxz2 via mikevolkov20,jul 26 2023  1024 pm utc,0.0,0.0,0.14,0.43,0.43,-7,-4,-0.5859,-1,0.9062463045120239
mattkardos,there were hundreds of people lined up outside of td bank ballpark when i got here over 3 hours before 1st pitch to try and snag an anthony volpe bobblehead even saw a group of people put up a canopy tent to shade themselves in line volpe mania still runs wild in bridgewater,jul 26 2023  919 pm utc,0.0,0.0,0.17,0.33,0.5,0,-3,0.0,0,0.8666512966156006
fadyen3,so true  td bank here in canada  liberal propaganda pushing,jul 26 2023  933 pm utc,0.0,0.0,0.0,0.0,1.0,-2,-1,0.2716,-1,0.8076164722442627
AlbertaBound9,canada is facing a significant gap in standardofliving performance or real gdp per capita compared to other advanced economies   the td bank report highlights canadas struggle to keep up with its peers  and it identifies insufficient growth in real gdp per capita as the,jul 24 2023  501 am utc,0.22,0.11,0.0,0.22,0.44,2,0,0.4767,-1,0.8094308376312256
