username,tweet_text,date,happy,angry,surprise,sad,fear,afinn,bing,sid,bertweet,bertweet_confidence
Arthur41827372,someone tell milhouse atkins that mitch white biggio espinal and luplow need to be upgraded by tuesday,jul 29 2023  338 pm utc,0.0,0.0,0.0,0.0,1.0,0,1,0.0,0,0.9198361039161682
AdamCar41970462,well he isnt gonna play varsho or biggio against lefties so who would you suggest,jul 29 2023  337 pm utc,0.0,0.0,0.0,0.0,1.0,0,1,0.0165,0,0.9690845608711243
FansoftheJets,because players dont play 162 games,jul 29 2023  337 pm utc,0.0,0.0,0.0,0.0,1.0,0,0,-0.2584,-1,0.6409891843795776
SandraC09629631,why kirk if he gets a hit he just clogges the bases because he cant run,jul 29 2023  336 pm utc,0.0,0.5,0.0,0.5,0.0,0,0,0.0,-1,0.9294141530990601
BLUEJAYSFAN1112,welocme to the lead off wiht no more springer leading off,jul 29 2023  336 pm utc,0.0,0.0,0.0,0.0,0.0,-1,2,-0.296,0,0.9581051468849182
jordanmackinnon,prefer somebody who can play defence and also at least be somewhat decent against righties,jul 29 2023  336 pm utc,0.33,0.0,0.33,0.0,0.33,0,2,0.4215,0,0.834232747554779
PehPeh75,gm asleep at the wheel,jul 29 2023  335 pm utc,0.0,1.0,0.0,0.0,0.0,0,0,0.0,0,0.9455106258392334
PhoenixGolf55,so chapman was  that springer was hitting ahead of him last night,jul 29 2023  334 pm utc,0.0,1.0,0.0,0.0,0.0,0,0,0.0,0,0.9683867692947388
PaulKrugShreds,jansen should be in the 4 slot,jul 29 2023  334 pm utc,0.0,0.0,0.0,0.0,0.0,0,0,0.0,0,0.9687668085098267
AdamCar41970462,he plays vs left handed pitching,jul 29 2023  334 pm utc,0.0,0.0,0.0,0.5,0.5,0,0,0.25,0,0.9653385877609253
andrew_danelon,they confirmed yesterday ryu will be back against baltimore,jul 29 2023  333 pm utc,0.0,0.0,0.0,0.0,1.0,0,0,0.0,0,0.9422311782836914
_universe_boss_,varsho needs a break for sure,jul 29 2023  333 pm utc,0.0,0.0,1.0,0.0,0.0,0,-1,0.3182,0,0.8694558143615723
MichaelKJames_,espinal and kirk in this jays lineup,jul 29 2023  333 pm utc,0.0,0.0,0.0,0.0,0.0,0,0,0.0,0,0.955430269241333
thevarsho,i will never understand espinal being in the lineup,jul 29 2023  333 pm utc,0.0,0.0,0.0,0.0,0.0,0,0,0.0,-1,0.9436340928077698
_jmew,im ready and no more dead air,jul 29 2023  332 pm utc,1.0,0.0,0.0,0.0,0.0,-4,0,-0.6478,1,0.8657842874526978
andrew_danelon,that would be perfect than also we we get tim anderson the whit can play lf so varsho doesnt have to play,jul 29 2023  332 pm utc,0.0,0.0,0.0,0.25,0.75,3,1,0.8176,1,0.9188981056213379
dougstevenson88,announce matt chapman extension and promotion to manager,jul 29 2023  332 pm utc,0.0,0.0,1.0,0.0,0.0,0,0,0.0,0,0.8816906809806824
Pickettsburgh8,mid lineup  loss incoming  finished  owned,jul 29 2023  332 pm utc,0.0,0.0,0.0,0.0,0.0,-3,-1,-0.3182,-1,0.7957114577293396
JaysPleaseWin,top 3,jul 29 2023  331 pm utc,0.0,0.0,1.0,0.0,0.0,2,1,0.2023,0,0.5270393490791321
realestbagchasa,i like danny dhing today he gave us some pop last night,jul 29 2023  331 pm utc,0.0,0.0,0.0,0.0,1.0,2,1,0.3612,1,0.9799407124519348
kelly15197728,nice to see jano up in the order,jul 29 2023  331 pm utc,1.0,0.0,0.0,0.0,0.0,3,1,0.4215,1,0.9368589520454407
jcp0918,replacing espinal with tim anderson in this stacked lineup,jul 29 2023  331 pm utc,0.0,0.0,0.0,0.0,1.0,0,0,0.0,0,0.965732216835022
Dmmcknz,ryu when,jul 29 2023  330 pm utc,0.0,0.0,0.0,0.0,0.0,0,0,0.0,0,0.9202690720558167
RedHotBat,admin pls announce soto to the jays,jul 29 2023  330 pm utc,0.0,0.0,0.0,0.0,0.0,0,0,0.0772,0,0.9561594724655151
Betstar96,td_canada customer service is nonexistent over there answer the phone,jul 29 2023  316 pm utc,0.0,0.0,0.0,0.0,0.0,0,-1,0.0,-1,0.9739557504653931
travisrobertson,took a wander from the former centennial planetarium now contemporaryyyc  to the now central library with some help from the now td_canada free fare zone  then to inglewood for some dessert  fun being a tourist in a home city  calgarystampede or otherwise   yyc,jul 27 2023  540 am utc,0.5,0.0,0.25,0.25,0.0,7,2,0.8519,1,0.9010202884674072
jomya_george,td_canada when are the new grad positions opening,jul 29 2023  124 pm utc,0.0,0.0,0.0,0.0,1.0,0,0,0.0,0,0.9711006283760071
ASTTBC,asttbcs cpd  schmoozapalooza is fast approaching wed like to send a special thanks to our event sponsors for their support   bcitsoce  bcitalumni  manulife  td_canada   get your ticket today asttbcorgcelebrating65ye,jul 28 2023  311 pm utc,0.0,0.0,0.5,0.0,0.5,6,3,0.8689,1,0.9874304533004761
shawndesouza,td_canada ceo   just posting what i recd from the dm after repeating everything i already posted  cx hell   thank you for contacting us  we are currently closed but will get back to you when we reopen saturday from 600am to 1100pm you can also visit,jul 29 2023  317 am utc,0.5,0.0,0.0,0.0,0.5,-2,0,-0.2617,0,0.8009139895439148
shawndesouza,td_canada ceo   td asked me to take my post to dm but it looks like its just a bot   for business do not use td  cant add vendors or payroll  rbc and cibc smart banking are better geared to biz,jul 29 2023  311 am utc,0.0,0.0,0.0,0.2,0.8,5,3,0.8922,-1,0.7701472640037537
shawndesouza,as per standard td customer experience lets make it as painful as possible for a customer who has high 6 figs in the account  the dm message was a standard customer service response   tdbankceo are you listening,jul 29 2023  252 am utc,0.0,0.0,0.0,0.57,0.43,0,-1,-0.4404,-1,0.9705469608306885
oshrilkal,cant access the only td atm for cash in my area anymore after 6pm because homeless people took over the space   fucking inept td_canada,jul 29 2023  247 am utc,0.5,0.0,0.0,0.0,0.5,-4,-2,0.0,-1,0.9805644154548645
shawndesouza,ceo   i tried to dm and got this pleasant but clueless message   good evening welcome to td canada trust my name is david thank you for chatting with us today how can i make your day better,jul 29 2023  245 am utc,0.43,0.0,0.0,0.29,0.29,11,5,0.9617,1,0.9841133952140808
shawndesouza,i do not have the option to dm   can you dm me so i  respond,jul 29 2023  238 am utc,0.0,0.0,0.0,0.33,0.67,0,0,0.0,0,0.6454153060913086
TD_Canada,hi again shawn we appreciate you taking the time to provide us with additional details however please note that we would need you to send us a dm private message so we can obtain additional details and provide further assistance we look forward to your private message ja,jul 29 2023  226 am utc,0.25,0.0,0.25,0.0,0.5,3,1,0.6124,1,0.9540383219718933
shawndesouza,comm with an appt with shefali dubé  hi shefali  i contacted the td small business advisor center and they said they didnt have the authority to issue a refund  they directed me to the branch  im getting the run around  ive attached the email thread with the advisor,jul 29 2023  223 am utc,0.2,0.0,0.0,0.0,0.8,1,0,-0.0572,0,0.8559187650680542
shawndesouza,hi  ive been working with the ajax north branch  salem and taunton but td doesnt support businesses  bryanbarclaytdcom sold me the promo but after repeated emails and the branch contacting him  theres no response,jul 29 2023  222 am utc,0.0,0.0,0.0,0.2,0.8,1,1,-0.6895,-1,0.94225013256073
TD_Canada,hi there shawn thanks for reaching out we can certainly understand how frustrating this situation can be and apologize for any inconvenience caused please feel free to send us a dm so we can chat further and see how we may be able to help ja,jul 29 2023  215 am utc,0.17,0.17,0.0,0.17,0.5,2,-1,0.8555,1,0.6434898376464844
shawndesouza,td_canada ceo   i have been struggling to get a refund on unlimited banking charges that was initially pitched to me as free if i was a member of a tech hub it worked for a while but suddenly stopped with no warning or notification and depleted hard earned funds,jul 29 2023  211 am utc,0.25,0.12,0.0,0.12,0.5,-9,1,-0.8462,-1,0.9363310933113098
MJillReeves,mover and shaker,jul 29 2023  155 am utc,0.0,0.0,0.0,0.0,0.0,0,0,0.0,0,0.8759130835533142
AntiHateNetwrk,globeandmail td_canada is that apology in the mail  how about you cbc torontostar  or is normalizing defamation and bigotry part of your esg score,jul 29 2023  1237 am utc,0.0,0.33,0.0,0.33,0.33,-1,-2,0.0516,-1,0.933372437953949
tami_ballantyne,this is where were at now any calls to td_canada is at least an hour wait for multibillion im being generous company you cant afford call back  quality service has definitely gone down the drain,jul 28 2023  1102 pm utc,0.25,0.0,0.25,0.0,0.5,2,1,0.7184,-1,0.9755043983459473
ericfarmer17,td canada wants to send me paper shares is this what i want or should td send them to ast for me,jul 28 2023  639 pm utc,0.0,0.0,0.0,0.0,1.0,2,0,0.3612,0,0.9767342805862427
GraChurch,there are things we can do to increase their absorption rates  like zoning  but it will not be sufficient to address the problem,jul 28 2023  955 pm utc,0.0,0.0,0.5,0.0,0.5,1,1,-0.2846,-1,0.8033316731452942
GraChurch,im glad most economists are now saying this however what they are still not articulating is that absorption rates can change  markets like toronto and vancouver have reached an inflection point where they are no longer able to absorb population at the rate they once did,jul 28 2023  953 pm utc,0.17,0.0,0.5,0.0,0.33,5,2,0.5719,0,0.548265278339386
Town_of_Aurora,mark your calendar for wednesday august 2 at 7 pm so you dont miss canadas own suzie mcneil and the chain reaction live at auroras concerts in the park presented by td_canada and sponsored by magnaint auroracasummerconcerts,jul 28 2023  912 pm utc,0.0,0.0,0.0,0.5,0.5,-2,-1,0.1798,0,0.5472680330276489
TD_Canada,hi swampah we genuinely apologize for the inconvenience we can certainly understand how frustrating this would be were here and ready to help please send us a dm to chat further kb,jul 28 2023  859 pm utc,0.17,0.17,0.0,0.33,0.33,-2,-1,0.5994,0,0.7868540287017822
swamp3r,td_canada if you only have a us  daily interest chequing account and no other td acct can you use the td app to mobile deposit usd cheques drawn from canadian financial insititutions  your web pageemail support say yes but phoning ingoing to the branch say no help,jul 28 2023  853 pm utc,0.2,0.0,0.0,0.0,0.8,4,1,0.5927,0,0.5265350341796875
torontolibrary,leafy greens in libraries  yes please our malvern branch is home to a towergarden allowing us to grow nutritious  delicious food yearround for patrons this initiative is sponsored by td_canada friends of the environment foundation,jul 27 2023  602 pm utc,0.25,0.0,0.0,0.25,0.5,2,1,0.8957,1,0.9804121255874634
VancouverTitans,get dripped out like heesang   cop your very own pathfinders hoodie available only when you purchase a super titans pass for our td_canada watch party on august 5th    vancouvertitansggtdfanhu,jul 27 2023  827 pm utc,0.0,0.0,0.5,0.0,0.5,5,2,0.8442,0,0.6210289001464844
UnknownJaysFan,ah sunshine if you truly believe that then youve got bigger problems  i feel sorry for you,jul 28 2023  741 pm utc,0.0,0.0,0.0,0.5,0.5,-1,-2,0.4767,-1,0.9304128885269165
88ukiyo,td_canada still using the excuse of covid for poor service really,jul 28 2023  741 pm utc,0.0,0.0,0.0,1.0,0.0,-3,-2,-0.4215,-1,0.9733232855796814
MoneyTalkGO,oil prices climbed to a threemonth high as supplies tightened td_canadas hussein allidina says the rally may continue amid rising demand full video here  gotdcom455tudb,jul 28 2023  657 pm utc,0.0,0.0,0.0,0.0,1.0,-1,0,-0.128,0,0.7005991339683533
TD_Canada,we are terribly sorry to learn about the issues you are facing on our platforms and apologize for any inconvenience please send us a dm to further troubleshoot yb,jul 28 2023  635 pm utc,0.0,0.2,0.0,0.4,0.4,-6,-4,-0.4404,-1,0.6320978403091431
tiliipeople,td_canada lost connection there the credit card info on easy web is not avail tech error try again later mobile app shows fine your banking system is high availability and td should know when there is an issue,jul 28 2023  627 pm utc,0.11,0.0,0.0,0.22,0.67,-2,-1,0.7398,-1,0.7598659992218018
TD_Canada,thank you for the shout out td is proud to support mental health initiatives and awareness together we can build a better future mb,jul 28 2023  621 pm utc,0.33,0.0,0.33,0.0,0.33,8,4,0.8807,1,0.9918404817581177
David34180647,askequiniti hey ive been trying to register my shares with my broker they informed me the dtc rejected the request what can i do  td_canada,jul 28 2023  614 pm utc,0.0,0.0,0.5,0.0,0.5,0,-1,-0.2732,0,0.662323534488678
TD_Canada,we are sorry to hear about this inconvenience we can definitely understand how this would be concerning please send us a dm so that we can discuss this further we look forward to connecting with you aj,jul 28 2023  605 pm utc,0.0,0.0,0.0,0.4,0.6,-2,-2,0.2083,0,0.6880514621734619
tiliipeople,td_canada my credit card info is not showing using easy web it says technical diff this is not the first time this has happened all other info for me is showing on easy web but not credit card info,jul 28 2023  558 pm utc,0.0,0.0,0.0,0.0,1.0,2,2,0.4203,-1,0.9382584691047668
SJ_Hurley,imagine td_canada freezing all your money over 50   cbccanewscanadatorontow,jul 28 2023  514 pm utc,0.0,0.0,1.0,0.0,0.0,0,-1,-0.1027,-1,0.9595803022384644
UWHalifax,here are some more photos from td_canadas halifax pride community celebration last thursday we handed out stickers and attendees wrote messages of love and support for queer youth in our community thank you for hosting td ashleymartell4 tinafmurphy,jul 28 2023  509 pm utc,0.67,0.0,0.0,0.0,0.33,7,4,0.8957,1,0.9867013096809387
mmatmem,i just called td canada 500600usd fee that apparently ast is charging td,jul 28 2023  457 pm utc,1.0,0.0,0.0,0.0,0.0,0,0,0.0,0,0.9585304260253906
TD_Canada,we are grateful for the appreciation you have shown and thank you for being a valued customer to chat about your experience please send us a dm have a great day mb,jul 28 2023  354 pm utc,0.6,0.0,0.0,0.0,0.4,11,3,0.9524,1,0.9926497340202332
feedbackacct,td_canada   just had a great experience with an agent on the phone where can i submit a survey,jul 28 2023  350 pm utc,0.5,0.0,0.0,0.0,0.5,3,1,0.6249,1,0.9909998774528503
_Spacedude_,after the 5th 6th he gets tired you can see it in his body language and the quality of his pitches,jul 28 2023  336 pm utc,0.0,0.0,0.5,0.5,0.0,-2,-1,-0.4404,-1,0.8805387020111084
LucaSperanzioso,sounds like fun by the way when can i open an fhsa,jul 28 2023  317 pm utc,0.5,0.0,0.0,0.0,0.5,6,2,0.7003,1,0.979911744594574
TD_Canada,turn up the savings at festivals this summer  heres how to save before during and after   no matter your budget summer festivals are about bringing canadians together through music      learn more gotdcom43uediz,jul 28 2023  306 pm utc,0.4,0.0,0.2,0.2,0.2,2,1,0.7269,1,0.8927786350250244
ElevationMtg,switching to ibkr from td_canada was a huge savingsless than 25 of the trading costs and around 10 of the margin costs literally saved me 30kyear  want to switch use my referral link for some extra cash ibkrcomreferraljames7844,jul 28 2023  227 pm utc,0.0,0.0,0.67,0.0,0.33,4,0,0.6597,1,0.9016969203948975
bramptondtbia,mark your calendars for jambana one world festival 2023 presented by td_canada join us on mon aug 7th 1  9pm at gage park to celebrate emancipation day dont miss this unforgettable event in downtownbrampton     jambanafestival citybrampton jonesjonesltd,jul 27 2023  301 pm utc,0.25,0.0,0.0,0.25,0.5,2,2,0.8606,1,0.978729784488678
TD_Canada,i am sorry to hear that jess and i can understand the importance of getting access to your account please send us a dm so we can further discuss about that issue  jf,jul 28 2023  1257 pm utc,0.0,0.0,0.0,0.25,0.75,2,-2,0.5423,0,0.8542699217796326
Jess02917208,td_canada easyweb is down   cant reset a password  cant even get in using old password  been happening since last night    fix it,jul 28 2023  1250 pm utc,0.0,0.0,0.0,0.0,0.0,0,0,0.0,-1,0.9723536968231201
mikewoodottawa,tonight i requested meetings with the presidents of bmo cibc rbc scotiabank and td_canada to discuss ceba repayments for small businesses i also asked the vice presidents of small business for these banks to meet with me as well  lets see what happens  ottawa,jul 28 2023  227 am utc,0.0,0.0,0.0,0.2,0.8,0,0,0.2732,0,0.9322052001953125
JSJD78,only a matter of time before kikuchi implodes,jul 28 2023  437 am utc,0.0,0.0,0.0,0.0,1.0,1,0,0.0258,-1,0.902332603931427
mikewoodottawa,i appreciate your kindness more than you know,jul 28 2023  309 am utc,1.0,0.0,0.0,0.0,0.0,2,2,0.6908,1,0.991824209690094
winfield_sue,thank you for all the incredibly hard work that you do,jul 28 2023  230 am utc,0.0,0.33,0.0,0.0,0.67,1,2,0.204,1,0.990068256855011
TD_Canada,we are sorry to hear that we can definitely understand how this can be frustrating to further assist you please send us a dmdb,jul 28 2023  107 am utc,0.0,0.25,0.0,0.25,0.5,-2,-2,0.2023,0,0.685000479221344
gordelliott99,go to atb they have treated marilyn and i very well,jul 28 2023  1253 am utc,0.0,0.0,1.0,0.0,0.0,0,1,0.3384,1,0.9879740476608276
HellNoToTheWEF,rbc scotiabank td_canada bmo  we are watching you too this has begun here ive seen it be done to trudeaus opposition and your attacks on canadians wont be tolerated here either you will get sued we wont stand for it,jul 28 2023  1250 am utc,0.0,0.33,0.33,0.0,0.33,-1,-3,-0.4404,-1,0.9713048338890076
Nigel_Farage,rbc td_canada scotiabank cibc bmo nationalbank have just fronted 10b to fund the next stage of construction for the climatewrecking  rights violating transmountain pipeline join me and standearth to pressure them to defundtmx bitly3avjvok,jul 27 2023  618 pm utc,0.0,0.0,0.0,0.0,1.0,-2,0,-0.5423,0,0.8551242351531982
official2s2,get dripped out like heesang   cop your very own pathfinders hoodie available only when you purchase a super titans pass for our td_canada watch party on august 5th    vancouvertitansggtdfanhu,jul 28 2023  1246 am utc,0.0,0.0,0.5,0.0,0.5,5,2,0.8442,0,0.6210289001464844
TrippersDaily,i need this,jul 27 2023  1132 pm utc,0.0,0.0,0.0,0.0,0.0,0,0,0.0,1,0.7521894574165344
plsgloomy,im at td canada trust in red deer alberta swarmappcomck8mh1fabwsd,jul 27 2023  1057 pm utc,0.0,0.5,0.0,0.0,0.5,1,1,0.5106,0,0.9639807939529419
RealStanDavis,we apologize for some miscommunication in the previous tweet we can confirm that were experiencing intermittent issues with easywebapp logins but reattempting the login attempt should resolve the issue we appreciate your patience while our support team resolve the issue kj,jul 27 2023  1026 pm utc,0.17,0.0,0.0,0.33,0.5,7,-1,0.9337,0,0.6075659394264221
RiseUpRadio1,cbccanewscanadatorontow td_canada,jul 27 2023  1019 pm utc,0.0,0.0,0.0,0.0,0.0,0,0,0.0,0,0.9465826749801636
TD_Canada,hi there thank you for voicing your concern and bringing this to our attention while there is no known error or issue at this time if you are having difficulty accessing online banking or the mobile app please send us a dm so we can learn more and help troubleshoot dj,jul 27 2023  1009 pm utc,0.0,0.0,0.0,0.38,0.62,2,-3,0.3699,1,0.6089193224906921
TD_Canada,great question david for your convenience you can review our current mortgage rates here tdcomcaenpersonalbankin if you have any further questions dont hesitate to send us a dm were here to help kj,jul 27 2023  1006 pm utc,0.14,0.0,0.0,0.0,0.86,3,2,0.8231,1,0.9263877868652344
YEGJackson,ok banks what kind of mortgage products do you have for under 6 bmo rbc scotiabank td_canada cibc nationalbank,jul 27 2023  1003 pm utc,0.33,0.0,0.0,0.0,0.67,2,0,0.296,0,0.9690481424331665
thepowersthatd,no prob thanks,jul 27 2023  951 pm utc,0.0,0.0,0.0,0.0,0.0,1,0,0.1779,1,0.7828381061553955
SalesforceCA,how can businesses achieve success in 2023 it starts with becoming a customer company  trailblazers like ariannahuff td_canada  mccainfoods came together at world tour toronto to discuss how to do just that    check out the highlights sforceco3ocp7zp,jul 27 2023  946 pm utc,0.0,0.0,0.0,0.33,0.67,4,2,0.7351,1,0.8359705209732056
TD_Canada,hi there we apologize for any inconvenience there are known issues with our easyweb login we advise that you try to login on your td mobile app as an alternative while we fix this issue if you have any further issues please send us a dm thank you for your patience jt,jul 27 2023  945 pm utc,0.0,0.0,0.0,0.4,0.6,0,-2,0.5574,0,0.9008029699325562
thepowersthatd,td_canada im unable to log in to our account on easyweb any known outages,jul 27 2023  943 pm utc,0.0,0.0,0.0,0.5,0.5,0,-1,0.0,-1,0.8285771012306213
TD_Canada,we certainly understand your concern in this case please send us a dm and well be happy to investigate this for you jd,jul 27 2023  932 pm utc,0.2,0.0,0.0,0.2,0.6,4,1,0.8591,1,0.5144534707069397
lexisfriend,so the idiotic td_canada says a friend who is a canadian citizen who flubbed a question on her id verification has to fly from eygpt to canada to unlock her account i cant believe how obtuse td_canada is absurd ridiculous,jul 27 2023  554 pm utc,0.33,0.0,0.0,0.0,0.67,-6,-4,-0.4902,-1,0.9744094610214233
AKhizrah,td_canada the app isnt working,jul 27 2023  930 pm utc,0.0,0.0,0.0,0.0,1.0,0,0,0.0,-1,0.9401089549064636
bandit13_nation,why does nobody td_canada know their website an app are down,jul 27 2023  924 pm utc,0.0,0.0,0.0,0.0,0.0,0,0,0.0,-1,0.9613938331604004
gcs_owls,our smm has one,jul 27 2023  912 pm utc,0.0,0.0,0.0,0.0,0.0,0,0,0.0,0,0.9450094699859619
Laser_2000,i live on the opposite side of the usa and just want one of these sweaters man,jul 27 2023  906 pm utc,0.0,0.0,0.0,0.0,0.0,1,0,0.0772,0,0.7468013167381287
sachinbahal,td_canada im trying to login into easyweb and its giving me this error any idea whats going on  this should be working but somethings gone wrong please try again soon 4010,jul 27 2023  904 pm utc,0.0,0.0,0.0,0.33,0.67,-3,-2,-0.3291,-1,0.7892652750015259
VancouverTitans,it was a chilly day,jul 27 2023  901 pm utc,0.5,0.0,0.0,0.0,0.5,0,-1,0.0,0,0.8926334977149963
AnimaTroy,youre making people model hoodies in this heat,jul 27 2023  834 pm utc,0.0,0.0,0.0,0.5,0.5,0,0,0.0,-1,0.7943052053451538
hadistan32,i want one but i cant come,jul 27 2023  831 pm utc,0.0,0.0,0.0,0.0,0.0,1,0,0.0387,-1,0.7987348437309265
Ladorsky,please is there a dm group for td canada trust and quest trade quest trade is asking for 300,jul 27 2023  828 pm utc,0.0,0.0,0.33,0.0,0.67,2,1,0.6808,0,0.9703873991966248
Afrocanadianinc,acd proudly announces our 2nd annual back to school aid event sponsored by td_canada  huge thanks to cibc foundation impact life home care inc and inside lagos kitchen for their support together we break barriers for a brighter future   backtoschooldrive2023,jul 27 2023  810 pm utc,0.17,0.17,0.17,0.33,0.17,9,1,0.946,1,0.9909737706184387
melfraser1984,thats a time to change banks situationi wouldnt put up with that honestly,jul 27 2023  608 pm utc,0.0,0.0,0.0,0.5,0.5,0,0,0.4588,-1,0.9051638841629028
lexisfriend,its insane,jul 27 2023  607 pm utc,0.0,0.0,1.0,0.0,0.0,-2,-1,-0.4019,0,0.6171533465385437
melfraser1984,ive dealt with this at work and was like heres the fax number for this and send over the ids and ill check to make sure its been received,jul 27 2023  606 pm utc,0.0,0.17,0.17,0.17,0.5,0,2,0.3182,0,0.9734681844711304
Habs4life10,if they are there for extended time,jul 27 2023  605 pm utc,0.0,0.0,0.0,0.0,0.0,0,0,0.0,0,0.9688917994499207
melfraser1984,do they not have fax machines they should just have to fax over their idthis is horrible customer service especially when someone is out of the country,jul 27 2023  600 pm utc,0.0,0.0,0.0,0.33,0.67,-3,-1,-0.5423,-1,0.9795047640800476
Habs4life10,i bet a canadien embassy could help,jul 27 2023  604 pm utc,0.0,0.0,0.0,0.0,1.0,2,0,0.4019,0,0.8314211368560791
TD_Canada,hello david please know this is not how we want our valuable customers to feel we would like to hear more about your experience to see how we can help please kindly send us a dm if you would like to chat further  js,jul 27 2023  604 pm utc,0.33,0.0,0.0,0.0,0.67,9,4,0.9467,-1,0.6154958009719849
David34180647,td_canada ive been trying to direct register my shares after my investment account was suspended ive had no updates currently on phone with rep and they note that transfer was declined i have the right to register my shares is there a compliance officer i can speak with,jul 27 2023  601 pm utc,0.0,0.0,0.0,0.0,1.0,0,1,-0.2263,0,0.7058541774749756
CanadianGrayMan,td_canada bank froze her accounts after an etransfer it wont tell her why   what a shtty bank td_canada is cbccanewscanadatorontow,jul 27 2023  359 pm utc,0.0,0.0,0.0,0.0,1.0,0,-1,0.0,-1,0.9792196750640869
TD_Canada,hello emily we have picked up your tweet and appreciate why this would be concerning please send us a dm so we can chat further and determine how we may be able to help mn,jul 27 2023  331 pm utc,0.25,0.0,0.0,0.25,0.5,5,1,0.7717,0,0.5198686122894287
LifeAsAGinger_,td_canada deposited a cheque last thursday still dont have the funds in my account whats going on,jul 27 2023  325 pm utc,0.0,0.0,0.0,0.0,1.0,0,0,0.0,-1,0.9289582371711731
NomadicQuantum,meanwhile i took a ukrainian refugee into a td canada trust branch it was decorated like 2slgbtq whatever the alfabet label of the year in corporatistgovernmentmedia canada is christmas with banners everywhere declaring this alfabet labels pride of the month and year 3,jul 27 2023  305 pm utc,0.33,0.0,0.0,0.0,0.67,3,3,0.802,0,0.8189050555229187
prospercan,discover how funding by our partners at td_canadas friends of the environment foundation has helped create food forests  how food forests are helping revitalize the traditional food and landbased knowledge of indigenous peoples bitly3udil3u,jul 27 2023  304 pm utc,0.14,0.0,0.43,0.0,0.43,2,3,0.7506,1,0.6229128837585449
HfxPartnership,the economic strategy scorecard in the halifax index 2023 presented by td_canada reports on the annual progress toward the strategys four longterm goals  read more at halifaxindexcomstrategysc halifaxindex2023 halifaxeconomy peopleplanetprosperity hfxeconstrategy,jul 27 2023  303 pm utc,0.0,0.0,0.0,0.33,0.67,2,1,0.4215,0,0.9513652324676514
IntizarZaidi,td_canada if you want to go to td take a day off,jul 27 2023  254 pm utc,1.0,0.0,0.0,0.0,0.0,1,0,0.0772,0,0.8880875110626221
