username,tweet_text,date,happy,angry,surprise,sad,fear,afinn,bing,sid,bertweet,bertweet_confidence
ellec1619,lol no madrid nor cristiano fan can bully me  i always put them in a pigs fence,aug 2 2023  1242 am utc,0.0,0.0,0.0,1.0,0.0,3,-2,-0.5517,-1,0.9032248854637146
reztrend,lol the title of the book is cisi but not all objects have inscriptions including pottery  button seals etc,aug 3 2023  141 pm utc,0.0,0.0,0.0,0.0,1.0,3,0,0.2263,0,0.9439238905906677
Skandd_Aniruddh,thats what they all say lol,aug 3 2023  141 pm utc,0.0,0.0,0.0,0.0,0.0,3,0,0.4215,0,0.873712956905365
thasweetestanbu,they wont do it in anyway no one would think this is a good idea lol,aug 3 2023  141 pm utc,0.0,0.0,0.0,0.0,0.0,5,1,0.5423,-1,0.8663896322250366
devOfrow,i wanted to tag u but i didnt know which one lol,aug 3 2023  141 pm utc,0.0,0.0,0.0,0.0,0.0,3,0,0.5719,0,0.9266831874847412
tornadicwonder,1 16 has nothing to do with the convo 2 the part of the ss where the user talks about 2017 is just saying nothing that hasnt already been said lol kyrie was a better scorer while curry was a better playmaker and rebounder better defender as well curry also had a higher ts,aug 3 2023  141 pm utc,0.0,0.0,0.0,0.0,0.0,11,6,0.9186,0,0.7713925838470459
Claraamazarine,the things that would of come out my mouth she would of regret it lol,aug 3 2023  141 pm utc,0.0,0.0,0.67,0.33,0.0,1,-1,0.0,-1,0.6342090964317322
Joseph4400,has anyone done this with penguin shachi and bepo lol,aug 3 2023  141 pm utc,0.0,0.0,0.0,0.0,0.0,3,0,0.4215,0,0.9477708339691162
mizzousp0rts,weird flex lol porn star or not youve said yes to how many people to marry them and left so you just out here bullshitting dudes technically,aug 3 2023  141 pm utc,0.0,0.0,0.5,0.0,0.5,2,-1,-0.0408,-1,0.8558424115180969
nojumper,lol i get it but the phrasing,aug 3 2023  525 am utc,0.0,0.0,0.0,0.0,0.0,3,0,0.2263,0,0.8433021903038025
KC_Medz,lol sure on what it looks more like you are going to be arrested for false statements and you have the people that will be going after you,aug 3 2023  141 pm utc,0.0,0.0,0.0,0.0,0.0,2,1,0.5849,-1,0.8813257217407227
Zamachwama_,palpitating lol fuck this shit,aug 3 2023  141 pm utc,0.5,0.0,0.5,0.0,0.0,-5,-2,-0.6486,-1,0.9797384738922119
PerryHecht5,so she went to ny lol and people thought she was going to paris again lol to be with a boy who doesnt even like the fruit remember lisas real boyfriend was always in korea,aug 3 2023  141 pm utc,0.0,0.0,0.0,1.0,0.0,8,1,0.5408,0,0.642326831817627
vsrecrds,ive managed to have patience with shipments  coming from hong kong  ill wait bro lol,aug 3 2023  141 pm utc,0.0,0.0,0.5,0.25,0.25,1,1,0.0,0,0.6358522772789001
MCJsays,im just trying to be nice to the trigger happy wind miller lol,aug 3 2023  141 pm utc,1.0,0.0,0.0,0.0,0.0,9,2,0.8519,0,0.6994507312774658
etherealkhay,they dont know thats the real flex lol,aug 3 2023  141 pm utc,0.0,0.0,0.0,1.0,0.0,3,0,0.4215,0,0.9343450665473938
nixcraft,that how i get them to click lol lol smart lol,aug 2 2023  443 pm utc,0.0,0.0,0.0,0.0,0.0,10,1,0.8779,1,0.9216296076774597
Actrastunt,right lol,aug 3 2023  141 pm utc,0.0,0.0,0.0,0.0,0.0,3,1,0.4215,1,0.516656219959259
makimakidesu_,lol dont be a sheep,aug 3 2023  141 pm utc,0.0,0.0,0.0,0.0,0.0,3,0,0.4215,0,0.8016253113746643
GLAMOROUS24_7,lol hes probably talking about being expected to perform well and be professional since he just wants to play fifa and get paid,aug 3 2023  141 pm utc,0.33,0.0,0.0,0.0,0.67,3,1,0.743,0,0.7801704406738281
RitaS195,lol barely can sell 100 of them ill pass,aug 3 2023  141 pm utc,0.0,0.0,0.0,0.0,0.0,1,0,0.0,0,0.6766879558563232
VigorousNFT,lol you are such an awesome fiction writer,aug 3 2023  141 pm utc,0.0,0.0,1.0,0.0,0.0,7,0,0.7845,1,0.9918175339698792
BaristerBarista,bobby bobby boddy   the entire crowd had so much fun that afternoon i wanted one of those dang footballs so bad no tactic was beneath me elbows throat punch groin shot whatever it took lol im kidding of course i exercised total restraint thank you so much,aug 3 2023  141 pm utc,0.4,0.2,0.0,0.2,0.2,5,0,0.3201,1,0.9912537932395935
SonyaRenee3333,women and men literally do the same treacherous things to one another so idk whats going on with the daily gender wars lol being a shitty person aint got no gender,aug 2 2023  1115 pm utc,0.0,0.0,0.5,0.0,0.5,-1,-1,-0.6573,-1,0.967564046382904
Edamaru_smg4fan,chelsea are the bank of brighton lol,aug 3 2023  141 pm utc,0.0,0.0,0.0,0.0,1.0,3,0,0.4215,0,0.773938775062561
Davektbffhmoore,blognavercomkewng1222317 kind of a specific tattoo but useful to my story i can use it for wolves and vamps even if it is a human bite lol ive been looking everywhere for bite marks,aug 3 2023  135 pm utc,1.0,0.0,0.0,0.0,0.0,7,1,0.8201,0,0.5295824408531189
MichaelaBCarter,yesterday is was in the 80s and i was actually kinda cold i hate it here lol,aug 3 2023  141 pm utc,0.0,0.0,0.5,0.5,0.0,0,-2,-0.1585,-1,0.9720130562782288
hewasnumber0001,the irony lol no amount of therapy or surgery can make you something you arent lol thanks for proving my point lmao dillon could have 1000 surgeries he will always be a man,aug 3 2023  141 pm utc,0.0,0.0,0.25,0.5,0.25,10,0,0.6902,0,0.5973115563392639
Glenn_somebody_,lol you are such a sissy boy drama queen lying spy banger,aug 3 2023  141 pm utc,0.0,0.0,0.0,0.0,0.0,3,-1,-0.1531,-1,0.9723159074783325
EndtheWef2030,lol so in your trump world everyone on the right has to bow and worship the man that locked us down the man that signed the cares act got it  your version of conservatism is really twisted,aug 3 2023  141 pm utc,0.2,0.0,0.2,0.2,0.4,5,1,0.7906,-1,0.8742195963859558
mijingy0o,donghyuk take it away from your face yunhyeong keeps saying hes barefaced donghyuk but your skin is still good yunhyeong coverscovers yunhyeong opens and eats a piece of chip its okay ill go enjoy some me time right now   exits live lol,aug 3 2023  128 pm utc,0.2,0.2,0.0,0.2,0.4,6,3,0.8885,0,0.5662381052970886
savage850,lol this man really named this bih x,aug 3 2023  141 pm utc,0.0,0.0,0.0,0.0,0.0,3,0,0.4215,0,0.7165644764900208
THEJenn_BunnY,lord knows we damn need one  lmao girl im scrambling trying to get my bey fit together  lol,aug 3 2023  141 pm utc,0.33,0.0,0.33,0.0,0.33,4,-2,0.7579,0,0.6541533470153809
marrglizzy2x,lol dead it they can watch hope they kno im single,aug 3 2023  141 pm utc,0.0,0.0,0.5,0.0,0.5,2,-1,0.1027,0,0.6822648048400879
PicturesFoIder,hopefully but i suspect well be seeing caicedo for 100m soon lol,aug 2 2023  1217 pm utc,0.0,0.0,0.0,0.0,1.0,4,0,0.6597,1,0.8210065960884094
ChelseaYdot,lol i was having a bad morning so i ordered myself sneakers to make myself feel better,aug 3 2023  141 pm utc,0.0,0.0,0.0,1.0,0.0,2,0,0.296,1,0.8296938538551331
danajacianee_,oh they are whores with their coins lol,aug 3 2023  141 pm utc,0.0,0.0,0.0,0.0,0.0,3,-1,-0.296,-1,0.9582831859588623
Social_Twerker,if i had something like this no way i would send it in for grading i would drive the 18 hours or however long and deliver it myself lol,aug 3 2023  141 pm utc,0.0,0.0,0.0,0.0,1.0,4,1,0.4215,0,0.7740092277526855
TAN1AAA,lol nikki  as a person who is in recovery over 35 years i can attest to you that its not the chinese its not the afghanistans its the person using the substance is the social economics is the demographics its the poverty its the war its the trauma its the united,aug 3 2023  1253 pm utc,0.0,0.0,0.5,0.0,0.5,-2,-1,-0.6597,0,0.867002546787262
Powergannon,yup thats a dude for sure be looking like a linebacker lol,aug 3 2023  141 pm utc,0.0,0.0,0.0,0.0,0.0,5,1,0.765,0,0.846473753452301
KoshkaChap,thats busquets son lol,aug 3 2023  141 pm utc,0.0,0.0,0.0,0.0,0.0,3,0,0.4215,0,0.899208664894104
freemasonerik,yeah jealous they get it more than i do  got a picture of doggos on other side got a lamp cos the tank had a light just need something else now having wander round garden centre get some fresh air distract my brain for a bit lol stupid brain,aug 3 2023  141 pm utc,0.0,0.0,0.0,1.0,0.0,-1,-3,-0.3182,-1,0.6540238261222839
Ty22Best,lol special counsel is not regulated by either chamber of congress as per the statute  any special counsel only reports to the ag  the only person connected to jack smith that you can send subpoena to is ag garland but guess what hes not gonna buzz  next,aug 2 2023  1021 pm utc,0.0,0.0,0.71,0.14,0.14,3,-1,0.5574,-1,0.5754880309104919
gittethuesen,give him time hell get there lol,aug 3 2023  141 pm utc,0.0,0.0,0.0,0.0,1.0,-1,-1,-0.4215,0,0.9366304278373718
SuperIntel69,lol the math is totally wrong in both statements  also these cars only rent for 1500day,aug 3 2023  141 pm utc,0.0,0.0,0.0,0.0,0.0,1,-1,-0.1513,-1,0.9172425866127014
_snacc_,i do everything except sleeping lol,aug 2 2023  443 pm utc,0.0,0.0,0.0,0.0,0.0,3,0,0.4215,0,0.8600969314575195
theartofdemi,it was 23 years ago lol cmon now  none of this was necessary to get brought back to light,aug 3 2023  141 pm utc,0.0,0.0,0.0,1.0,0.0,3,0,0.4215,-1,0.6774110198020935
Beefyicecream,how tf is skyrim and hogwarts up there theyre single player games  whos bullying you npcs and clash of clans the mobile game lol,aug 3 2023  141 pm utc,0.0,0.0,0.0,0.0,0.0,-1,-2,-0.2732,-1,0.884730339050293
DionShield,fuslie reads her dms on how ludwig got her and sykkuno to enter pogchamps chess tournament  sykkuno thats literally what he told me too and he said you were in it so i thought it was casual lol,aug 2 2023  915 pm utc,0.0,0.0,0.5,0.5,0.0,3,0,0.5574,0,0.6408815383911133
changelingenby,lol nooot me sending in my two week notice the night before they announced a bunch of annoying new work rules lol,aug 3 2023  141 pm utc,0.0,0.0,0.0,0.2,0.8,4,0,0.4404,-1,0.9558245539665222
ENA_BILLE,you aint lying lol sheila e and the time was dope the purple rain era,aug 3 2023  141 pm utc,0.0,0.5,0.5,0.0,0.0,3,-2,0.1139,1,0.7393860220909119
AirMax1963,hahaha that was my life lol i was wrapping up my last spot or two in august lol,aug 3 2023  830 am utc,0.0,0.0,0.0,0.0,1.0,9,0,0.8481,1,0.6555961966514587
deanohenson,just saw this lol algofam,aug 3 2023  141 pm utc,0.0,0.0,0.0,0.0,0.0,3,0,0.5023,0,0.7934535145759583
AlgoElonmusk420,gmgm acfam  nftcommmunity  i wish yall a fruitful month ahead may august bring you tons of abundance  and dont be a pushy bug in the space lol  happy thursday  verticalnft  samurai your way thru 2023,aug 3 2023  138 pm utc,0.4,0.0,0.0,0.2,0.4,6,2,0.8754,1,0.9915366172790527
altered_cosmos,you quote tweeted a guy discovering a wacky thing happened in the comic how am i supposed to know youre talking about some completely separate thing lol,aug 3 2023  519 am utc,0.0,0.0,0.5,0.0,0.5,3,0,0.4703,0,0.8214337825775146
UselessNobody8,totally agree lol so stupid,aug 3 2023  141 pm utc,0.0,0.0,0.0,0.0,0.0,2,-1,0.2911,-1,0.9546675086021423
Kryptk33p3r666,wow okay this is extra messed up lol the official gundam fc booth merch printed the word marriage as guels dialogue but bandai refuses to let the seiyuu use that word for sulemio  the bandaihomophobia is too real   g_witch_m gundam_info sunrise_web スレミオ結婚,aug 3 2023  141 pm utc,0.0,0.5,0.17,0.33,0.0,5,-1,0.4678,-1,0.9329700469970703
jirakugo,reminds me of this lol,aug 2 2023  540 pm utc,0.0,0.0,0.0,0.0,0.0,3,0,0.5023,0,0.7233436107635498
Gundam_FanC,adored i think its potentially my fav of the year  i need to make my list lol when i have a second im gonna make my best of 2023 list i dont know why i havent yet,aug 2 2023  900 am utc,0.33,0.0,0.0,0.67,0.0,9,3,0.9153,1,0.9887922406196594
MrSinha_,bcuz ppl will internalise criticising powerful professors might come with a lawsuit lol,aug 3 2023  838 am utc,0.0,0.0,0.0,0.0,0.0,3,1,0.25,-1,0.7864781022071838
RuxandraTeslo,this was my first drawing of j bowless it was gonna be a minicomic but i didnt like it lol murderdrones murderdronesj,aug 3 2023  141 pm utc,0.0,0.0,0.5,0.0,0.5,5,1,-0.6871,-1,0.7329416275024414
sillydrone,lol every damn light is on on this mans dashboard,aug 2 2023  1148 pm utc,0.0,0.0,1.0,0.0,0.0,-1,-1,0.0258,-1,0.7431847453117371
OhhSoKONNIE_,lol nikki  as a person who is in recovery over 35 years i can attest to you that its not the chinese its not the afghanistans its the person using the substance is the social economics is the demographics its the poverty its the war its the trauma its the united,aug 3 2023  141 pm utc,0.0,0.0,0.5,0.0,0.5,-2,-1,-0.6597,0,0.867002546787262
KoshkaChap,i want to get back into pokemon cards missed so many sets was looking at some absolute gems i have and was just itching to open more too bad that shits expensive  though one of these didnt come from a pack lol but my love for the cards kept me interested in the content,aug 3 2023  141 pm utc,0.25,0.0,0.12,0.12,0.5,4,-2,0.8106,1,0.7632091641426086
twisteyhornet,lie because im breaking all them bullshit generational curses lol,aug 3 2023  141 pm utc,0.0,0.0,0.5,0.0,0.5,-1,-4,-0.25,-1,0.9152141809463501
lmTheReasonWhy,remember the girlies was saying hes racially ambiguous lol,aug 2 2023  815 pm utc,0.0,0.0,0.0,0.0,0.0,3,-1,0.4215,0,0.933698832988739
JaeMajette,lol what,aug 1 2023  1134 pm utc,0.0,0.0,0.0,0.0,0.0,3,0,0.4215,0,0.8347360491752625
Brieyonce,its biden17 lol he isnt winning shit,aug 3 2023  1236 am utc,0.0,0.0,1.0,0.0,0.0,3,0,0.4493,-1,0.945600688457489
JasmineLWatkins,its time to go  lol,aug 2 2023  756 pm utc,0.0,0.0,0.0,0.0,0.0,3,0,0.4215,0,0.733005166053772
lyfeOftheParte,lol you think the feds will get there in time to save you or cops after defunding the police yalls cult has some serious cognitive dissonance,aug 3 2023  126 pm utc,0.0,0.0,0.0,0.0,0.0,5,-1,0.6908,-1,0.900063693523407
Prinz__JFC,thats just what you hope happens lol,aug 2 2023  1155 am utc,0.0,0.0,0.0,0.0,1.0,5,0,0.6908,0,0.8657710552215576
Victori08345038,dah lama tak buka tenor  terkejut tengok dunno why this gif of all things hit 1k share lol i never seen people use it on my tl,aug 3 2023  141 pm utc,0.0,0.5,0.5,0.0,0.0,4,0,0.6124,0,0.8869869112968445
Deon10000,lol the 947 music bank consists of over 14 000 songs buddy good luck,aug 3 2023  141 pm utc,0.5,0.0,0.0,0.0,0.5,9,2,0.8271,1,0.8974311947822571
Pug_Lynn,lol he just beat you by almost 40 points and he usually wins by 35 points but sure you have him beat this time,aug 3 2023  141 pm utc,0.0,0.0,1.0,0.0,0.0,7,1,0.7351,0,0.7870609164237976
_littlehuman_,if u would like a bluesky code i just looked at it for the first time in a bit and noticed i do have a couple invites now lol,aug 3 2023  141 pm utc,0.0,0.0,0.0,0.0,1.0,5,1,0.6486,0,0.5922839045524597
hbolton,lol youre still asking for proof when our corruption level has gone internationally   i was ashamed when i saw that video of paying the falcons directly from fifa it tells alot,aug 3 2023  141 pm utc,0.0,0.0,0.25,0.5,0.25,1,-2,-0.0772,-1,0.9535444378852844
Acada_tv,lol she wishes she was,aug 3 2023  141 pm utc,0.0,0.0,0.0,0.0,0.0,4,0,0.5267,0,0.7623469829559326
LongJoanSilver,probably bama despite all the chatter about it being a down year for them this year   osu has the best chance if mccord really balls out since marvin harrison is downright unstoppable lol  michigan just matches up poorly against most top tier teams that have great d lines,aug 3 2023  141 pm utc,0.14,0.14,0.14,0.0,0.57,15,1,0.9245,0,0.5902853012084961
RandyRainbow,lol alam ko naman talagang background friend lang ako from the start,aug 3 2023  136 pm utc,1.0,0.0,0.0,0.0,0.0,3,0,0.7184,0,0.8907111287117004
Edwyeen,lol thats p much the same as us only the gentle reminder is aimed at like 200 people,aug 3 2023  141 pm utc,0.0,0.0,0.0,0.0,0.0,5,2,0.802,0,0.9450670480728149
ravenynnas,this is completely random but id love to see pchal reacting to any of imported cheese videos lol specially tierlists,aug 3 2023  141 pm utc,1.0,0.0,0.0,0.0,0.0,6,1,0.8885,1,0.8613600134849548
Real_hotguts,streaming diablo iv and maybe some final fantasy xvi later the roman numeral duo lol come join me twitchtvmangascrub,aug 3 2023  141 pm utc,0.0,0.0,0.0,0.0,1.0,4,0,0.6124,1,0.7732447385787964
SteelWingRowlet,nvm i found it lol,aug 3 2023  141 pm utc,0.0,0.0,0.0,0.0,0.0,3,0,0.4215,0,0.5392443537712097
AragonesWebster,im glad we are starting to have a societal conversation about how many women see their sons as pseudo partners and have twisted relationships with them  boy mom is not a phrase borne of comedy lol it references a very commonly seen disturbing dynamic that must be stopped,aug 3 2023  141 pm utc,0.2,0.0,0.0,0.2,0.6,4,0,0.6637,0,0.5263627767562866
NYC_1Ts,thats the only angle youre getting lol no linos,aug 3 2023  141 pm utc,0.0,0.0,0.0,0.0,0.0,2,0,0.1531,0,0.9362656474113464
jazlynfaiithh,if it were up to me mine wouldnt go outside at all even tho theyre not rly in danger bc we live in the boonies and nowhere near any big roads but theres tons of strays and im scared theyll get into fights lol,aug 2 2023  1208 am utc,0.0,0.0,0.0,0.67,0.33,0,-2,-0.4238,-1,0.7363119721412659
StRochsJuniors,so art train well i didnt see you on the train pedityoung golden__lol 1972_1121 ugly700,aug 3 2023  141 pm utc,0.0,0.0,0.0,0.0,0.0,0,1,0.3321,0,0.89771968126297
maiamindel,its okay lol im just getting started at 24,aug 3 2023  141 pm utc,0.0,0.0,0.0,0.0,0.0,3,0,0.5719,1,0.5976249575614929
AllEliteKeeks,im sorry bro lol eagles fans be funny sometimes  cuz what was the reason,aug 3 2023  141 pm utc,0.0,0.0,0.33,0.67,0.0,6,-1,0.6597,0,0.6827213764190674
leakena_hl,lol wut try again,aug 3 2023  141 pm utc,0.0,0.0,0.0,0.0,0.0,3,0,0.4215,0,0.8618898987770081
WatcherAfar,lol how you gonna prove that when he obviously said to not be violent,aug 3 2023  141 pm utc,0.0,0.0,0.0,0.0,1.0,0,-1,0.7137,-1,0.5004897117614746
Johnnybereel,why did this got hid lol,aug 3 2023  141 pm utc,0.0,1.0,0.0,0.0,0.0,2,0,0.34,0,0.7787981033325195
Eklavya_FCB,lol twitter blue now officially lets you hide your blue check   and warns that you could still accidentally reveal that youre a subscriber,aug 3 2023  141 pm utc,0.0,0.14,0.14,0.57,0.14,-2,0,-0.1779,0,0.7578880190849304
dead_em_,he way better than rivers lol,aug 3 2023  141 pm utc,0.0,0.0,0.0,0.0,0.0,5,1,0.6908,1,0.9018913507461548
JoshuaPHilll,lol i dont know since when choi jinhyuk join mud but okey hes one show with heechul  i remember choi jinhyuk said before hes hate male idols except super junior,aug 2 2023  113 pm utc,0.0,0.0,0.0,1.0,0.0,4,0,0.4215,0,0.8293434381484985
sunflow3rmin_,lol what a full of oneself man,jun 13 2021  343 pm utc,0.0,0.0,0.0,0.0,0.0,3,0,0.4215,-1,0.8338054418563843
real_sioser,lol the way he got so shy  윤재혁,aug 3 2023  141 pm utc,0.0,0.0,0.0,0.0,0.0,2,0,0.0474,0,0.8533138632774353
PRFMnews,why is this comment sending me lol,aug 3 2023  232 am utc,0.0,0.0,0.0,0.0,1.0,3,0,0.4215,0,0.7172182202339172
lovelyjaehyuk_,its at least worth exploring at this point he certainly doesnt have the 200 foot reputation at this point but hes also 18 years old lol so why not give it a look,aug 3 2023  139 pm utc,0.0,0.0,0.5,0.0,0.5,5,2,0.705,0,0.9090232849121094
EsOnHerChest,i thiink that only applies to like celeb fan accounts or something like that so ur safe lol,aug 3 2023  141 pm utc,0.0,0.0,0.0,0.0,1.0,11,3,0.9108,0,0.9037516117095947
J_Fahringer,bcuz they be too busy tryna juggle 234 heffas lol,aug 3 2023  141 pm utc,0.0,0.0,0.0,0.0,1.0,3,0,0.4215,-1,0.8059316277503967
CaptNorth,i think this is still the last time i saw leeds win a game at elland road lol,aug 3 2023  141 pm utc,0.0,0.0,0.0,0.0,0.0,7,1,0.765,0,0.9329329133033752
Merritt125,messi has given a lot of penalties to his teammates in the past this has nothing to do with his percentages lol he just shared the penalty,aug 3 2023  141 pm utc,0.0,0.0,0.0,1.0,0.0,2,-1,0.296,0,0.89011549949646
Mehmehmeh311,2004 and 2009 they didnt have any omnibus alliance atleast their alliance is cohesive  your party is full of jokers who say that were here to destroy dravidam and go on to ally with a dravidian party lol cant even see eye to eye with your alliance partners on various issue,aug 3 2023  141 pm utc,0.0,0.0,0.0,0.0,1.0,0,-1,0.5719,-1,0.9249495267868042
pastelbeach_,i love vroom vroom and trophy that sonic 3 fm bass sound in vroom vroom goes hard af amongst many ither factors imo lol,aug 3 2023  141 pm utc,0.33,0.33,0.33,0.0,0.0,5,1,0.765,1,0.9892100691795349
_cub19,lol not that is just aint kid attracting,aug 3 2023  140 pm utc,1.0,0.0,0.0,0.0,0.0,5,0,0.0634,0,0.6807727813720703
you_so_funnie,lol thats exactly what i was thinking,aug 3 2023  140 pm utc,0.0,0.0,0.0,0.0,0.0,3,0,0.4215,1,0.5841622948646545
JamieSummersTV,lol a panic spew homeandaway,aug 2 2023  514 pm utc,0.0,0.5,0.0,0.0,0.5,0,-2,-0.128,0,0.8365018367767334
jeffphilips1,loluna newly cooked minister dun rush block me probably thought im among those doing archeology on his tl tell him im not against his appointment one bit even if he was daily abusing tinubu for breakfast buhari for lunch and osinbajo for dinner whats more important to,aug 3 2023  911 am utc,0.6,0.2,0.0,0.0,0.2,1,1,-0.5868,0,0.6502096652984619
Modeling_Imgntn,seth rogen is pretty cringe lol you can see the mark of his gross touch in every form of media hes had a hand in,aug 3 2023  140 pm utc,0.33,0.0,0.0,0.67,0.0,2,-1,0.7269,-1,0.9789279699325562
dafrabs,absolutely lol if youre an adult you shouldnt be asking athletes for autographs unless youre at an event specifically designed for that,aug 3 2023  140 pm utc,0.0,0.0,0.5,0.0,0.5,3,0,0.4754,0,0.7759319543838501
itsmattfred,its wash trading take out the reward picture is 100 different dont try to think it will be different lol organic volume is different than ppl being paid to trade lol,aug 3 2023  140 pm utc,0.0,0.0,0.0,0.0,1.0,8,1,0.8519,0,0.861497700214386
BaseballGabb,lol mrsinha_ why dont you call out ambanis channel news18india for giving space to so called maulana gulam sarwar  ambanis channel has invited him in several debate and he is a good from of prateektv,aug 3 2023  128 pm utc,0.0,0.0,0.0,0.0,1.0,6,1,0.7964,1,0.6932613849639893
ClBlockchain,lol go ahead and try to problve trump was mean prove his feelings  the dems wont even admit what a woman is and thats from ahchecks notes a scj thats a woman  hahahaha  you cant make this s hit up,aug 3 2023  140 pm utc,0.0,0.2,0.2,0.4,0.2,2,1,0.2978,-1,0.8514696359634399
zoo_bear,lol this was my grandpa after he got attacked by the same dudes after getting drunkone is buried,aug 3 2023  103 pm utc,0.0,0.0,0.0,0.0,0.0,2,0,-0.0516,-1,0.6313289999961853
ReallyRemona,lol points were made but are those tire shop pants no khakis,aug 3 2023  140 pm utc,0.0,0.0,0.67,0.33,0.0,2,0,-0.2263,0,0.9297645092010498
olivelampe,thats what jesus would do lol,aug 3 2023  140 pm utc,0.0,0.0,0.0,0.0,0.0,4,0,0.4215,0,0.7611975073814392
FiboSwanny,homeschooling helped our family  lol,aug 3 2023  140 pm utc,0.0,0.0,1.0,0.0,0.0,3,1,0.4215,1,0.949039101600647
crazyraiderrad2,youre welcome i love our team and love our community its the least i can do i think the wrap up show listeners need a nickname lol,aug 3 2023  140 pm utc,1.0,0.0,0.0,0.0,0.0,11,3,0.9349,1,0.9927518367767334
gorwow,you right tho lol,aug 3 2023  140 pm utc,0.0,0.0,0.0,0.0,0.0,3,1,0.4215,1,0.6951096653938293
desix_O825,lol so he drew someone patting someone,aug 3 2023  116 pm utc,0.0,0.0,0.0,0.0,1.0,3,0,0.4215,0,0.8985649347305298
neosborin,really hope at least one of them was x or xai or neuralink or spacex or starlink or boringcompany lol   is there one email for all of these company so i can send my resume once  get screened by someone who can think in omnidirection to see where i would fit best  if,aug 3 2023  140 pm utc,0.33,0.0,0.0,0.0,0.67,9,1,0.9134,0,0.8394906520843506
RatherBeeACapy,socks in the grass with no shoes lol,aug 3 2023  140 pm utc,0.0,0.0,0.0,0.0,1.0,2,0,0.1531,0,0.9352904558181763
Wolverine3625Lj,why not lol ty,aug 3 2023  140 pm utc,0.0,0.0,0.0,0.0,0.0,3,0,-0.5448,0,0.7281076908111572
tnsxpm,why this sound like a school presentation lol,aug 3 2023  140 pm utc,0.0,0.0,0.0,0.0,0.0,5,1,0.6486,0,0.7041279673576355
_Love_Lexi,i remember they tried to put that out lol,aug 2 2023  1227 am utc,0.0,0.0,0.0,1.0,0.0,3,0,0.4215,0,0.942035436630249
Baker32Jamie,im trying to find out literally contacted nike lol,aug 3 2023  140 pm utc,0.0,0.0,0.0,0.0,0.0,3,0,0.4215,0,0.9589323401451111
TempDaddy,i think that you are triggered  im secure in who i am dont project your insecurities onto me lol,aug 3 2023  140 pm utc,0.0,0.0,0.0,0.0,1.0,5,1,0.7602,-1,0.536439061164856
ChristineLoner6,lol so much for leaving sophie alone on one page ctvnews whines about the lack of privacy two pages over they are encroaching on it   seriously you cant make this level of public hypocrisy up facts stranger than fiction,aug 3 2023  140 pm utc,0.0,0.0,0.0,1.0,0.0,-1,-4,-0.6124,-1,0.852979838848114
TheBCHPodcast,cope cos your bitcoin sucks lol,aug 3 2023  1239 pm utc,0.0,0.0,0.0,0.0,0.0,0,-1,0.0772,-1,0.9645368456840515
Zailey74,this is disgusting if you ask me they should never do that or keep to themselves in their pride month cause poor innocent children also suffer what this people acted lol this completely beyond disgusting,aug 3 2023  140 pm utc,0.25,0.0,0.0,0.75,0.0,-7,-3,-0.7783,-1,0.9789175987243652
libsoftiktok,had the first iphone and that was enough for me  i still have my s10e and have had zero issues with it dont see me ever going back to an iphone  everyone with an apple is afraid to do updates as it screws up their phone  lol,aug 3 2023  310 am utc,0.0,0.0,0.0,0.0,1.0,1,-1,0.2023,1,0.4725170135498047
TheRealJeffMac5,lol now you have me craving bacon,aug 3 2023  140 pm utc,0.0,0.0,0.0,0.0,0.0,3,0,0.4215,1,0.5928264260292053
littlebabyjedi,girl children really arent safe lol future parents are on here screaming its not that deep incels are professing all sorts of madness onto the lives of young girls and those of us calling it out are allegedly fatherless you people havent had responsible protective fathers,aug 3 2023  140 pm utc,0.17,0.0,0.33,0.0,0.5,1,1,-0.8943,-1,0.9730058908462524
