username,tweet_text,date,happy,angry,surprise,sad,fear,afinn,bing,sid,bertweet,bertweet_confidence
tbratsis,enter now for your chance to win a pair of tickets to see tool at td garden on wednesday november 15 ulink1dxephdwrae_t,jul 29 2023  548 pm utc,0.0,0.0,0.0,0.0,1.0,6,1,0.7003,0,0.7725992202758789
tdgarden,we are 1 week away from samsmith at td garden on 85   get tickets before its too late bitly3goymqx,jul 29 2023  100 pm utc,0.0,0.5,0.0,0.5,0.0,0,1,0.0,1,0.5788669586181641
FOXSportsArg,sundaytd garden is ours thebig3s gonna bring the heat,jul 29 2023  530 pm utc,0.0,0.0,0.0,1.0,0.0,0,0,0.0,1,0.9357763528823853
tdgarden,the king of waltz andrerieu is bringing his musical extravaganza to td garden on sept 19   dont miss out get tickets now bitly3y8lae8,jul 28 2023  154 pm utc,0.0,0.0,0.0,1.0,0.0,-2,-1,0.1139,1,0.9534702301025391
AshleyBratsis88,enter now for your chance to win a pair of tickets to see tool at td garden on wednesday november 15 ulink1dxephdwc4t_t,jul 29 2023  450 pm utc,0.0,0.0,0.0,0.0,1.0,6,1,0.7003,0,0.7700393199920654
hockey_east,heplaysoftheyear mens bracket round 1 matchup 4 thread   brady berard plays the bounce off the end board and puts it in the net to send friarshockey to td garden   wherechampionsplay x gofriars,jul 29 2023  112 pm utc,0.0,0.0,0.33,0.17,0.5,0,1,0.25,0,0.9452029466629028
CookedByCeltics,enter now for your chance to win a pair of tickets to see tool at td garden on wednesday november 15 ulink1dxephdw45c_t,jul 29 2023  1245 pm utc,0.0,0.0,0.0,0.0,1.0,6,1,0.7003,0,0.7843025326728821
Chief_sFriend,they should put a giant basketball jesus statue on top of the td garden in the pose of the christ the redeemer statue in brazil,jul 29 2023  338 pm utc,0.0,0.0,0.33,0.33,0.33,3,1,0.2023,0,0.8567898869514465
TheSportsMuseum,we are closed today due to the big3 we look forward to seeing our visitors monday for any of our walkin sports museum tours or our td garden arena tours,jul 29 2023  200 pm utc,1.0,0.0,0.0,0.0,0.0,0,0,0.0,1,0.6670318841934204
ChrisDring27,got it for 50 bucks at td garden,jul 29 2023  146 pm utc,0.0,0.0,0.0,0.0,0.0,0,0,0.0,0,0.9493503570556641
Unique_Heat,july 29 2023 ice cube cypress hill and more venue td garden 100 legends way boston ma 02114,jul 29 2023  1207 pm utc,0.0,0.0,0.0,0.0,0.0,0,0,0.0,0,0.9576320648193359
tomdobs55,i refuse to call the td garden anything but the fleetcenter,jul 29 2023  1145 am utc,0.0,0.0,0.0,1.0,0.0,-2,-1,-0.1531,-1,0.8760088086128235
Bradymags1213,he wrestled a dark match at the td garden and the crowd went wild boston was ready to embracethechange,jul 29 2023  514 am utc,0.5,0.0,0.0,0.5,0.0,0,-1,0.3612,1,0.5546756386756897
UnoRory,ive seen mb20 6 times  post malone for the 1st time in sept 22 at td garden and became a huge fan  definitely worth seeing him a genuine guy with great energy i wish i was seeing you on this tour but decided on madonna in montreal which is now postponed,jul 29 2023  425 am utc,0.25,0.0,0.0,0.0,0.75,9,3,0.7469,1,0.9888290762901306
prevailwyd,does anyone know why the td garden used to look foggy a lil,jul 29 2023  138 am utc,0.0,0.0,0.0,0.0,0.0,0,0,0.0,0,0.9139196276664734
bandzzlewis,hopefully we play dem this year i want kyrie to go off on em at td garden,jul 28 2023  1055 pm utc,0.0,0.0,0.0,0.0,1.0,3,0,0.6597,1,0.8147341012954712
jmullen2320,no thank you td garden needs the  energy ufc292,jul 28 2023  1055 pm utc,0.0,0.0,0.0,0.0,0.0,1,1,0.34,0,0.6439945101737976
iangarryMMA,for fohboston i reviewed the erykah baduyasiin bey concert last weekend at td garden take a read here frontofhousebostoncomconce,jul 28 2023  822 pm utc,0.0,0.0,0.0,0.0,0.0,0,0,0.0,0,0.9213099479675293
alulahussen,the big3 returns to boston with six games scheduled for sunday at td garden     ice cube and i chatted about a range of topics including the event his interview with tucker carlson which oldschool celtics got on his nerves the most and more  bostoncomsportssports202,jul 17 2023  345 am utc,0.0,0.0,0.0,0.0,0.0,-1,0,-0.1027,0,0.9603869318962097
_KhariThompson,a special message from the one and only scalabrine   get your tickets for thebig3 at td garden this sunday july 30 bitly3karrer,jul 28 2023  947 pm utc,0.0,0.0,1.0,0.0,0.0,0,0,0.4019,0,0.5109075903892517
tdgarden,a legendary team whipped our andover hs team in the gahden speaking of when will miaa get the girls back  td garden move over,jul 28 2023  714 pm utc,0.0,0.0,0.5,0.0,0.5,0,1,0.0,1,0.6192375421524048
MattBuckley_MA,lets say it does happen are you going to be as loud and proud as you are now to admit you were wrong or are you going to hide in darkness like the city of boston did after getting sent home not once but twice by 2 south fl teams this last year in the td garden,jul 28 2023  726 pm utc,0.2,0.2,0.0,0.6,0.0,-1,-1,0.0772,-1,0.5549100041389465
champagnebodden,enter now for your chance to win a pair of tickets to see tool at td garden on wednesday november 15 ulink1dxephdmqv8_t,jul 28 2023  717 pm utc,0.0,0.0,0.0,0.0,1.0,6,1,0.7003,0,0.7890130877494812
tbratsis,enter now for your chance to win a pair of tickets to see tool at td garden on wednesday november 15 ulink1dxephdmbye_t,jul 28 2023  705 pm utc,0.0,0.0,0.0,0.0,1.0,6,1,0.7003,0,0.7708429098129272
MurphysLaw74,not that its surprising news but nhlbruins team president cam neely has confirmed that patrice bergerons no 37 will be raised to the td garden rafters  do they do it on march 3 37 against leafsforever  more at boshockeynow   bostonhockeynowcom202307,jul 27 2023  941 pm utc,0.0,0.0,0.5,0.0,0.5,-1,0,-0.4951,0,0.7790643572807312
Makemegiggle617,i copped my ticket to see jonasbrothers at td garden another solo concert on the horizon for me i cannot wait,jul 28 2023  502 pm utc,0.0,0.0,0.0,0.0,0.0,0,0,0.0,1,0.9931360483169556
AshleyBratsis88,enter now for your chance to win a pair of tickets to see tool at td garden on wednesday november 15 ulink1dxephdjtcy_t,jul 28 2023  426 pm utc,0.0,0.0,0.0,0.0,1.0,6,1,0.7003,0,0.7595170140266418
BGlobeSports,ice cubes big3 returns to boston bringing a 3on3 basketball spectacle to td garden tribalqnfh2qa,jul 28 2023  401 pm utc,0.0,0.0,0.0,1.0,0.0,0,0,0.0,0,0.6880766153335571
abratsis49,enter now for your chance to win a pair of tickets to see tool at td garden on wednesday november 15 ulink1dxephdj9vy_t,jul 28 2023  349 pm utc,0.0,0.0,0.0,0.0,1.0,6,1,0.7003,0,0.7669087052345276
iwilltweetsoon,i sat in front of the td garden sign in traffic too long and now i have a ticket to a jonasbrothers concert,jul 28 2023  340 pm utc,0.0,0.0,0.0,0.0,1.0,0,0,0.0,0,0.7271140217781067
FitzProv,ice cubes big3 returns to boston bringing a 3on3 basketball spectacle to td garden bostonglobecom20230728s via bostonglobe,jul 28 2023  326 pm utc,0.0,0.0,0.0,1.0,0.0,0,0,0.0,0,0.7163005471229553
arigcevans,big3 basketball is returning to causeway street on sunday with a sixgame slate set to tip off at 1230 pm at td garden tribal8gkactz,jul 25 2023  1112 pm utc,0.0,0.0,0.0,0.67,0.33,0,0,0.0,0,0.9428229928016663
BostonGlobe,boston ma at td garden august 15th and 16th,jul 28 2023  312 pm utc,0.0,0.0,0.0,0.0,0.0,0,0,0.0,0,0.9733906984329224
jonasbrothers,not that its surprising news but nhlbruins team president cam neely has confirmed that patrice bergerons no 37 will be raised to the td garden rafters  do they do it on march 3 37 against leafsforever  more here  bostonhockeynowcom202307,jul 16 2023  842 pm utc,0.0,0.0,0.5,0.0,0.5,-1,0,-0.4951,0,0.7663241028785706
BOSHockeyNow,tbh i didnt even know who he was when he invited me to seat with them at the td garden media dining on my first nba game there such a legend youll be missed mg thanks for your kindness and encouragement,jul 27 2023  942 pm utc,0.0,0.0,0.33,0.33,0.33,2,1,0.7579,1,0.9907870888710022
nino22,we are open today for sports museum tours  td garden arena tours we look forward to seeing our visitors for our any of our walkin sports museum tours at 100 pm 200 pm 300 pm 400 pm  500 pm or td garden arena tours at 1230 pm 130 pm 230 pm 330 pm  430 pm,jul 28 2023  222 pm utc,0.0,0.0,0.0,0.0,1.0,0,0,0.0,1,0.9770632982254028
NBCSBoston,the king of waltz andrerieu is bringing his musical extravaganza to td garden on sept 19   dont miss out get tickets now bitly3y8lae8,jul 27 2023  346 pm utc,0.0,0.0,0.0,1.0,0.0,-2,-1,0.1139,1,0.9534702301025391
CFCDUBois,was td garden till game 7 hit both the bruins and celtics,jul 17 2023  306 pm utc,0.0,1.0,0.0,0.0,0.0,0,0,0.0,0,0.9568392634391785
MiamiLebronn,event update  post malones show at td garden originally scheduled for september 24th has been rescheduled to october 10th previously purchased tickets will be valid for the new rescheduled date,jul 28 2023  124 pm utc,0.0,0.0,0.0,0.0,1.0,0,0,0.0,0,0.9719530344009399
chander65698221,drivegooglecomfiled1jyr download 100 book completely free your garden  neighbors envy owners pridechina garden   td garden   garden city   raised garden bed   brooklyn botanic garden   chicago botanic garden   garden center   garden gnome,jul 28 2023  819 am utc,0.5,0.0,0.0,0.5,0.0,0,2,0.3597,0,0.6325482130050659
bymandaaa,bruins td garden 75 because of the fans 25 cuz of the pizza,jul 28 2023  502 am utc,0.0,0.0,0.0,0.0,0.0,0,1,0.0,0,0.662021815776825
PatrickKur53960,td garden little caesars area  madison square garden bell center pnc bank arena and so many others yup its true,jul 28 2023  339 am utc,0.0,0.0,0.0,0.0,1.0,0,0,0.4215,0,0.539109468460083
welshiewhiteout,was td garden till game 7 hit both the bruins and celtics,jul 28 2023  330 am utc,0.0,1.0,0.0,0.0,0.0,0,0,0.0,0,0.9568392634391785
mamcnich,i did boston a few years ago my advise dont park near td garden find a different parking garage and take the t to the arena way cheaper toronto while a fun city wasnt the best arena wise did that last year i have 4 eastern conference arenas i still need to visit,jul 28 2023  232 am utc,0.25,0.0,0.0,0.0,0.75,7,4,0.4646,0,0.8830157518386841
Tjomix,my first nhl game   attending boston bruins vs new york rangers at td garden facebookcom100001247869860,mar 28 2019  1211 am utc,0.0,0.0,1.0,0.0,0.0,0,0,0.0,0,0.9424545764923096
tbratsis,enter now for your chance to win a pair of tickets to see tool at td garden on wednesday november 15 ulink1dxephdc8r8_t,jul 28 2023  216 am utc,0.0,0.0,0.0,0.0,1.0,6,1,0.7003,0,0.790809690952301
jonasbrothers,boston ma at td garden august 15th and 16th,jul 16 2023  842 pm utc,0.0,0.0,0.0,0.0,0.0,0,0,0.0,0,0.9733906984329224
Elliott14727088,ive been to all of them my team is vegas and i truly believe its the best arena experience seattle is very cool but the views of the ice arent so great  td gardenboston is my 2nd fave  ive been to tampa 2x and their fans and even the staff are the worst to visitors,jul 28 2023  1221 am utc,0.67,0.0,0.0,0.33,0.0,4,4,-0.6323,1,0.6474624872207642
DannyMartinez4,looking for someone to cook in td garden,jul 27 2023  1145 pm utc,0.0,0.0,0.0,0.0,0.0,0,0,0.0,0,0.9549328088760376
jacedelaney,they all made the playoffs in addition to the islanders nets and mets the teams that dont play at the td garden cant say that i know its hard being the inferior little brother city its ok at the rate that they are going the red sox should reach 27 chips by 2099,jul 27 2023  1121 pm utc,0.0,0.25,0.12,0.25,0.38,-2,-2,-0.4284,1,0.6850460171699524
MindOfVito,i had this year 1 cause of the narrative coming from last year 8th seed winning consecutive games at td garden going up 30 boston fighting back one of the craziest endings ever in game 6 but i understand your opinion thib,jul 27 2023  1139 pm utc,0.0,0.0,0.33,0.33,0.33,2,2,0.09,0,0.8525229692459106
Fayedawayy,technically i scored the last basket in the old boston garden i worked on the film celtic pride on the last day of filming some of the crew and i played a 3 on 3 game at lunch i made the final shot after filming that day the floor was moved over to td garden truestory,jul 27 2023  1114 pm utc,0.33,0.11,0.11,0.11,0.33,0,2,0.5859,0,0.8294815421104431
MarchandEnjoyer,not that its surprising news but nhlbruins team president cam neely has confirmed that patrice bergerons no 37 will be raised to the td garden rafters  do they do it on march 3 37 against leafsforever  more at boshockeynow   bostonhockeynowcom202307,jul 27 2023  1013 pm utc,0.0,0.0,0.5,0.0,0.5,-1,0,-0.4951,0,0.7790643572807312
MurphysLaw74,not that its surprising news but nhlbruins team president cam neely has confirmed that patrice bergerons no 37 will be raised to the td garden rafters  do they do it on march 3 37 against leafsforever  more here  bostonhockeynowcom202307,jul 27 2023  941 pm utc,0.0,0.0,0.5,0.0,0.5,-1,0,-0.4951,0,0.7663241028785706
BOSHockeyNow,no mf way parking at the td garden is 60,jul 27 2023  942 pm utc,0.0,0.0,0.0,0.0,1.0,-1,0,-0.296,-1,0.9280638098716736
Taurusbby0502,such an amazing song take me out out of that truck all of your music videos and albums such an amazing fantastic blast night on february 17th td garden boston ma denim and rhinestones tour up front pit cant wait to listen rest of deluxe edition album on itunes sept 22nd,jul 27 2023  801 pm utc,0.2,0.0,0.6,0.2,0.0,12,3,0.9042,1,0.9928204417228699
musiccountry_1,10 hockey community in october i had the chance to see my drawing of patrice bergeron at the museum of fine arts in boston later he signed my drawing and said it was so cool and i wish i had met him that day during the black friday game td garden had a standing ovation for,jul 27 2023  736 pm utc,0.38,0.0,0.0,0.0,0.62,6,3,0.8296,1,0.9878609776496887
babybergy37,i often just think about the heat having to walk into td garden for a game 7 in the ecf with backs against the wall and caleb martin turning into a top 5 player in basketball  man last season was weird,jul 26 2023  1051 pm utc,0.0,0.33,0.67,0.0,0.0,1,0,-0.0258,0,0.778786838054657
BradyHawk305,enter now for your chance to win a pair of tickets to see tool at td garden on wednesday november 15 ulink1dxephd7b80_t,jul 24 2023  228 pm utc,0.0,0.0,0.0,0.0,1.0,6,1,0.7003,0,0.7815310955047607
tbratsis,lakers and celtics blowing back to back leads ad and jb missing the game clutching ft lebron went on his knees in td garden while pat bev stole a camera to call out eric lewiss blatant nocall hands down funniest reg season game ive ever seen,jul 27 2023  617 pm utc,0.0,0.0,0.4,0.2,0.4,-2,-1,0.34,1,0.475492388010025
Treybana,enter now for your chance to win a pair of tickets to see tool at td garden on wednesday november 15 ulink1dxephd70ac_t,jul 27 2023  555 pm utc,0.0,0.0,0.0,0.0,1.0,6,1,0.7003,0,0.7862644791603088
Dom_2k,boston ma at td garden august 15th and 16th,jul 26 2023  230 pm utc,0.0,0.0,0.0,0.0,0.0,0,0,0.0,0,0.9733906984329224
Casanova5256,we were walking the freedom trail and stopped at the red line i was gonna take it just to see where it goes whats the one that goes by the td garden if you watch the old celtics games they show a train outside i walked a toks that bridge following the trail and didnt see it,jul 27 2023  525 pm utc,0.0,0.17,0.17,0.33,0.33,1,1,0.5106,0,0.9574024677276611
SRTBoston617,td garden of course,jul 27 2023  516 pm utc,0.0,0.0,0.0,0.0,0.0,0,0,0.0,0,0.6963065266609192
PopBase,now the celtics have to raise banner 18 to the td garden rafters in 24  celticsvoice ive met 100s of celebritieseven more local celebsbetween my sportswriting career and my former job in hotel management in newportyou were undoubtedly the classiest of them all,jul 26 2023  852 pm utc,0.0,0.0,0.0,0.0,1.0,0,0,0.0,1,0.9622446298599243
NBCSBoston,enter now for your chance to win a pair of tickets to see tool at td garden on wednesday november 15 ulink1dxephd5nfr_t,jul 27 2023  346 pm utc,0.0,0.0,0.0,0.0,1.0,6,1,0.7003,0,0.7848215699195862
PorkMeat_1,td garden i am outside of you,jul 27 2023  441 pm utc,0.0,0.0,0.0,0.0,0.0,0,0,0.0,0,0.9560197591781616
abratsis49,vegas or boston td garden is loud especially during the playoffs and vegas just has that rowdiness about their fans,jul 27 2023  406 pm utc,0.0,0.0,0.0,0.0,0.0,0,0,0.0,-1,0.8980877995491028
jarvydrury17,td garden is good bell centre is good msg is good vegas is cheesy af but in an enjoyable way chicago was a little quiet when i went the panthers do this weird rawr thing every few seconds and in general are not cheesy good devils are meh islanders are ok,jul 27 2023  350 pm utc,0.33,0.0,0.33,0.33,0.0,10,3,0.9484,1,0.6792548298835754
TheBestFanInUSA,jesus starting pits at td garden,jul 27 2023  347 pm utc,0.0,0.0,0.0,1.0,0.0,1,0,0.0,0,0.8635320067405701
L1025Mark,its going down this sunday   grab your tickets to see thebig3s return to td garden bitly3karrer,jul 27 2023  339 pm utc,0.0,0.0,0.0,0.0,0.0,0,0,0.0,1,0.5715630650520325
b1acksuicide,td garden is great but im biased,jul 27 2023  332 pm utc,1.0,0.0,0.0,0.0,0.0,1,0,-0.0258,1,0.9671965837478638
tdgarden,td garden full of lamelos shoes when they play charlotte i feel why bro hurt,jul 27 2023  251 pm utc,0.0,0.0,0.0,0.33,0.67,-2,-1,-0.25,-1,0.9699046015739441
CommanderVolkov,boston ma at td garden august 15th and 16th,jul 27 2023  232 pm utc,0.0,0.0,0.0,0.0,0.0,0,0,0.0,0,0.9733906984329224
Pajita06,boston black wallstreet he must aint never been outside the td garden the greatest black celtic statue being in city hall plaza tells everything we need to know about the city   tell just give his check to bernice burgos,jul 27 2023  217 pm utc,0.0,0.0,0.0,0.33,0.67,3,1,0.6369,0,0.6986507773399353
jonasbrothers,we are open today for sports museum tours  td garden arena tours we look forward to seeing our visitors for our any of our walkin sports museum tours at 100 pm 200 pm 300 pm 400 pm  500 pm or td garden arena tours at 1230 pm 130 pm 230 pm 330 pm  430 pm,jul 16 2023  842 pm utc,0.0,0.0,0.0,0.0,1.0,0,0,0.0,1,0.9770632982254028
TheSportsMuseum,last year i enjoyed myself so much it was a special year and the most fun ive had playing hockey   andybrickley spoke 1on1 with patrice bergeron following his retirement press conference at td garden   nhlbruins  watch the full interview rbgyeprg9,jul 27 2023  200 pm utc,0.29,0.0,0.29,0.0,0.43,4,2,0.8858,1,0.9926162362098694
GapiBolhar,a recordsetting performance an electric td garden atmosphere a blowout of our division rival in a winnertakeall matchup  game 7 vs philly is our game of the year nbacomcelticsnewssidebar,jul 27 2023  1159 am utc,0.0,0.0,1.0,0.0,0.0,0,-1,0.0,1,0.9452948570251465
NESN,technically i scored the last basket in the old boston garden i worked on the film celtic pride on the last day of filming some of the crew and i played a 3 on 3 game at lunch i made the final shot after filming that day the floor was moved over to td garden truestory,jul 26 2023  604 pm utc,0.33,0.11,0.11,0.11,0.33,0,2,0.5859,0,0.8294815421104431
celtics,a recordsetting performance an electric td garden atmosphere a blowout of our division rival in a winnertakeall matchup  game 7 vs philly is our game of the year nbacomcelticsnewssidebar,jul 25 2023  656 pm utc,0.0,0.0,1.0,0.0,0.0,0,-1,0.0,1,0.9452948570251465
yungruzinskii,all im gonna say is i didnt leave until the handshake line was way over with with when tampa beat the canes in the 2021 playoffs   i definitely wouldnt have left my seat in td garden with bergeron still on the ice,jul 27 2023  740 am utc,0.0,0.0,0.5,0.0,0.5,-1,0,0.4306,0,0.7985588908195496
NESN,last year i enjoyed myself so much it was a special year and the most fun ive had playing hockey   andybrickley spoke 1on1 with patrice bergeron following his retirement press conference at td garden   nhlbruins  watch the full interview rbgyeprg9,jul 26 2023  604 pm utc,0.29,0.0,0.29,0.0,0.43,4,2,0.8858,1,0.9926162362098694
985TheSportsHub,holding court at td garden on wednesday bruins legend patrice bergeron explained why it was time for him to walk away from the game of hockey 985thesportshubcomlisticle,jul 26 2023  842 pm utc,0.0,0.5,0.0,0.0,0.5,0,0,0.0,0,0.9642349481582642
ErikaaLauren,what i truly love about jbs community work is that he goes to the underserved communities and is well aware of the places that need his help the most one thing i cant stand about the boston is white and racist crew is they think boston is just like td garden area lol,jul 27 2023  404 am utc,0.17,0.0,0.0,0.17,0.67,7,3,0.9042,1,0.946068525314331
bcwomenshockey,me at td garden on feb 6 2023 watching a talented line of burke gustafson and ambrosio defending a fast break at the end of ot,jul 27 2023  359 am utc,0.0,0.0,0.67,0.0,0.33,0,1,0.5106,0,0.6138666272163391
IanSteeleABC6,mentioned here one pillar at td garden and in the new england community is moving on patrice bergeron while another is setting a foundation jaylen brown  abc6 bleedgreen nhlbruins,jul 27 2023  342 am utc,0.0,0.0,0.0,0.5,0.5,0,0,0.0,0,0.9401365518569946
IanSteeleABC6,jillian ann  riptide pipedvideow_1bds4vg0 via youtube a fellow coworkers who i used to work with when i worked at td garden shes in los angeles now working on her music career she was a fellow usher when i worked there i believe she also went to berklee college of music,jul 27 2023  341 am utc,0.0,0.0,0.0,0.0,1.0,0,3,0.0,0,0.8745766878128052
jdnboston,cam neely on if no 37 will be up in the td garden rafters in the near future  thats a nobrainer really,jul 27 2023  319 am utc,0.0,0.0,0.0,0.0,0.0,-1,0,-0.296,0,0.9253696203231812
ConorRyan_93,at td garden a thank you message for patrice bergeron nhlbruins,jul 26 2023  559 pm utc,0.0,0.0,0.0,0.0,0.0,2,1,0.3612,1,0.868613064289093
IrwinSeavey1796,im definitely going to the jonas brothers show not knowing the setlist and i mean it this time as my show is literally only the 3rd show of the tour so i dont need to wait as long  cant wait to see them on joes birthday next month at td garden in boston,jul 27 2023  200 am utc,0.0,0.0,0.5,0.17,0.33,0,0,0.4019,1,0.989700436592102
CaughtOnKAM,i wanted to blow up td garden when that happened,jul 27 2023  153 am utc,0.0,0.0,1.0,0.0,0.0,0,-1,0.0,-1,0.9623998403549194
AEWonTV,a royal rampage tbs title fight and a trios grudge match is on the menu tonight  dont miss aewrampage from the td garden at 109c on  tntdrama,jul 21 2023  405 pm utc,0.0,0.0,0.0,0.75,0.25,-3,-3,-0.286,0,0.6718149781227112
KnicksArgentoo,several years ago here in boston a parking lot a block from the td garden raised their event parking rate from 1200 to 3600 greed prevails and i dont know what they charge today,jul 26 2023  1126 pm utc,0.2,0.0,0.0,0.2,0.6,-4,-1,-0.6808,-1,0.9592535495758057
garner1708,holding court at td garden on wednesday bruins legend patrice bergeron explained why it was time for him to walk away from the game of hockey 985thesportshubcomlisticle,jul 27 2023  112 am utc,0.0,0.5,0.0,0.0,0.5,0,0,0.0,0,0.9642349481582642
985TheSportsHub,goatedwok egoovo 7bankaii chefcurryeraa 30dynasty cookedbysteph   take over his replies like how curry took over td garden in game 4,jul 26 2023  842 pm utc,0.0,0.0,0.0,0.0,0.0,2,1,0.3612,0,0.9489730596542358
your_awannabe,cam neely on patrice bergerons no 37 getting raised to the td garden rafters thats a nobrainer really well figure out a time to do that he certainly has earned that,jul 27 2023  1240 am utc,0.0,0.0,0.0,0.0,0.0,-1,1,0.3804,1,0.9555666446685791
HackswithHaggs,from the moment i was drafted i made a vow to myself that i would do whatevers possible to get another banner raised in td garden despite our previous shortcomings mishaps and key departures the vow still remains i have the upmost confidence in us,jul 26 2023  923 pm utc,0.0,0.17,0.0,0.5,0.33,2,0,0.5106,1,0.9719609618186951
babybergy37,10 hockey community in october i had the chance to see my drawing of patrice bergeron at the museum of fine arts in boston later he signed my drawing and said it was so cool and i wish i had met him that day during the black friday game td garden had a standing ovation for,jul 26 2023  1051 pm utc,0.38,0.0,0.0,0.0,0.62,6,3,0.8296,1,0.9878609776496887
PatrickFahlen,cam neely on patrice bergerons no 37 getting raised to the td garden rafters thats a nobrainer really well figure out a time to do that he certainly has earned that,jul 26 2023  229 pm utc,0.0,0.0,0.0,0.0,0.0,-1,1,0.3804,1,0.9555666446685791
HackswithHaggs,a recordsetting performance an electric td garden atmosphere a blowout of our division rival in a winnertakeall matchup  game 7 vs philly is our game of the year nbacomcelticsnewssidebar,jul 26 2023  923 pm utc,0.0,0.0,1.0,0.0,0.0,0,-1,0.0,1,0.9452948570251465
celtics,watch reporting from td garden on the retirement of nhlbruins captain patrice bergeron  reflecting on the big moments the journey from draft day to providence to boston  the impact of the center during his 19 seasons wearing the spoked b abc6,jul 25 2023  656 pm utc,0.25,0.25,0.25,0.0,0.25,1,1,0.0,0,0.9208104610443115
NCoitABC6,last year i enjoyed myself so much it was a special year and the most fun ive had playing hockey   andybrickley spoke 1on1 with patrice bergeron following his retirement press conference at td garden   nhlbruins  watch the full interview rbgyeprg9,jul 26 2023  1030 pm utc,0.29,0.0,0.29,0.0,0.43,4,2,0.8858,1,0.9926162362098694
HackswithHaggs,cam neely on patrice bergerons no 37 getting raised to the td garden rafters thats a nobrainer really well figure out a time to do that he certainly has earned that,jul 26 2023  923 pm utc,0.0,0.0,0.0,0.0,0.0,-1,1,0.3804,1,0.9555666446685791
ConorRyan_93,cam neely on if no 37 will be up in the td garden rafters in the near future  thats a nobrainer really,jul 26 2023  559 pm utc,0.0,0.0,0.0,0.0,0.0,-1,0,-0.296,0,0.9253696203231812
NESN,patrice bergeron addresses the media live at td garden   watch it here rbgyqnyq8,jul 26 2023  336 pm utc,0.0,0.0,1.0,0.0,0.0,0,0,0.0,0,0.9590775370597839
ArchieCross18,banner 18 is coming to td garden baby,jul 26 2023  823 pm utc,0.0,0.0,1.0,0.0,0.0,0,0,0.0,0,0.6108381748199463
PatrickFahlen,cam neely on if no 37 will be up in the td garden rafters in the near future  thats a nobrainer really,jul 26 2023  229 pm utc,0.0,0.0,0.0,0.0,0.0,-1,0,-0.296,0,0.9253696203231812
