username,tweet_text,date,happy,angry,surprise,sad,fear,afinn,bing,sid,bertweet,bertweet_confidence
bogotablickyana,my double hr dosyabos watchlist for today and the next few days i wont be posting screenshots of my exact picks bc i dont want to hear yall bitch about not hitting lol   d swanson  d jansen   m muncy  k tucker   g torres  b bichette  p alonso  c morel   a bohm  s ohtani,aug 3 2023  1210 pm utc,0.5,0.5,0.0,0.0,0.0,-1,-1,-0.7472,0,0.5280646085739136
fella_IV,from he fights to i wont debate because fox is mean to me lol   of course if i were advising trump id be terrified of debates too his 2020 debates with biden were objectively bad and hes lost a few steps since then,aug 3 2023  142 pm utc,0.0,0.0,0.2,0.6,0.2,-6,-1,-0.8658,-1,0.9740594625473022
mattdizwhitlock,lol loser blocked me when i called him out,aug 2 2023  1120 pm utc,0.0,0.0,0.0,1.0,0.0,-1,-1,-0.4019,-1,0.9619571566581726
AlexThomp,lol i didnt say thats the only part of the south ive lived in ive lived all over the south,aug 2 2023  1042 pm utc,0.0,0.0,0.0,0.0,0.0,3,0,0.4215,0,0.9451345801353455
buiarslove,lol this is dumbest question ever  thai sone support all of them no matter what who they love its not you business about the profile pic that her use in the forum if you dont like just shut up and get yourself off,aug 3 2023  142 pm utc,0.2,0.2,0.0,0.0,0.6,10,3,0.4922,-1,0.5940055251121521
prodcbgluvr,lol the bots are bored,aug 3 2023  142 pm utc,0.0,0.0,0.0,1.0,0.0,1,-1,0.1779,-1,0.473819375038147
shibafoto,gmfb please dont ever do this animal segment again lol,aug 3 2023  142 pm utc,0.0,0.0,0.0,0.0,0.0,4,0,0.6249,-1,0.826596200466156
taengguuuuuu,lol crazy what a year can do who wouldve ever thought,aug 3 2023  123 pm utc,0.0,0.0,0.0,0.0,1.0,1,-1,0.1027,1,0.7449339032173157
akgrl33,lol overseas yrf dhe,aug 3 2023  142 pm utc,0.0,0.0,0.0,0.0,0.0,3,0,0.4215,0,0.8982487916946411
UncleVogel,lol  not hating like this,aug 3 2023  142 pm utc,1.0,0.0,0.0,0.0,0.0,2,0,0.5255,0,0.8171482086181641
YeGlo94,we criticised former governor simon lalong for accepting to chair the northern governors forum but today were celebrating and congratulating sen simon mwadkwon on his emergence as one of the trustees of northern senators forum lol,aug 3 2023  1118 am utc,0.5,0.0,0.0,0.0,0.5,7,0,0.8779,1,0.732654869556427
C__JohnnyDepp,ai seen all the videos we have lol,aug 3 2023  142 pm utc,0.0,0.0,0.0,0.0,0.0,3,0,0.4215,0,0.9338987469673157
DaDarkniGhtLon,i am watching jk live and his house needs to get it together lol,aug 3 2023  142 pm utc,0.0,0.0,1.0,0.0,0.0,3,0,0.5719,-1,0.575931191444397
KanzahAD,lol  its almost an nfl game  better than anything else on the tube thats for sure,aug 3 2023  142 pm utc,0.0,0.0,0.0,0.0,1.0,5,1,0.7906,1,0.9908745288848877
Bryson_86,they can say whatever theyd like lol i know these cowards would never ever step to me in person  all talk,aug 3 2023  142 pm utc,0.0,0.0,0.0,0.0,0.0,5,1,0.6486,-1,0.9685896039009094
hisgirlypop,lol is there anything working normally in his house other than the kitchen,aug 3 2023  142 pm utc,0.0,0.0,0.0,0.0,1.0,3,0,0.4215,0,0.8166636228561401
miiniyoongs,fngr gtii    look at tup  we all know its a short squeeze with a huge naked short but press always has a neg twist and never reports the truth   bear raid yest before story lol   financeyahoocomme11fcddd,aug 3 2023  138 pm utc,0.0,0.4,0.2,0.2,0.2,4,-1,0.4417,0,0.7035414576530457
HAMShortkiller,lol mrsinha_ why dont you call out ambanis channel news18india for giving space to so called maulana gulam sarwar  ambanis channel has invited him in several debate and he is a good from of prateektv,aug 3 2023  1138 am utc,0.0,0.0,0.0,0.0,1.0,6,1,0.7964,1,0.6932613849639893
zoo_bear,too much fortune telling lol,aug 3 2023  103 pm utc,0.5,0.0,0.0,0.5,0.0,3,1,0.4215,0,0.7934237122535706
quesoarmoire,lol why do russians always try to awaken other russians in english can it be they are just trying to virtue signal to a foreign audience nono its stupid ukrainians who dont get the mysterious russian soul,aug 3 2023  142 pm utc,0.0,0.0,0.67,0.33,0.0,1,-1,0.296,-1,0.9601049423217773
MariiMontto,you really dont have to write kanji to learn how to read them  english spelling is kind of similar  ive always had trouble spelling words like  psychology chicken yes i often misspell this which i did writing this lol pseudoscience acknowledge i can never write this one,aug 3 2023  142 pm utc,0.2,0.2,0.0,0.4,0.2,3,0,0.5499,-1,0.5373921990394592
missingbtstime,we spent 71m on kepa lol you will not see me complaining about this fee   not to mention we are trying to soften their stance on caicedo by taking a player that they dont want off of their books,aug 3 2023  142 pm utc,0.0,0.0,0.5,0.5,0.0,4,-1,0.4888,0,0.6636678576469421
btsbaragi_jk,and maybe a few other dudes too lol,aug 3 2023  141 pm utc,0.0,0.0,0.0,0.0,0.0,3,0,0.4215,0,0.9470709562301636
AdriTelevision,lol sorrytheyve already gotten camera reels of your precious obamaand hillary saying the things theyre accusing pres trump of,aug 3 2023  142 pm utc,0.0,0.33,0.67,0.0,0.0,1,1,0.7003,-1,0.8343016505241394
ThatYuta,lol the good or bad kind,aug 3 2023  1217 am utc,1.0,0.0,0.0,0.0,0.0,5,0,0.6808,0,0.829282283782959
FabrizioRomano,we been saying that tho lol,aug 3 2023  1238 pm utc,0.0,0.0,0.0,0.0,0.0,3,0,0.4215,0,0.8910171389579773
DebraZeisset,lol  republicans dont have a sense of humour  so nah they werent sarcastic,aug 3 2023  142 pm utc,0.0,0.0,0.0,1.0,0.0,3,0,0.6979,-1,0.9153479337692261
JCMTrismegistus,lol you sound like one of those delusional xrp to da moon 50000 2023 clowns,aug 3 2023  142 pm utc,0.0,0.0,0.0,0.0,0.0,5,0,0.6486,-1,0.895810604095459
von_Bismack,41 out of the 47 ministers appointed by tinubu are career politicians who have been pencilled down for one crime or another  this is the human they told us knows how to pick good brains lol,aug 2 2023  604 pm utc,0.0,0.0,0.0,1.0,0.0,3,0,0.296,-1,0.5071154832839966
eurotec007,saw this pos this morning and had to lol,aug 3 2023  142 pm utc,0.0,0.0,0.0,0.0,0.0,3,0,0.4215,0,0.6161124110221863
Enikanoselu7,see no style you give me wey i no go take never going to stress you mama  buh you see that your inplay i want it back 2 back  lol what other styles were you people thinking,aug 3 2023  142 pm utc,0.0,0.0,0.0,0.0,1.0,2,-1,0.2575,0,0.7720207571983337
yoorkitty,he is so whipped lol,aug 3 2023  139 pm utc,0.0,0.0,0.0,0.0,0.0,3,0,0.4728,0,0.6932123899459839
yaqwin,i cannot wait to be a mom lol its such a beautiful thing from the moment it starts,aug 3 2023  714 am utc,0.5,0.0,0.0,0.0,0.5,6,1,0.7717,1,0.9921268224716187
191Introvert,so why tf im i taking the risk then  if she cant benefit from it lol whats the reason im working day and night omoh make god no put person success for where e hard jare una dy craze,aug 3 2023  142 pm utc,0.1,0.1,0.2,0.4,0.2,4,-1,0.2071,-1,0.8561193346977234
JoelWBerry,so which one is it lol,aug 2 2023  948 pm utc,0.0,0.0,0.0,0.0,0.0,3,0,0.4215,0,0.9335217475891113
StunningRealm,lol sure because what people can see is always correct  not like your side is known for yelling at 9 yo girls just trying to race,aug 3 2023  142 pm utc,0.0,0.25,0.5,0.0,0.25,5,2,0.457,-1,0.8055471777915955
PopBase,lol but we all know in the movement we elect you based on ur faction not credential we dont need to know you we just need to know if you are with us or not,aug 2 2023  220 pm utc,0.0,0.0,0.0,1.0,0.0,3,0,0.2263,0,0.8288877010345459
silvsmith0919,i saw someone claim the racist thing because not enough bipoc are represented in xmen and its like the majority of the fandom arent a fan of that either i would love to see a team that has more than two people who arent white also a lot of the fandom is gay lol,aug 3 2023  142 pm utc,0.4,0.0,0.2,0.2,0.2,8,2,0.5481,0,0.5885010957717896
MailaLazarus,i actually like this job  for now lol,aug 3 2023  142 pm utc,0.0,0.0,0.0,0.0,1.0,5,1,0.6486,1,0.9816073179244995
GayScottSummers,its not a complaint lol go ahead and find me ever saying nerf villagers   like i said i know how good it is and that changing it a bit is needed im saying despite how it is now im not against the change  if you cant tell the difference then i dont know what to say,aug 3 2023  142 pm utc,0.0,0.5,0.0,0.5,0.0,8,1,0.6067,0,0.8870766162872314
young_licia,lol they dont know they are military reservists lowkey send them to warrrrrrrrrrr,aug 3 2023  142 pm utc,0.0,0.0,0.0,0.0,1.0,3,0,0.4215,0,0.5053281784057617
NickTetsujin,yah top left corner is a serious bird watcher and artist now lol good for robbo,aug 3 2023  142 pm utc,0.0,0.5,0.5,0.0,0.0,8,2,0.7351,1,0.9589916467666626
EtuboLion,makes me miss the days when they voted for gore and couldnt fill out a ballot correctly lol,aug 3 2023  130 pm utc,0.25,0.0,0.0,0.5,0.25,1,0,0.296,-1,0.9109970927238464
WeaklingGoblin,oh very much i play on a 40 tv from the comfort of my couch surrounded by cats lol i do have to play with a kbm on a lap table though as our controllers are just impossible now but yes i do love it,aug 3 2023  142 pm utc,0.25,0.0,0.0,0.25,0.5,9,1,0.9401,1,0.9862579107284546
XoSigneddesi,nah all this in front of our families is just too much for me lol,aug 3 2023  142 pm utc,0.0,0.0,1.0,0.0,0.0,3,0,0.34,-1,0.8259766101837158
BigQadi,yes he has lol he aint went to the championship round lol   ill never understand the shade dak gets lol,aug 2 2023  204 pm utc,0.0,0.0,0.0,0.0,0.0,8,0,0.8807,-1,0.6296374201774597
JusKallMeKB2,lol girls in the audience cant believe their eyes,aug 3 2023  142 pm utc,0.0,0.0,1.0,0.0,0.0,3,0,0.4215,0,0.6797379851341248
byhermoss,hes not gonna leave after that lol  emperor trump is coming be ready,aug 3 2023  120 pm utc,0.33,0.0,0.67,0.0,0.0,2,2,0.6649,0,0.6744290590286255
1984ever1,still need to listen to the episode but id assume the formal vote would have to be postapplication  this may be a prevote or a discussion of options  hopefully some leaks lol,aug 3 2023  142 pm utc,0.0,0.0,0.0,1.0,0.0,5,-1,0.8047,0,0.9345760345458984
clonesjer,she is shinning brightest idk when their delalu world gonna end where they think manisharani𓃵 game is going down  ppl playing safe lol  elvishyadav𓃵 manisharani elvisharmy manishasquad elvisha biggbossott2 bbott2 aashikabhatiya biggbossott,aug 3 2023  142 pm utc,0.0,0.0,0.0,0.0,1.0,6,2,0.8779,1,0.9400936365127563
FaizyShaikh33,the song fits them so well   lol also i love your handle,aug 3 2023  124 pm utc,1.0,0.0,0.0,0.0,0.0,6,2,0.8756,1,0.9888673424720764
jetsetjayy,dont give ppl false hope if you cannot keep to your word also enjoy making ppl angry is it lol,aug 3 2023  142 pm utc,0.17,0.33,0.0,0.17,0.33,4,0,0.6808,-1,0.9540425539016724
soppyali,were all these divorces during her porn career shocking lol,aug 3 2023  142 pm utc,0.0,0.0,1.0,0.0,0.0,1,-1,0.0258,-1,0.6231035590171814
bullishbestie,i was invited to two baby showers this morning and theyre both having girls  i love baby showers lol,aug 3 2023  142 pm utc,0.33,0.0,0.33,0.0,0.33,6,1,0.7906,1,0.9930158853530884
Cc_delite,lol how can she be in a position to moderate emotional family discussions she doesnt even know the value of family shes since trashed and denied her own family trashed her own ailing father who loves her and raised her yikes what message is invictus sending,aug 3 2023  142 pm utc,0.11,0.22,0.33,0.22,0.11,1,-3,0.765,-1,0.9661588072776794
chadasianwife,this is so true i have horrible aspects with people around my age and thats what i gravitated towards to the most learned it the hard way lol,aug 2 2023  549 pm utc,0.0,0.67,0.0,0.0,0.33,-1,-2,0.3077,-1,0.5000953674316406
p88tan,now they say that lol,aug 3 2023  142 pm utc,0.0,0.0,0.0,0.0,0.0,3,0,0.4215,0,0.9035818576812744
JoeyMarchant2,lol but do you understand that the credit for the answer is due to justin entirely not the reporter at all thats what the point is here my guy,aug 3 2023  142 pm utc,0.0,0.0,0.5,0.0,0.5,3,0,0.6486,0,0.8681005239486694
ActivatedAlexMn,ive only had make gynecologist nigga you just aint it lol a damn dweeb,aug 3 2023  142 pm utc,0.0,0.0,0.0,1.0,0.0,-1,-1,-0.0191,-1,0.9737744331359863
ButterMamas,apparently she got a lil messy and told a couple ppl about the p5 alliance but then wouldnt say who was in it so it looked sus lol,aug 3 2023  134 pm utc,0.0,0.0,0.0,1.0,0.0,3,-1,0.4497,-1,0.7184644937515259
mmjmom,heres a free one lol,aug 3 2023  142 pm utc,1.0,0.0,0.0,0.0,0.0,4,1,0.7269,1,0.701691746711731
aelynn000,our little walk on we had a better skit planned but then panicked when the few before us were so quick to go on and off the stage lol  but look how good we look part of fanfest history forever  ffxivfanfest ffxivfanfest2023,aug 3 2023  413 am utc,0.0,0.25,0.0,0.0,0.75,5,1,0.6705,1,0.9778889417648315
Bout_this_U,na that aint crab island lol,aug 3 2023  142 pm utc,0.0,0.0,0.0,0.0,0.0,3,0,-0.3252,0,0.9383386969566345
GmerGeek17,one small gift  im not tryna pay it back lol,aug 3 2023  410 am utc,0.0,0.0,0.0,0.0,0.0,4,0,0.7181,0,0.5468842387199402
TamBeesly,trust me theyre targetting keadilan just as much as dap lol although yeah dr kelvin is the ph youth chief,aug 3 2023  142 pm utc,0.0,0.0,0.0,0.0,1.0,5,1,0.8074,0,0.8934406638145447
BENcME,abusive woman feels entitled to deride and ridicule staffers is absolutely shocked when forced to deal with the consequences of her actions lol now im curious do antivaxxers demand doctors take down vaccination posters because they feel threatened i bet they do,aug 2 2023  426 pm utc,0.0,0.0,0.25,0.0,0.75,-6,-4,-0.9092,-1,0.959564745426178
AKV9021,lol this is so funny xd,aug 3 2023  142 pm utc,0.0,0.0,1.0,0.0,0.0,7,-1,0.8915,1,0.9644891619682312
shadowmaat,lol im not sure i think its something to do with the style content or how i connect with the characters like i think i dont like the concept of the office or most of the characters but i remember liking parks and rec at least somewhat cuz of audrey plaza ron swanson,aug 3 2023  142 pm utc,0.0,0.0,0.0,0.0,1.0,7,3,0.7557,0,0.5446420311927795
moneygo_round,some of which  lol,aug 3 2023  142 pm utc,0.0,0.0,0.0,0.0,0.0,3,0,0.4215,0,0.8297263383865356
PhilYanda,things natsume likers do for natsume smh i see cant wait to combine bubbles to the highest level and see how much i can farm with it lol thank you,aug 3 2023  142 pm utc,0.0,0.0,1.0,0.0,0.0,5,1,0.4588,1,0.980274498462677
PerryBNewman,they cost money lol,aug 3 2023  142 pm utc,0.0,0.0,1.0,0.0,0.0,3,0,0.4215,0,0.7540757656097412
Hanasgarden,lol people do stuff like this then well talk about our much vaunted moral values,aug 3 2023  142 pm utc,0.0,1.0,0.0,0.0,0.0,5,2,0.8442,-1,0.5138001441955566
taekwontrone,and itll be thrown out i love it when these people give you hope lolgood luck,aug 3 2023  142 pm utc,0.5,0.0,0.0,0.0,0.5,8,2,0.8779,1,0.6961240172386169
yellowjackie09,obviously according to who you lol,aug 3 2023  142 pm utc,0.0,0.0,0.0,0.0,0.0,3,0,0.4215,0,0.9169464111328125
Scary_Ougi,good morning it really has i worry that if i blink itll be monday again lol may you have a blessed day friend,aug 3 2023  142 pm utc,0.75,0.0,0.0,0.25,0.0,3,0,0.8632,1,0.9331439733505249
SankarBalasu,too hot lol,aug 3 2023  142 pm utc,0.0,0.0,0.0,1.0,0.0,3,1,0.4215,0,0.6064561605453491
Johnnii_Boii,whats the point in answering the phone if you cant talk lol,aug 3 2023  142 pm utc,0.0,0.0,1.0,0.0,0.0,3,0,-0.3252,-1,0.875006377696991
KrystalEyez,well this ones very smart dobbing the dog in so she the cat wont get blamed  thats pretty smart id say so take your scientific opinions and shove it up the dog lol,aug 3 2023  142 pm utc,1.0,0.0,0.0,0.0,0.0,4,4,0.9397,1,0.7716330289840698
trashaccounxt,to be fair yoona brings her snsd brwnd everywhere lol despite of being a brand herself and to be fair taeyeon does too lol,aug 3 2023  142 pm utc,0.0,0.33,0.0,0.67,0.0,10,2,0.8481,0,0.6609538197517395
garfshots,theres a very good reason hes disrespected lol,aug 3 2023  142 pm utc,0.0,0.0,0.0,1.0,0.0,4,1,0.4576,-1,0.9144851565361023
AhaanRungta,didnt you post a question im single because why was i wrong to assume u actually wanted a response or is it a rhetorical post for attention  you call me crazy but posting like you do for millions of strangers just to receive attention is crazy check your privilege lol,aug 2 2023  948 pm utc,0.0,0.0,0.2,0.2,0.6,-1,-2,0.6542,-1,0.7918580770492554
zilla_stan,ok if ya want to sell not a dude swim wear you should not use nad as your logo because nad might just be a little too close to nads just saying lol,aug 3 2023  142 pm utc,1.0,0.0,0.0,0.0,0.0,4,0,0.6486,0,0.5997138023376465
jman_laser,lie because im breaking all them bullshit generational curses lol,aug 3 2023  142 pm utc,0.0,0.0,0.5,0.0,0.5,-1,-4,-0.25,-1,0.9152141809463501
lmTheReasonWhy,my wife said she wanted to do one of those get ready with me videos when we went to go see beyoncé but wanted me in it she got what she asked for lol  renaissanceworldtour beyonce,aug 2 2023  815 pm utc,0.5,0.0,0.0,0.0,0.5,3,1,0.6652,1,0.8732046484947205
ksea43,lol i quit believing in fairy tales when i was 9 so go troll someone else,aug 3 2023  1258 pm utc,0.0,1.0,0.0,0.0,0.0,3,0,0.4215,-1,0.7771469950675964
iownbums,slacker lol ill forgive you today,aug 3 2023  142 pm utc,0.0,0.0,0.0,0.0,0.0,2,0,0.2732,0,0.6530386209487915
brenda_whi15512,i also had a scottish guy who played at aberdeen and quit lol,aug 3 2023  142 pm utc,0.0,0.0,0.0,0.0,1.0,3,0,0.6369,0,0.8938956260681152
ultrafosc,why are you finding me cute so much  should we even create poopy tl gang now lulol,aug 3 2023  142 pm utc,1.0,0.0,0.0,0.0,0.0,2,1,0.6249,1,0.6323042511940002
NiDaFooFooo,all shes doing is showing how awful or stupid a person she is here imagine being so bold in your ls and then coming out with a take like this lol,aug 3 2023  142 pm utc,0.0,0.0,0.67,0.0,0.33,2,-1,0.4051,-1,0.9812410473823547
ExpressThese_,triggered magat is triggered lol at the all caps like your fat orange god   linking a protrump site will never prove your point mouth breather now go lie down before matlock comes on you need to rest up before the dinner buffet at 4pm,aug 3 2023  115 pm utc,0.0,0.0,0.6,0.2,0.2,6,-1,0.7506,-1,0.9454644918441772
DisIsMohd,already in the right order lol,aug 3 2023  142 pm utc,0.0,0.0,0.0,0.0,0.0,3,1,0.4215,1,0.8881463408470154
ThisIsHipHop2,she reminds me of my mom lol,aug 1 2023  1250 pm utc,0.0,0.0,0.0,0.0,0.0,3,0,0.4215,0,0.5903313755989075
sunookitchenrag,this post by its self cost you all the credibility you ever had lol,aug 3 2023  1222 pm utc,0.0,0.0,1.0,0.0,0.0,3,0,0.4215,-1,0.9026528000831604
Sm759413,no one is in your inbox ffs suddenly the liar doesnt like being held to account show us in the text where she is even pregnant lol show us how dirt causes a child to be killed in the womb lol,aug 3 2023  142 pm utc,0.0,0.0,0.5,0.0,0.5,-1,-2,-0.9137,-1,0.9417269825935364
snowviolet,i really didnt drink yesterday like i didnt even take a bottle to the cemetery just so i wouldnt be tempted to drink lol im standing on my word,aug 3 2023  142 pm utc,0.0,0.33,0.0,0.0,0.67,5,1,0.1754,0,0.553437352180481
Drenotdreatl,lol they is but they still gone follow,aug 3 2023  142 pm utc,0.0,0.0,0.0,0.0,0.0,3,0,0.2263,0,0.8246926069259644
Malmatic,dont ever say that again that shit is way too close to vibrator lol,aug 3 2023  142 pm utc,0.5,0.0,0.5,0.0,0.0,-1,-1,-0.2023,-1,0.9419522881507874
_JustaPlayer_,lol love this they just kept coming,aug 3 2023  142 pm utc,0.5,0.0,0.5,0.0,0.0,6,1,0.7906,1,0.9886782765388489
BlackSupremeKai,i hate when ppl sneaky talk about me like you can say it to me and we can argue for days im really into that lol,aug 3 2023  142 pm utc,0.5,0.0,0.0,0.5,0.0,1,-1,-0.3477,-1,0.9250781536102295
briiiiit_3,lol am typing all the day from mobile for the last week,aug 3 2023  142 pm utc,0.5,0.0,0.0,0.0,0.5,3,0,0.4215,0,0.7884095907211304
MaryMartinlond1,good lord lol the money mayor pete is throwing around for dei over at dot is hilarious   will schedule the tweets on randoland_us for tomorrow,aug 3 2023  142 pm utc,1.0,0.0,0.0,0.0,0.0,8,2,0.8126,0,0.5354840755462646
senfine,joke    you clearly dont follow chelsea lol   theres no fanbase thats as toxic as chelsea fan base,aug 3 2023  142 pm utc,0.5,0.0,0.0,0.5,0.0,8,-1,0.3956,-1,0.9728342890739441
wolf_griz,bratz fist collab being with a non black celebrity isnt sitting right in my spirit  just dont seem right lol,aug 3 2023  142 pm utc,0.0,0.5,0.0,0.5,0.0,4,1,-0.1611,-1,0.9492844939231873
courtknee_e,me too honestly lol and im a regular at starbucks,aug 3 2023  141 pm utc,0.0,0.0,0.0,0.0,0.0,3,0,0.7003,1,0.7896320819854736
keyon,that missed by a mile lol,aug 3 2023  427 am utc,0.0,0.0,0.0,1.0,0.0,1,-1,0.1531,0,0.5537919998168945
FresnoFresno99,i think there is something wrong with me bc everybody is like its true exercise does make you feel better and no it does not lol it makes me feel miserable i hate sweating and i get so aggressive after exercising like truly the worst feeling,aug 3 2023  141 pm utc,0.0,0.0,0.0,0.86,0.14,-4,-2,-0.7683,-1,0.974227786064148
Lichterherz,they gotta go somebody gon have to completely eradicate them mfs off the face of the earth bc this is terrifying lol,aug 3 2023  141 pm utc,0.0,0.0,1.0,0.0,0.0,3,0,-0.2263,-1,0.971589207649231
prodbyxodus,thinking about how gary sanchez has a 780 ops and 13 fwar this year which would both be 3rd highest on the yankees lol,aug 3 2023  141 pm utc,0.0,0.0,0.0,0.0,0.0,3,0,0.4215,0,0.6262661218643188
YankeeWRLD,21 goals 62 assist lol that like bruno 3seasons,aug 2 2023  1001 pm utc,0.0,0.0,0.0,0.0,0.0,5,1,0.6486,0,0.49917957186698914
AliceMi79785995,willy mo peña was not showing up when i search for himgot robbed lol,aug 3 2023  141 pm utc,0.0,0.0,0.0,0.0,0.0,3,0,0.4215,-1,0.8610056042671204
ColinWallace13,lmao i dont need actors to be anarchosocialists but i at least hope they are decent people lol,aug 3 2023  141 pm utc,0.0,0.0,0.5,0.0,0.5,9,1,0.875,0,0.4858468770980835
FAWil4,yeah miles is my guy he heard all that stuff so it was of no interest to him as time went on miles was just a different kind of guy lol his last guitar player really a bass learned on the job basically 8791,aug 3 2023  141 pm utc,0.4,0.2,0.0,0.0,0.4,6,0,0.7003,0,0.8839447498321533
iamslickrick_,lol so new heartstopper season came out today but im scared to watch it bc me and the ex bf were gonna watch it together  we had a whole list of films and tv shows to watch that i havent touched since we broke up bc then its actually real,aug 3 2023  141 pm utc,0.0,0.0,0.57,0.43,0.0,0,-2,-0.7684,0,0.6088889837265015
mirrorwaIIs_,id be freaking out lol,aug 3 2023  141 pm utc,0.0,0.0,0.0,0.0,0.0,3,-1,0.0,0,0.5956296324729919
miiniyoongs,lie because im breaking all them bullshit generational curses lol,aug 3 2023  136 pm utc,0.0,0.0,0.5,0.0,0.5,-1,-4,-0.25,-1,0.9152141809463501
JoelWBerry,seriously lol havent seen one highlight where he separates on his own,aug 2 2023  948 pm utc,0.0,0.0,0.0,0.0,1.0,5,0,0.0165,0,0.7900799512863159
JaeMajette,hes so annoyed lol poor baby,aug 1 2023  1134 pm utc,0.0,0.0,0.0,1.0,0.0,-1,-2,-0.4902,-1,0.8893731236457825
JayFive_5,25m package for brightons 3rd choice keeper lol the obsession with brighton  they sold mac allister for 30m by the way paulwinstanley9 u guys are a joke,aug 3 2023  141 pm utc,0.33,0.33,0.0,0.0,0.33,5,0,0.3818,-1,0.770681619644165
KaiCyreus,please please please do this lol,aug 3 2023  141 pm utc,0.0,0.0,0.0,0.0,0.0,6,0,0.8271,1,0.9228472113609314
satti45_,jimmypisstank see its not just canada that has this problem lol,aug 3 2023  141 pm utc,0.0,0.0,0.0,0.0,1.0,1,-1,-0.0836,-1,0.928006112575531
ys_tweetzz,walmart 11000 on sale for 7500 i bought 4 lol,aug 2 2023  1216 pm utc,0.0,0.0,0.0,0.0,0.0,3,0,0.4215,0,0.7332631349563599
Rizzy232,i have to find a outfit for sunday iaint been out in so long i want me and deja to get out our bodies lol,aug 3 2023  141 pm utc,0.0,0.0,0.0,0.0,1.0,4,0,0.5233,0,0.7544910907745361
FringedCanuck,to learn clickteam im gonna be making a fnas remake called  five nights at sonics  south island  heres the designs lol  you can ask questions abt some of the choices but i cant answer some lore bits  sonicthehedgehog,aug 3 2023  141 pm utc,0.0,0.2,0.2,0.2,0.4,3,0,0.2263,0,0.8793063163757324
TonieM_,definitely going lol,aug 3 2023  141 pm utc,0.0,0.0,0.0,0.0,1.0,3,0,0.6705,1,0.8928908705711365
GAMING_INC5,we definitely went back late as hell in august i feel for the new generation lol and they get out later than we did for summer,aug 3 2023  125 am utc,0.33,0.0,0.0,0.33,0.33,-1,-1,-0.0258,0,0.6400247812271118
AllHailDorian,im not of the thought process that it doesnt matter im just saying there are so many other factors that nitpicking it is pointless david ross has way more information than we do yet we get on here and act like hes clueless because of a decision we dont like lol,aug 3 2023  141 pm utc,0.0,0.0,0.25,0.25,0.5,6,-1,0.0243,-1,0.8221725225448608
JBush____,if anyone watching on tv got any decent replay of this hand mvt mentions please do shout lol,aug 3 2023  136 pm utc,0.0,0.0,1.0,0.0,0.0,4,1,0.8338,0,0.8530139327049255
_teejanae,lol dont you enjoy your handouts justin the benevolent is beyond reproach  such a peasant mentality,aug 3 2023  141 pm utc,1.0,0.0,0.0,0.0,0.0,5,1,0.5956,-1,0.840336263179779
TheFitGuyShaq,transitory inflation lol,aug 3 2023  1255 pm utc,0.0,0.0,0.0,0.0,0.0,3,0,0.4215,0,0.9108926653862
ameeruszkai,kinda what i liked about it lol since i never played the game i really dont have a lot to compare it to,aug 3 2023  141 pm utc,0.0,0.0,0.0,0.5,0.5,5,1,0.5082,1,0.5923835039138794
GavinKing9,lol grass isnt always greener,aug 3 2023  141 pm utc,0.0,0.0,0.0,0.0,0.0,3,0,0.4215,0,0.8944416046142578
KanekoaTheGreat,do you know how many times ive almost died lol seriously move,aug 3 2023  432 am utc,0.0,0.0,0.0,0.0,1.0,0,-1,-0.3008,-1,0.8133664131164551
AstroAuntie,lol that time you post the cutest drinks,aug 3 2023  141 pm utc,0.0,0.0,0.0,0.0,0.0,3,0,0.765,1,0.9496708512306213
