username,tweet_text,date,happy,angry,surprise,sad,fear,afinn,bing,sid,bertweet,bertweet_confidence
jubilantsleep,currently dcaing 1k per week for my portfolio and 10 bucks for my daughter lol im excited to learn her interests so we can start coming up with a business plan,aug 3 2023  143 pm utc,0.25,0.0,0.25,0.25,0.25,7,2,0.7351,1,0.9850006103515625
lmTheReasonWhy,i remember lowkey shipping leaf and serena when the xy protags designs came out back in 2013 lmao i even drew fanart of them back in the day lol,aug 2 2023  815 pm utc,0.33,0.0,0.33,0.0,0.33,7,0,0.7717,0,0.6077257394790649
JaeMajette,jesus do u even reflect on what youre saying lol  my position actually aligns with historical trends  accepts the science showing masks dont stop infection surgeons use them to avoid fluid transfer since viral load in contained environments are the issue,aug 1 2023  1134 pm utc,0.0,0.25,0.0,0.25,0.5,3,-2,0.5842,0,0.5897572636604309
DrFamilyDad,lol because were the only one that make stuff  architects electrical engineers material scientists mechanical and civil engineers artists and music composers  hell even chefs and cooks carpenters tailors sculptors and many others  dont be arrogant,aug 3 2023  143 pm utc,0.17,0.17,0.0,0.17,0.5,-3,-2,-0.0444,0,0.7927690744400024
SteelWingRowlet,if this is the version of the story that they think makes them look good imagine what actually happened lol,aug 3 2023  143 pm utc,0.0,0.0,0.5,0.5,0.0,6,1,0.6908,0,0.5282399654388428
TUFF_Movie,lol maybe theyll be in the supplementary list,aug 3 2023  143 pm utc,0.0,0.0,0.0,0.0,0.0,3,0,0.4215,0,0.8931193351745605
bashy_io,lol and your outrage over every breath trump or his supporters take is not a sign of desperation lololol pot meet kettle smfh,aug 3 2023  635 am utc,0.0,0.0,0.67,0.0,0.33,1,-1,0.5967,-1,0.8952381610870361
allenakinkunle,lol mom neither,aug 1 2023  427 pm utc,0.0,0.0,0.0,0.0,0.0,3,0,0.4215,0,0.8210152387619019
PinkWug,lol dude counting after the ko is hilarious,aug 3 2023  108 pm utc,0.5,0.0,0.0,0.0,0.5,5,1,0.6705,1,0.7437226176261902
wilderpatriot,what kinda marriage is this lol,aug 3 2023  143 pm utc,0.0,0.0,0.0,0.0,0.0,3,0,0.5023,-1,0.5432676076889038
FatherOfTears,and that right there is more than enough for me not to come to the south lol f the sun,aug 3 2023  143 pm utc,0.0,0.0,0.0,0.0,0.0,3,2,0.4215,-1,0.520965039730072
Chicago_Daisy,robert  lol i almost said that one  great minds amirite,aug 3 2023  143 pm utc,0.5,0.0,0.5,0.0,0.0,6,1,0.7845,1,0.9288275837898254
ThatGuyDY,dont ask me why but ill be watching this tonight lol,aug 3 2023  143 pm utc,0.0,0.0,1.0,0.0,0.0,1,0,0.0,1,0.9092391729354858
chartitbitches,hormones feel fyxked lol,aug 3 2023  143 pm utc,0.0,0.0,0.0,0.0,0.0,3,0,0.4215,-1,0.6946912407875061
ChannelChyna,whatever theyre  saying she did she did that shit notice how she doesnt mention anything about the religious harassment allegation because weve all seen the video with that jesus freak dance captain lol judgment for the plaintiffs,aug 3 2023  143 pm utc,0.0,0.0,0.33,0.0,0.67,0,-4,-0.802,-1,0.889556348323822
faiygo_,agreed the musical is too good for this art lol,aug 3 2023  452 am utc,0.0,0.0,0.0,0.0,0.0,7,1,0.7783,1,0.9231479167938232
HarlemMC,right i mean dont get me wrong shes a lil sassy girl but the sweetness outweighs it lol,aug 3 2023  1156 am utc,0.0,0.0,1.0,0.0,0.0,1,1,0.8682,1,0.800179123878479
_slpakire,those b teams can be made up of bubble players league of legends has a good system just recently pro player faker was injured for a month and they brought someone from their b team who then gets a shot in the pro scene if players arent performing  they can be replaced,aug 3 2023  143 pm utc,0.0,0.0,0.0,0.5,0.5,1,1,0.0516,0,0.9115285873413086
lumilittlemeow,theres a sex demon that looks like ursula and literally lays and feeds off of sexual energy and perversion and it really reminds me of her lol,aug 3 2023  143 pm utc,0.0,0.0,0.0,0.0,0.0,5,-1,0.6249,-1,0.8220114707946777
CypherxIts,same w tory n meg situationppl had a bias towards meg at the timeit was easy to take tory side bc he entertained ppl on ig during the panny he was more likeable bt the 2 even tho he has a history of being volatile towards everyone lol,aug 3 2023  143 pm utc,0.5,0.0,0.0,0.0,0.5,3,-1,0.8832,0,0.7526713013648987
fifth_wife,about to lol,aug 3 2023  104 am utc,0.0,0.0,0.0,0.0,0.0,3,0,0.4215,0,0.5788141489028931
satoruhatakes,shes annoying lol,aug 3 2023  143 pm utc,0.0,0.0,0.0,1.0,0.0,1,-1,0.0258,-1,0.9569442868232727
KaySmith_93,lol yeah right,aug 3 2023  143 pm utc,0.0,0.0,0.0,0.0,0.0,4,1,0.6124,0,0.5809007883071899
Coachkcrypto,trudeau and his wife just separated lol,aug 3 2023  143 pm utc,0.0,0.0,0.0,0.0,0.0,3,0,0.4215,0,0.5166621208190918
23kylean,username casinr3 ive never really played the game that much but now its starting to seem more appealing somehow lol good luck to the other participants,aug 3 2023  143 pm utc,0.5,0.0,0.0,0.0,0.5,9,3,0.9066,1,0.9854662418365479
xinkuleni_,i like this show even more lol dichashow,aug 3 2023  927 am utc,0.0,0.0,0.0,0.0,0.0,5,1,0.6801,1,0.9920319318771362
msstaceylace,lol i used to have to park my silverado in the visitor parking of my condo and then get my bf to go back it into our spot on the 3rd level of parking he had to back it in because when i had to go to work the following night id not be able to back it out lmao,aug 3 2023  143 pm utc,0.0,0.0,0.0,0.0,1.0,7,1,0.7717,0,0.8861799836158752
AceDawson11,think we got got what you meant lol,aug 3 2023  143 pm utc,0.0,0.0,0.0,0.0,0.0,3,0,0.4215,0,0.6203638911247253
Micah_Romans,what kinda makin the band typa shit is this lol,aug 3 2023  143 pm utc,0.0,0.0,0.5,0.0,0.5,-1,-1,-0.2023,-1,0.9517703652381897
drkamaldds,my life began to change when i realized i was addicted to chaos i thought i thrived through it lol,aug 3 2023  143 pm utc,0.0,0.0,0.0,0.0,1.0,1,-2,-0.2263,-1,0.5890876650810242
selenvacarter,im crying at all the qrts of people going with the experiment and going down the slide lol,aug 3 2023  942 am utc,0.0,0.0,0.0,0.0,0.0,1,0,-0.0772,0,0.58857661485672
KeciMielyn,hidalgo  and yes i cheated and answered twice i couldnt choose lol,aug 3 2023  143 pm utc,0.0,0.0,1.0,0.0,0.0,1,-1,-0.4464,0,0.6155985593795776
kayleeee,im glad the search bar on our phones at least pulls up x when we search up twitter lol,aug 3 2023  143 pm utc,0.5,0.0,0.0,0.5,0.0,6,1,0.7003,1,0.911501944065094
Kman_94,good god please do this this would be the funniest thing to happen in years  you dont have to win shit these days hell you dont even gotta show up and play anymore  give the man his half ass participation trophy lol,aug 3 2023  143 pm utc,0.2,0.0,0.4,0.0,0.4,0,1,-0.171,1,0.3825206756591797
jinmarieee,i hate seeing good looking cops lol,aug 3 2023  143 pm utc,0.0,0.0,0.0,1.0,0.0,3,0,0.25,-1,0.9691465497016907
lindagdetroit,lol i mean seriously thats all before getting gaslit  dismissed,aug 3 2023  143 pm utc,0.0,0.0,0.0,0.0,0.0,3,0,0.2732,-1,0.5672363638877869
MullingsJane,lol 9 will mention africa as the only country in africa,aug 3 2023  143 pm utc,0.0,0.0,0.0,0.0,0.0,3,0,0.4215,0,0.9290982484817505
GOT7isOT7,for those that dont understand why filo ahgasespepis were so upset about pjys fancon not abt jy himself obvsly ill try to mention everything this whole process from december til today has been a lot this is just the gist of it since too many side characters appeared lol,feb 27 2023  433 pm utc,0.0,0.0,0.0,0.5,0.5,-1,-1,-0.5214,0,0.8362217545509338
AlphaThordragon,youre more forgiving than a couple others ive tried it on ill very likely skip a few letters lol,aug 3 2023  143 pm utc,0.0,0.0,0.0,0.0,0.0,2,0,0.4927,0,0.643722414970398
envyofyibo,wangyibo trending in weibo main hs w 王一博让c位好丝滑  people praised yibo smooth attempted in avoid centre position at today roadshow but as usual he failed dapeng  everyone will always put him in centre lol,aug 3 2023  1212 pm utc,0.0,0.0,0.0,1.0,0.0,3,0,-0.0644,0,0.8595184683799744
shimkonqz,the fact gyuvin is known to help write rickys captions and him posting right after gyuvin makes me think they are sitting together rn scrolling on twt reading zeroses comments lol,aug 3 2023  1140 am utc,0.0,0.0,0.0,1.0,0.0,5,1,0.6705,0,0.8914767503738403
KSOOVIBE,ksoo is so competitive most especially if chanyeol is his opponent lol,aug 3 2023  110 pm utc,0.0,0.0,0.0,0.0,0.0,5,0,0.6176,0,0.6230432987213135
TooChillToCool,exactly lol like its too early to be stupid,aug 3 2023  143 pm utc,0.0,0.0,0.0,0.0,0.0,3,0,0.2263,-1,0.9507575631141663
AomAom93342103,i think im one of them lol binance,aug 3 2023  143 pm utc,0.0,0.0,0.0,0.0,0.0,3,0,0.4215,0,0.7214789986610413
JonasGwin,lol my wife does this when im being critical  why are you being mean does a fine job of shutting things down,aug 3 2023  143 pm utc,0.2,0.2,0.2,0.0,0.4,5,0,0.3182,-1,0.6879426836967468
thackerpd,clearly a barcompetition onlol,aug 3 2023  1100 am utc,0.0,0.0,0.0,0.0,0.0,1,1,0.4019,0,0.8165359497070312
gunnysvg,just us in the live chat for discussions with what lunatic leftists call a hate group lol click through to our rumble at rumblecomkyleseraphinlive,aug 3 2023  143 pm utc,0.33,0.0,0.33,0.33,0.0,-3,-2,-0.6249,0,0.5868988633155823
homotron666,sorry i was with evan and forgot to put whatsapp on again lol,aug 3 2023  143 pm utc,0.0,0.33,0.0,0.67,0.0,2,-1,0.3612,0,0.8038608431816101
icanbe24,not really its more like messi going to china lol,aug 3 2023  143 pm utc,0.0,0.0,0.0,0.0,0.0,5,1,0.7056,0,0.856616735458374
Mason020417,im confused now what do yall want from an apology theres not much more she could ever do there lol cant think of anything else she could include,aug 3 2023  143 pm utc,0.0,0.0,0.0,0.5,0.5,1,-1,0.25,-1,0.8343964219093323
LEFTYWINSAGAIN,lol we love it too hahaha,aug 3 2023  143 pm utc,1.0,0.0,0.0,0.0,0.0,9,1,0.891,1,0.9903734922409058
lovelyjaehyuk_,lol the way he got so shy  윤재혁,aug 3 2023  139 pm utc,0.0,0.0,0.0,0.0,0.0,2,0,0.0474,0,0.8533138632774353
honespire,been a while since i did youtube live tomorrow or sunday ill do it ill tell when it decided i dont have any photo to givemy room always messy lately my selca i use it all to be photocard bonusdont have selcalol __ honetrans cix seunghun fromm 38,aug 3 2023  143 pm utc,0.0,0.0,0.0,0.0,1.0,-4,-1,-0.7964,0,0.9019861221313477
MarcusTrollin,crazy cause we tied and won against yall with the receivers youre making fun of lol,aug 3 2023  143 pm utc,0.33,0.0,0.0,0.33,0.33,8,1,0.8126,0,0.6837296485900879
callyowl,bet xisco wished he hadnt walked out on us now lol,aug 3 2023  143 pm utc,0.0,0.0,0.0,0.0,1.0,3,0,0.4215,0,0.7796076536178589
PlankySmith,lol we absolutely do,aug 3 2023  143 pm utc,0.0,0.0,0.0,0.0,1.0,3,0,0.4215,1,0.8529896140098572
jordanbpeterson,usually i hate  lol but just this once lol,aug 3 2023  411 am utc,0.0,0.0,0.0,1.0,0.0,3,-1,0.5023,-1,0.7611842155456543
ConceptualJames,lol   the right of the people peaceably to assemble to petition the congress for a redress of grievances  as americans we do love to paraphrase the bill of rights by omitting key clauses dont we,aug 2 2023  1014 pm utc,0.2,0.0,0.2,0.2,0.4,6,1,0.8176,0,0.7580311894416809
Trianglemancsd,hoppin on ya exs number 1 song is cringe cuz i can only think what what happen in my life if iiii did that goofy shit lol it wouldnt go well,aug 3 2023  137 pm utc,0.0,0.0,0.33,0.0,0.67,-1,-1,-0.3213,-1,0.9543615579605103
charliekirk11,lol i agree greg and also im ready to sweep all of the apes with 1eth,aug 2 2023  441 pm utc,1.0,0.0,0.0,0.0,0.0,4,1,0.7783,1,0.8609052896499634
redix2_,no one will believe you lol expect this to happen to more of your pedo friends,aug 3 2023  143 pm utc,1.0,0.0,0.0,0.0,0.0,2,0,0.5719,-1,0.9291037321090698
rapalert6,i am certain they didnt know what the hell happened lol,aug 2 2023  242 pm utc,0.0,0.0,0.0,0.0,0.0,0,-1,-0.1779,-1,0.7948272228240967
utkus_eth,raya had the highest saves kepa own was  because our defenders are shitty if we had sanchez last season  hes gonna have the same saves percentages lol,aug 3 2023  143 pm utc,0.0,0.0,0.0,0.0,0.0,2,0,-0.128,-1,0.8235961198806763
ac_maestro,lol mrsinha_ why dont you call out ambanis channel news18india for giving space to so called maulana gulam sarwar  ambanis channel has invited him in several debate and he is a good from of prateektv,aug 3 2023  143 pm utc,0.0,0.0,0.0,0.0,1.0,6,1,0.7964,1,0.6932613849639893
dartagnank,tony went on tucker prior to the election said he would produce damning documents the next day but then he lost them in the mail after putting them on a thumb drive lol tucker then dropped the story after recovering the drive and said he didnt want to jump all over a,aug 3 2023  1058 am utc,0.14,0.0,0.29,0.29,0.29,1,-2,-0.0729,-1,0.5252552032470703
getoffmee11,she said a whole punch of nothing lol,aug 3 2023  143 pm utc,0.0,0.0,0.0,0.0,0.0,3,-1,-0.3252,-1,0.5153446197509766
DoctorEthereum,i dont care how many calories you are burning this is not healthy lol,aug 3 2023  143 pm utc,0.0,0.0,0.0,1.0,0.0,7,0,-0.7366,-1,0.959793746471405
MrSinha_,you sound salty lol,aug 3 2023  838 am utc,0.0,0.0,0.0,0.0,0.0,3,0,0.4215,-1,0.7222070097923279
Thetdawg27,i hope ml zahhak and ran get this treatment lol,aug 3 2023  143 pm utc,0.0,0.0,0.0,0.0,1.0,5,0,0.6908,0,0.7765225768089294
Feli_NFN,lol because they want piece of the pie fun fact when you cash out you pay taxes someone please factcheck them also they have themselves siphoned off millions from the taxpayers both are corrupt,aug 3 2023  1018 am utc,0.5,0.0,0.0,0.0,0.5,8,0,0.8074,-1,0.9591842293739319
lilhaima__,pick me up some oreos and whipped cream lol,aug 3 2023  143 pm utc,0.0,0.0,0.0,0.0,0.0,3,0,0.4215,0,0.8056520819664001
Combat_Vet82,same reason god needs 10 of your money lol,aug 3 2023  143 pm utc,0.0,0.0,0.5,0.5,0.0,4,0,0.5994,0,0.8802027106285095
gregorykingjr,she is shinning brightest  idk when their delalu world gonna end where they think manisharani𓃵 s game is going down  ppl playing safe lol  elvishyadav manisharani elvisharmy manishasquad elvisha biggbossott2 bbott2 aashikabhatiya biggbossott,aug 3 2023  143 pm utc,0.0,0.0,0.0,0.0,1.0,6,2,0.8779,1,0.9232733845710754
itsinstagram,lol not going to happen snowflake,aug 3 2023  1230 pm utc,0.0,0.0,0.0,0.0,0.0,3,0,0.4215,-1,0.8668368458747864
RobK_joker,lie because im breaking all them bullshit generational curses lol,aug 3 2023  143 pm utc,0.0,0.0,0.5,0.0,0.5,-1,-4,-0.25,-1,0.9152141809463501
lmTheReasonWhy,lol oh this again  amazing that these people think they have insights into housing policy but are genuinely oblivious to the basic fact that developers are landlords,aug 2 2023  815 pm utc,0.0,0.0,0.25,0.25,0.5,7,0,0.5106,-1,0.8964514136314392
JaeMajette,lol he doesnt even care anymore why would i wait for the uncertainty,aug 1 2023  1134 pm utc,0.0,0.0,0.5,0.0,0.5,5,0,-0.3022,-1,0.9371767044067383
leighbeadon,a fucking piece of paper lol,aug 2 2023  735 pm utc,1.0,0.0,0.0,0.0,0.0,-1,-1,0.4215,-1,0.9756439328193665
Theo_Naidoo,after turning 30 my goal is to be generally fit lol   bike ride in the morning walk in the afternoon cut back on processed sugar occasional trip to the gym  i may never have a six pack but ill be alright,aug 2 2023  724 pm utc,0.5,0.0,0.5,0.0,0.0,1,0,-0.0258,1,0.8717585206031799
marshmaluccc,honestly this lol im more impressed than shocked good for her,aug 3 2023  143 pm utc,0.5,0.0,0.5,0.0,0.0,7,1,0.8601,1,0.9820511341094971
J_M_G_M_,yeah on that song cant even compare them lol,aug 3 2023  143 pm utc,0.0,0.0,0.0,0.0,0.0,4,0,0.6124,0,0.786480188369751
kjohournsony,i guess thats why so many people like her shit let me go work for her ass lol,aug 3 2023  143 pm utc,0.0,0.0,0.67,0.0,0.33,-3,1,-0.3687,-1,0.9641779065132141
heartuyoonjin,come to mine jungkook the tv works here perfectly  im not sure about the wifi tholol,aug 3 2023  143 pm utc,0.0,0.0,0.0,0.0,1.0,3,2,0.5003,1,0.9654073715209961
PratorMiles,case by case thing lol,aug 3 2023  143 pm utc,0.0,0.0,0.0,0.0,0.0,3,0,0.4215,0,0.9183734655380249
jkijay,i have this issue where i wanna add certain details to an illvstration but its shit that will take forever like im hell bent on adding cedar branches but doing that will take longer than drawing svng and im dreading it so im more likely to abandon the whole thing lol,aug 3 2023  143 pm utc,0.0,0.12,0.12,0.38,0.38,-6,-3,-0.9397,-1,0.9512550830841064
RickyB_official,lol why that guy come out and sneak him like that lol,aug 3 2023  143 pm utc,0.0,0.0,0.0,0.0,0.0,8,0,0.7964,0,0.8299358487129211
jogamuito_10,vinis minutes are low because he almost never performs well for brazil lol nice try,aug 3 2023  143 pm utc,0.5,0.0,0.0,0.5,0.0,6,2,0.4496,-1,0.9427843689918518
dandersen9465,this is exactly what trump wants i believe trump needs to be  processed as any other criminal however trump will be the eternal victim  turn that  mug shot into 100 grift money   100 sympathy lol,aug 3 2023  143 pm utc,0.0,0.0,0.67,0.33,0.0,-1,2,-0.0516,-1,0.957380473613739
myebix,more reigen x lmk wukong edits this time theyre 40 cleaner i feel like wukong would get along well w the mp100 cast theyd probably all hate him tho except for mob until he spends more time w them lol  anyway i was thinking gingersnap would b a cute ship name,aug 2 2023  632 pm utc,0.25,0.25,0.0,0.25,0.25,6,3,0.7693,1,0.616896390914917
Jamesonrulez,ive already seen him added in two dynasty leagues lol,aug 3 2023  143 pm utc,0.0,0.0,0.0,1.0,0.0,3,0,0.4215,0,0.8986880779266357
TheeFaMulan,i still have yet to get these karma vocals down but i am lol planning some live performances to record with a few ppl,aug 3 2023  143 pm utc,0.0,0.0,0.0,0.0,0.0,3,0,0.5719,0,0.7475548982620239
ConceptualJames,the fact that hes equating gynecology to getting to your makeup done tells me everything i need to know lol men yes even doctors will feel entitled to womens bodies so casually and then feign ignorance as to why women are uncomfortable with them,aug 2 2023  1014 pm utc,0.0,0.0,0.25,0.25,0.5,1,-3,0.5777,-1,0.9111171960830688
GloriaAlamrew,im glad i wasnt the only one lol its ugly as hell to me,aug 3 2023  100 pm utc,0.5,0.0,0.0,0.5,0.0,-1,-1,-0.4767,-1,0.592954158782959
pandasugarbutt,lol never once did i state you were,aug 3 2023  252 am utc,0.0,0.0,0.0,1.0,0.0,3,0,0.4215,0,0.802513837814331
coffeekap,how you gonna hate reeses lol,aug 3 2023  143 pm utc,0.0,0.0,0.0,1.0,0.0,0,-1,-0.2263,0,0.5391830205917358
_kekati,lol we hear,aug 3 2023  143 pm utc,0.0,0.0,0.0,0.0,0.0,3,0,0.4215,0,0.6387847661972046
unis_queen,slow your role with the comfortably lol  freddy in the original is at his most dark and sinister   this might be the coldest  line in any horror movie,aug 3 2023  143 pm utc,0.2,0.0,0.2,0.4,0.2,3,-2,-0.2415,0,0.7590752840042114
DirkSmi25036562,why lol,aug 3 2023  143 pm utc,0.0,0.0,0.0,0.0,0.0,3,0,0.4215,0,0.8464391231536865
SasTheAss,as long as im not involved lol,aug 3 2023  136 pm utc,0.0,0.0,0.0,0.0,1.0,3,0,-0.3252,0,0.8380435109138489
selenvacarter,where are the xtechs at lol xtechs,aug 3 2023  942 am utc,0.0,0.0,0.0,0.0,0.0,3,0,0.4215,0,0.946144163608551
BernardJReeves,they are just supporting what the coach want  lol,aug 3 2023  143 pm utc,0.0,0.0,0.0,0.0,0.0,5,1,0.7184,0,0.577238917350769
tito_tttttttttt,i hate these corny pandering internet n stfu please lol if a woman is into you all that suckin up wouldnt even matter,aug 3 2023  143 pm utc,0.0,0.0,0.0,0.5,0.5,2,-2,0.0839,-1,0.9647753834724426
OnMahThrone,youre calling me a child ive watched my team win 2 super bowls lol you cant even keep your points straight and now youre moving the goalposts you went from he had no hype to yes he had hype as any first round pick does no people were baffled that he fell that far,aug 3 2023  143 pm utc,0.0,0.25,0.75,0.0,0.0,10,-2,0.8934,-1,0.7626457810401917
SteelersWin109,lol funny story they say the same thing,aug 3 2023  143 pm utc,0.0,0.0,1.0,0.0,0.0,7,-1,0.6908,0,0.8021688461303711
PressX_toDoubt,xixi played lol late at night    looks like the hubby was bragging her skills to deer wifey huh    looks like he played too long    how many penta kill do u think he got ctto  半是蜜糖半是伤 loveissweet 罗云熙 luoyunxi 白鹿 bailu 长月烬明 tilltheendofthemoon,aug 3 2023  143 pm utc,0.0,0.0,0.2,0.2,0.6,4,1,0.7096,0,0.7096436619758606
YunLu_Intl,we have such an unserious fanbase lol,aug 3 2023  1252 pm utc,0.0,0.0,0.0,0.0,0.0,3,0,0.4215,-1,0.8850308060646057
jacob_knight112,jake what are we lol,aug 3 2023  1225 am utc,0.0,0.0,0.0,0.0,0.0,3,0,0.4215,0,0.9129428267478943
mickeydedrinker,soldiers dey leak document cos dem no want be scapegoat for useless war youre here talking about treason  soldiers that you feed 1000 naira per day are refusing to fight but one idiot is somewhere talking about clout on social media  lol,aug 3 2023  143 pm utc,0.25,0.0,0.0,0.5,0.25,-13,-6,-0.8934,-1,0.9248155355453491
Franeb,the effects on the live screen while jennie is dancing a wholeass edit lol cute,aug 2 2023  140 pm utc,0.33,0.0,0.33,0.0,0.33,5,1,0.7003,1,0.8849635720252991
lesyeuxdelalis,lol trying to  uplift,aug 3 2023  1038 am utc,1.0,0.0,0.0,0.0,0.0,3,1,0.4215,1,0.5013968348503113
rockeye56,hi uhm can yall use john on me i wanna experiment with that idk why but i like that name lol,aug 3 2023  143 pm utc,0.0,0.0,0.0,1.0,0.0,5,1,0.775,1,0.8117874264717102
Sub_GMD,what r u on about temper was winning he didnt land a punch lol got absolutely battered,aug 3 2023  143 pm utc,0.0,0.25,0.0,0.25,0.5,7,-2,-0.1857,-1,0.81293123960495
ElliotS84521858,paulbiaoco still tix left if youre interested i got mine a whle ago when they first came out lol i cant believe im fanboying so much over this tbh,aug 3 2023  143 pm utc,1.0,0.0,0.0,0.0,0.0,5,0,0.6705,1,0.9300815463066101
EgoOfMigo,people already annoyed with me n we aint even play yet lol,aug 3 2023  143 pm utc,0.0,0.0,0.0,0.5,0.5,1,-1,-0.211,-1,0.959248960018158
SiXDuce401,maybe if you stopped hating minorities for no reason there wouldnt be a problem  also lol if you think the south would be functional without the north,aug 3 2023  143 pm utc,0.0,0.0,0.0,0.67,0.33,-4,-2,-0.3274,-1,0.8242364525794983
the_nerd_skull,i felt the same way growing up lol,aug 3 2023  353 am utc,0.0,0.0,0.0,1.0,0.0,4,0,0.5423,0,0.6963350176811218
DearUncleBernie,i also learned to stop entertaining shit out of boredom that was a bad habit of my mine lol,aug 3 2023  143 pm utc,0.0,0.0,1.0,0.0,0.0,-3,-2,-0.7096,-1,0.8844467997550964
diced_gold,send that text pour your heart out remove the lol lmao nothing is funny anything wey wan sup make e sup,aug 2 2023  335 pm utc,0.0,0.0,0.2,0.6,0.2,11,-1,0.6479,0,0.718550980091095
trulybobbys,lol the struggle but hes doing his best his so lovely 3,aug 3 2023  544 am utc,1.0,0.0,0.0,0.0,0.0,7,1,0.9286,1,0.9890115261077881
brisin_advocate,lol easy if you dont understand there was a tweet back then about a kenya man beating his sister cause she did a tiktok without hijab  someone did a poll about whether he was in the right the last option was should have done the honours translated as ended her life,aug 3 2023  143 pm utc,0.0,0.0,0.33,0.0,0.67,3,2,0.7096,-1,0.8297754526138306
_PIF64_TY,lol it would be kind of funny lol  shitty but funny lol,aug 3 2023  143 pm utc,0.33,0.0,0.67,0.0,0.0,16,-2,0.856,0,0.5108449459075928
KevinGower16,what a surprise perdomo is dominican and proceeds to run away from confrontation lol,aug 3 2023  143 pm utc,0.0,0.5,0.5,0.0,0.0,3,-1,0.3818,0,0.6852331757545471
OskoElBurro,lol the way he got so shy  윤재혁,aug 3 2023  143 pm utc,0.0,0.0,0.0,0.0,0.0,2,0,0.0474,0,0.8533138632774353
lovelyjaehyuk_,hi wagd   dont know if i will ever have the courage to publish lol,aug 3 2023  139 pm utc,0.0,0.0,0.0,0.0,1.0,5,1,0.7184,0,0.8441985845565796
parafyna,then to ask what did i do lol ok,aug 3 2023  143 pm utc,0.0,0.0,0.0,0.0,0.0,3,0,0.6124,0,0.9447712898254395
jaydine20,lol i get you actually but dont just doubt bro  there are easier ways to make money    you get your 5k back in like 3 days,aug 3 2023  143 pm utc,0.33,0.0,0.0,0.33,0.33,4,1,0.8889,0,0.7258947491645813
_YongDim,the more you have on your resume the more you get paid lol  but im sure the fact that he has a lot more on his resume vs her does have something to do with patriarchy bc shes so talented,aug 3 2023  143 pm utc,0.0,0.0,0.0,1.0,0.0,3,1,0.8936,0,0.6300700902938843
alphakilco,tropical hitlerperfect lol,aug 3 2023  143 pm utc,0.0,0.0,0.0,0.0,0.0,3,0,0.4215,1,0.7871996164321899
Dinkus01,what i looked like in july v what my art looked like in july  this is a wip that i may never finish but its all i did lol lol lol,aug 3 2023  143 pm utc,0.0,0.0,0.0,0.0,0.0,13,2,0.9274,0,0.6406999826431274
CDB113,no lol but black people will say anything to theyre benefit,aug 3 2023  143 pm utc,0.0,0.0,0.0,0.0,1.0,4,1,0.6486,0,0.551582396030426
iHad2GoGetit,theyre back  at least for today lol but make no mistake  these two continue to chose each other be it in front of the camera or behind it,aug 3 2023  122 am utc,0.0,0.0,0.0,1.0,0.0,0,-1,-0.6124,1,0.7525694370269775
AJP22,lol maybe you should go and check it and see the point they are on,aug 3 2023  1253 pm utc,0.0,0.0,1.0,0.0,0.0,3,0,0.4215,0,0.9331425428390503
MsB_pisces,mase and cam at boosie levels when it comes to the demo lol,aug 3 2023  143 pm utc,0.0,0.0,0.0,0.0,0.0,3,0,0.4215,0,0.9055678248405457
ski_824,using our lingo on the next one lol,aug 3 2023  143 pm utc,0.0,0.0,0.0,0.0,0.0,3,0,0.4215,0,0.8147615194320679
haileee_ann,lol i wont fuck you even if youre the last person on earth,aug 3 2023  143 pm utc,0.5,0.0,0.5,0.0,0.0,-1,-1,0.6858,-1,0.9106952548027039
brainplasty,more people than your guy lol,aug 3 2023  143 pm utc,0.0,0.0,0.0,0.0,0.0,3,0,0.4215,0,0.879811704158783
UnpoisonedNoJab,me i wanna draw more of this ooh and that and a lot more of this  also me no no you have too much on your plate right now amber get to work on stuff you currently have on the list   this is basically my brain on a daily basis lol,aug 3 2023  143 pm utc,0.0,0.14,0.14,0.29,0.43,1,2,-0.1531,0,0.8675797581672668
