,0
0,im selling drake its all blur tour tickets   _4x for  scotiabank arena toronto on ca  dm me for more details draketickets drakeand21savage itsallablurtour draketickets drakesongs drakemood drakeconcert concert draketour 21savage
1,data engineer  scotiabank at scarborough canada itjobs techishiring jobsfcomjobdataengineer
2,scotiabank made billions in quarterly profits and was appointed chair to steve clarks ontarios housing affordability task force  finance  organized real estates appetite for profits is insatiable leilanifarha vaughanvoice22 shellycanuck
3,newcomers to canada not driving employment gains  scotiabank msncomencamoneytopstori
4,scotiabank posted rates   bullish    share ur best rates below
5,drake and 21 savage tickets  scotiabank arena  ticketscentercom  this is disgusting this guys fan base cant afford to even see him as rich as he is how does he justify this ticketscentercomtickets
6,need that scotiabank amex
7,in the past month ive debanked scotiabank and ditched my smart phone service  im reading more and paying less fees for bad serviceso i figure ive got that going for me
8,im not ready for scotiabank sos
9,scotiabank arena would loveee to have you oliviarodrigo
10,newcomers to canada not driving employment gains  scotiabank  a greater burden on canadas social programs msncomencamoneytopstori
11,selling of my 2 floor drake tour tickets for oct7scotiabank arena 40 bay street waytoronto onm5j 2x2 section 302 row 6  hmu if interested in them drakeconcert toronto draketoronto
12,scotiabankhelps is there any was to set up card in google pay without downloading the scotiabank app  i dont use the app when i try to use the roll free option the number just rings
13,watch  live life to its fullest with scotiabank jamaicas american express platinum card  visit the website to read more  bitly44ny8qc  follow us facebook facebookcomourtodaynews youtube ourtoday twitter our_today_news instagram ourtoday     otlife
14,newcomers to canada not driving employment gains  scotiabank msncomencamoneytopstori
15,scotiabank if a j ticket is for fast transactions i dont wanna know about the rest
16,they have concerts at the rogers center  literally all the time the weeknd was just there and if its not a stadium tour he will play scotiabank raptorsleafs arena hes 1000 gonna come
17,eurusd could recover to the lowmid111s in the next 12 sessions  scotiabank dlvritst187j
18,checkout shots of the newly narrowed temperance street as part of the new scotiabank north tower at torontos bay adelaide centre only on our utforum here owlyupy350ppnej
19,tc energy trp price target lowered to 5500 at scotiabank themarketsdailycomp77250
20,in the past month ive debanked scotiabank and ditched my smart phone service  im reading more and paying less fees for bad serviceso i figure ive got that going for me
21,need that scotiabank amex
22,newcomers to canada not driving employment gains  scotiabank  a greater burden on canadas social programs msncomencamoneytopstori
23,scotiabank total myth that canadas gdp and employment are being driven by immigration   overwhelming share of job gains have not gone to newcomers   cdnecon cdnpoli bnnbloombergcavideototal
24,i just spend like 30 seconds looking for my twitter app and wondering how i accidentally deleted it also it will never be x it will always be twitter just like the acc will never be scotiabank arena
25,encore was proud to be an event partner for the national wealth conference at the shaw centre in ottawa the event had educational sessions and exciting activities making it an unforgettable experience for 1500 scotiabank wealth advisors for the multiday business conference
26,hello rav for any concerns with your banking please contact scotiabank peru at scotiabankpe or by visiting the following link   nitternetmessages2840292     kind regards
27,newcomers to canada not driving employment gains  scotiabank msncomencamoneytopstori
28,newcomers to canada not driving employment gains  scotiabank  a greater burden on canadas social programs msncomencamoneytopstori
29,newcomers to canada not driving employment gains  scotiabank msncomencamoneytopstori
30,newcomers to canada not driving employment gains  scotiabank msncomencamoneytopstori
31,data engineer  scotiabank at scarborough canada itjobs techishiring jobsfcomjobdataengineer
32,hi edmond thanks for reaching out were sorry to hear youve been having trouble with your scene account please send us a direct message with your full name scene membership card number and a summary of the issue and we will be able to help you out
33,went  to see soundoffreedommovie yesterday at scotiabank theatre on the bustling downtown of toronto yesterday godschildrenarenotforsale reallycaviezel timballard angelstudiosinc
34,itll be scotiabank
35,very clever fishing text all scotiabank cards start with 45360 beware
36,newcomers to canada not driving employment gains  scotiabank  cainvestingcomnewseconom
37,scotiabank and american express unveil platinum card for jamaicans owlyob7y50ppepc
38,so everybody except the banks knew the new notes were coming or i guess boj never gave them enough time to update these atms  i know it will be costly but at least one machine to accept these new notes would be great scotiabank
39,newcomers to canada not driving employment gains  scotiabank  a greater burden on canadas social programs msncomencamoneytopstori
40,newcomers to canada not driving employment gains  scotiabank msncomencamoneytopstori
41,scotiabank  economics publications   latam daily chile bcch cuts benchmark rate no change in unemployment rate  via harksterhq on piqsuitecomsuite iftttn79vxcr
42,credit unions froze accounts as well
43,scotiabank scotiabankjm this is the atm in liguanea at the rubis station
44,opening the new animated teenage mutant ninja turtles mutant mayhemcowritten by seth rogen  evan goldberghas a preview screening monday night  dartmouth regular engagement starts tuesday in 3d  2d  scotiabank dartmouth  sackville
45,good morning jamie thank you for connecting with scotiabank canada  to help connect with our international partners in jamaica please feel free to send them a dm at scotiabankjm for further assistance sc
46,why does it feel like jamaicas banking system is at a standstill scotiabank ncbja  the economy is moving fast yet our money is moving slow what kind of punishment is this why are so many atms dysfunctional and the tellers are at a snails pace 2hrs in the bank for what
47,good to see scotiabank is jumping back into the mortgage market after they went on a not widely known break over the last 89 months   scotias new rates  bundled products make them a top mortgage contender again   welcome back scotia  mortgage realestate canada
48,this past saturday our team had the pleasure of hosting the highly anticipated nua onestop auto show in collaboration with scotiabank and nassaus leading car dealers
49,excited to share  a beautiful new childrens book in our collection  the hockey jersey by jael richardson samepageparlbibliocommonsc  available in braille thanks to nnelsca  scotiabank   nsprovlibrary hockeycanada highlandconnect recreationns accessiblitymatters
50,i guess they dont read but i think it has more to do with other scotiabank arenas already using tm i know in toronto when i saw ed we had to go through ticket monster
51,the fact that we have it here now for our scotiabank arena is pretty sad
52,argx scotiabank initiates coverage on argenx at sectir perform 516 price target
53,scotiabank posted rates   bullish    share ur best rates below
54,with scotiabanks reengagement in the mortgage broker market canadians who use brokers will soon have 4 of the big 6 banks actively competing for their mtgs that could bolster broker market share in 2024offsetting some upward pressure on mtg spreads rates industrywide
55,what happens to a customers account if your fraud dept identifies fraudulent activity and the customer confirms the activity is fraudulent do you secure my account until i get to the branch to confirm my identity or do you continue to let the fraudulent activity to continue
56,hello milton for any concerns with your banking please contact scotiabank peru at scotiabankpe or by visiting the following link nitternetmessages2840292   lc nitternetmessagescompose
57,with scotiabanks reengagement in the mortgage broker market canadians who use brokers will soon have 4 of the big 6 banks actively competing for their mtgs that could bolster broker market share in 2024offsetting some upward pressure on mtg spreads rates industrywide
58,renting a room in canada as a housemate might be the perfect solution for internationalstudents coming here to study check it out india china philippines studyincanada scotiabank prepare4canada rentingincanada sparrow prepareforcanadacomaccommo
59,teller at preston street  scotiabank pedro  carma is real the teller service black guy when entering the bank  he speaks there is musty odours coming from his breath  he looks dusty  he scandling others while his musty scents spreading on others when they enter the bank
60,argenx argx coverage initiated by analysts at scotiabank americanbankingnewscomp2 stocks
61,tech improvements customer initiatives earn scotiabank another award ewnewscomtechimprovements
62,anna hannem of scotiabank speaks with subhash kari evp of infocepts about leveraging ai technologies starting with small use cases and key to organizational innovation  watch here hubslyq01zq18l0 cdomagazine
63,activists in vancouver canada demonstrated outside scotiabank denouncing its sponsorship in elbit systems which makes it an accomplice in the israeli war crimes
64,scotiabank allowed my partner to put our mortgage on hold for 6 months due to lockdown rules without my signature and it has destroyed my finances he lived for free and then let it go back to the bank he works for the feds he knows what he can get away with jordanbpeterson
65,twice at scotiabank arena is a reason to celebrate   inspired by their song moonlight sunrise we gave jypetwice matching necklaces depicting two moon phases the first is the moon phase on their debut date the second features the moon on their scotiabank arena debut
66,scotiabank posted rates   bullish    share ur best rates below
67,usd rebound likely to run out of momentum  scotiabank fxstreetpagelinkus9n dollarindex nfp banks
68,this is what youre investing in scotiabank genocide colonialism jewish supremacy has no place in the 21st century bankers that profited from slavery now hang their heads in shame why do you seek to profit from ethnic cleansing and genocide
69,scotiabank hires rbc exec as group head for global wealth management business  wealth professional  scoopit wealthprofessionalcanewsi
70,usd rebound likely to run out of momentum  scotiabank fxstreetpagelinkus9n dollarindex nfp banks
71,scotiabank suggests that the usdcad pair currently trading at 132151 must either significantly exceed the levels of 13250 or drop below 13150 in order to clearly establish a direction for further progress nehcapcom20230731scotia
72,gbpusd gains through 12865 to put cable on track to retest the 130 area  scotiabank fxstreetpagelinkmzbl gbpusd technical analysis banks
73,check out our latest episode of the startupwomen podcast  featuring chris mcmartin from scotiabank and melissahcpa they share their knowledge on how every business owner can build wealth but needs to be ready to receive it owly88ln50pl1an  presented by scotiabank
74,usdcad needs to either break well through 13250 or 13150 to make clearer directional progress  scotiabank fxstreetpagelink43a6 usdcad banks
75,eurusd could recover to the lowmid111s in the next 12 sessions  scotiabank fxstreetpagelink9f9b eurusd banks
76,activists in vancouver canada demonstrated outside scotiabank denouncing its sponsorship in elbit systems which makes it an accomplice in the israeli war crimes
77,biomarin pharmaceutical bmrn now covered by scotiabank americanbankingnewscomp2 stocks
78,scotiabank begins coverage on biomea fusion bmea americanbankingnewscomp2 stocks
79,in this prefinal part of the series anna hannem vp  data  ai risk at scotiabank shares her visionary take on harnessing ais potential responsibly advocating for starting small and respecting privacy regulations owlyrmxl50pon82 responsibleai ai dataethics
80,according to scotiabank the eurusd at 110312 might see a rebound to around the low or middle 111 range within the next one to two trading sessions nehcapcom20230731accord
81,scotiabank posted rates   bullish    share ur best rates below
82,i know but its generally all the same system in these big cinemas which is why i also said hvac ive seen cineplex scotiabank readings during tiff that crossed the 4000 mark
83,the gbpusd currency pair is currently trading at a rate of 128612 it has made gains that have taken it up to 12865 indicating that it is likely to continue its upward trajectory and reach the 130 level this analysis has been provided by scotiabank nehcapcom20230731thegb
84,gbpusd gains through 12865 to put cable on track to retest the 130 area  scotiabank fxstreetpagelinkmzbl gbpusd technical analysis banks
85,scotiabank lowers teck resources teck price target to c6900 americanbankingnewscomp2 stocks
86,food for thought on immigration from scotiabank scotiabankcomcaenaboute cdnecon canada cdnpoli immigration
87,scotiabank posted rates   bullish    share ur best rates below
88,scotiabank begins coverage on aura biosciences aura americanbankingnewscomp2 stocks
89,in may 2023 rbc scotiabank and tdbank were downgraded by barclays pulling tsx lower by 17 percent such recent past may be the least worrying if the lazy and greedy banking sector does not implement a major overhaul to have better compliance in ethics and technology
90,tech improvements customer initiatives earn scotiabank another award ewnewscomtechimprovements
91,the most important factor in the near future for the usdcad currency pair at a rate of 132442 is expected to be economic data and how it will affect the market according to scotiabank nehcapcom20230731themo
92,usdcad economic data and their impact should be the primary driver in the near term  scotiabank fxstreetpagelinkkw39 usdcad banks
93,scotiabank posted rates   bullish    share ur best rates below
